	sentiment	review
4773	0	Log file information. Log file information is automatically reported each time you make a request to access the App. It can also be provided when the App is installed on your device. When you use our App, analytics tools automatically record certain log file information, including time and date when you start and stop using the App, and how you interact with the App.
4716	0	"COPPA: HOMER Learning adheres to the Children's Online Privacy Protection Act (“COPPA”). COPPA is a law in the United States that regulates the way in which online Websites may collect and use information from children. We do not collect or use information in a manner that is inconsistent with the COPPA. In fact, as stated fully below, no personal information is required from you to visit our Sites. For more information on the COPPA please visit Children's Online Privacy Protection Rule (""COPPA"") or consult this simple one-page informational guide from the kidSAFE Seal Program. "
2473	0	If you have any questions about this Privacy Policy, please contact us:kiary@kiarygames.com
2622	1	Where Adobe Ireland transfers your personal information to the United Kingdom or a country which is not within the EEA and is not subject to an adequacy decision by the EU Commission, we rely on one or more of the following legal mechanisms: EU-U.S. Privacy Shield, Swiss-U.S. Privacy Shield, European Commission approved Standard Contractual Clauses, and your consent in certain circumstances. A copy of the relevant mechanism can be provided for your review upon request, using the contact details provided at the end of this Privacy Policy. For more information about the certification of Adobe U.S. to the EU-U.S. Privacy Shield, including the scope of our certification, please see Privacy Shield/European data transfers.
2246	0	For the purposes of the GDPR, we are the data controller.
1984	0	You can log into your DoubleUGames account at any time if you want to remove it. However, we will no longer be able to provide you with certain products or Services if you do so and your game experience will be impacted. You will also lose all of your achievements by closing down your DoubleUGames account and also lose any items or data stored on your DoubleUGames account and any other contents stored on your DoubleUGames account.
1059	1	"We may transfer and share your information to third parties (including service providers operating on our behalf) which may be located in countries outside the European Union (“EU”) and/or the European Economic Area (“EEA”) which may not have the same level of data protection laws as those in the country where you are located. Where your data is sent to a country outside the EU/EEA that is not subject to an adequacy decision by the EU Commission, the transfers will only occur based on the following safeguards: i) If the entity is certified to comply with the principles for data protection under the US-EU Privacy Shield Framework (""Privacy Shield"") (see Privacy Shield at www.privacyshield.gov), or ii) If we have entered into EU Commission approved standard contractual clauses with the entity, which is deemed to offer sufficient safeguards with respect to the protection of the privacy and fundamental rights and freedoms of individuals."
2928	1	Trials of Heroes may store and/or transfer your personal data to its affiliates and partners in and outside of EU/EEA member states and the United States in accordance with mandatory legislation and this Privacy Policy. Trials of Heroes may disclose your personal data to third parties in connection with a corporate merger, consolidation, restructuring, the sale of substantially all of Trials of Heroes’s stock and/or assets or other corporate change, including, without limitation, during the course of any due diligence process provided, however, that this Privacy Policy shall continue to govern such personal data.
108	0	Complete details on each type of Personal Data collected are provided in the dedicated sections of this privacy policy or by specific explanation texts displayed prior to the Data collection.
749	0	Occasionally, we may change this privacy policy (or other documents in the Adobe Privacy Center) to allow Adobe to use or share your personal information in a different way. If we do, the links to the policy on our websites (which are generally found in the footer of the website) will indicate that the policy has been changed. For new users, the change will become effective upon posting. For existing users, if the change is significant, it will become effective 30 days after posting. We encourage you to periodically review the Adobe Privacy Center for the latest information on our privacy practices.
2902	0	The purposes of the information that is processed automatically are:(1) to operate and update the Software and the Services, and provide you with existing and new functionality and features; (2) to improve and customize the Software and the Services; (3) to maintain, test, monitor and improve the quality and operation of the Software
1479	0	You have the right to request a copy of the personal information we hold about you and to have any inaccuracies corrected.
1414	1	The data that we collect from you may be transferred to, and stored at, a destination outside Hong Kong. It may also be processed by staff operating outside Hong Kong. who work for us, one of our associated companies or a third party engaged by us. By submitting your personal information to us, you agree to such transfer, storing or processing. We will take all steps reasonably necessary to ensure that your personal information is treated securely at all times and in accordance with this Privacy Policy.
17	0	(“Third Party Log In Information”)
4856	0	In the event that we are acquired by or merged with a third-party entity, we reserve the right, in any of these circumstances, to transfer or assign the information we have collected from you as part of such merger, acquisition, sale, or other change of control.
5014	1	Transfers of Personal Data: The Services are hosted and operated in the United States (“U.S.”) through Company and its service providers, and if you do not reside in the U.S., laws in the U.S. may differ from the laws where you reside. By using the Services, you acknowledge that any Personal Data about you, regardless of whether provided by you or obtained from a third party, is being provided to Company in the U.S. and will be hosted on U.S. servers, and you authorize Company to transfer, store and process your information to and in the U.S., and possibly other countries. You hereby consent to the transfer of your data to the U.S. as set forth herein.
4436	1	With respect to the aforementioned circumstances, we will ensure that your personal information is provided with adequate protection in accordance with this Privacy Policy.
1112	1	Transferring upon obtaining your express consent: we will transfer your personal information to another party upon obtaining your express consent.
1626	0	You may request deletion of your account at any time through the Privacy Settings in the Uber app, or via Uber's website (riders and delivery recipients here; drivers and delivery partners here).
391	0	If you are a representative or employee of any Buyer or Seller or a sole trader Buyer or Seller:you will be asked to provide certain contact information that is necessary for the registering for a Platform account on behalf of a Buyer or Seller, including name, address, phone number, email address, job title and department; you will be asked to provide certain identity information, tax registration and/or related information about your business, such as your company name, business type and industry, corporate registration details and information about your business license;if you are a Seller we will also ask you to provide details about the goods and products that you intend to sell via the Platform and details about your sales/transactions on Alibaba.com;if you are a Buyer we will also ask you to provide details or preferences about the goods and products that you may be interested in buying via the Platform and any details or preferences relevant to your purchases;if you are successfully certified by Alibaba.com as a blogger or an influencer, in addition to the information mentioned above, we may also collect your live stream videos, your social media account names and profile photos, and posts or comments made by other users of the Platform; in connection with the facilitation of transactions, purchases and payments over the Platform, you will be asked to provide certain payment information. This might include bank account numbers, billing and delivery information, credit/debit card numbers, expiration dates and security code and tracking information from cheques or money orders to facilitate the sale and purchase as well as the settlement of purchase price of the products or services transacted on or procured through the Platform;we will process any information provided to us in connection with disputes or to support complaints in connection with the Platform or goods and/or services purchased via the Platform. Please note, Buyers and/or Sellers may submit complaints regarding the products and services on the Platform and/or disputes between the Buyers and Sellers to the Platform and under such circumstances, we will process data provided to us by Buyers and/or Sellers that is relevant to the disputes or complaints submitted. This may include health data of end-users (which may include minors as applicable) of products purchased on the Platform to the extent relevant to the disputes or complaints that are being reviewed by the Platform and to the extent that the individual(s) has provided their explicit consent to their data being shared with us for the purposes of handling the complaints and/or settling the disputes
2740	1	In connection with our provision of the Platform and its connected services, we may transfer your personal information to countries outside of the EEA, including to countries that may not provide the same level of data protection as your home country such as the United States and China. We take appropriate steps to ensure that recipients of your personal information are bound to duties of confidentiality and we implement appropriate measures to ensure your personal information will remain protected in accordance with this Privacy Policy, such as standard contractual clauses. A copy of those clauses can be requested from DataProtection@service.alibaba.com.
1690	0	We collect information from you when you or enter information on our site.
5254	1	Your information, including Personal Data, may be transferred to — and maintained on — computers located outside of your state, province, country or other governmental jurisdiction where the data protection laws may differ than those from your jurisdiction.
4463	0	"""Mobirix"" may also invite you to share non-personal information about yourself which may include but is not limited to: (1) your age or date of birth; (2) your gender; (3) information about the hardware you may own; (4) your favorite websites, friend information and fan pages (collectively referred to as ""non-personal information"")."
5273	0	Please note that because a third party site manages the purchases of virtual goods offered by the Service, we do not have access to your credit card details and billing information.
4230	1	Our business may require us to transfer your Personal Data to countries to countries such as the People’s Republic of China or Singapore. We take appropriate steps to ensure that recipients of your Personal Data are bound to duties of confidentiality and security requirements.
5027	1	BetterMe does business globally. We may transfer personal data to countries other than the country in which the data was originally collected in order to provide the Service set forth in the Terms and Conditions of Use and for purposes indicated in this Privacy Policy. If these countries do not have the same data protection laws as the country in which you initially provided the information, we deploy special safeguards.
2139	0	11.2. All correspondence received by us from you (written or electronic inquiries) is classified as restricted-access information and may not be disclosed without your written consent. The personal data and other information about you may not be used without your consent for any purpose other than for response to the inquiry, except as expressly provided by law.
4300	0	As you are aware: withdrawal of consent, or opting out of certain data usage, will in some cases make our services unavailable to you.
2250	0	To personalize our ads
2087	0	Individually identifiable information may identify an individual and may be of a private nature. Ferro Entertainment may collect some of these personal information: user’s personal identifiers, user’s e-mail address, geo-location data. Ferro Entertainment does not collect any personal information from you without your approval, which is acquired through your acceptance of the Privacy Policy. Personal information may also be stored on the users’ device through generally accepted industry technologies used within Ferro Entertainment Apps (cookies, local storage).Purpose of collecting personal information is to improve the user experience and our apps, permit certain ad serving features (frequency capping), supply the users with personalized information and content (customized and interest-based ads), permit certain functionalities available within the apps (in-app purchases), permit the user to use the Game Center Features, the Social Features and the features which are available while using the “Log in with Facebook” feature, and send push notifications to the user’s device after the user has agreed to accept push notifications from Ferro Entertainment. Users can deactivate push notifications by changing the notification settings in accordance with the instructions of the operating system running on the users’ device.
354	1	We share information globally, both internally within the Facebook Companies, and externally with our partners and with those you connect and share with around the world in accordance with this policy. Your information may, for example, be transferred or transmitted to, or stored and processed in the United States or other countries outside of where you live for the purposes as described in this policy. These data transfers are necessary to provide the services set forth in the Facebook Terms and Instagram Terms and to globally operate and provide our Products to you. We utilize standard contract clauses, rely on the European Commission's adequacy decisions about certain countries, as applicable, and obtain your consent for these data transfers to the United States and other countries.
4917	0	NOVA GEIMS, OOO collects some information from you when you: (a) create an account, (b) play our games or use game-related services, (c) make a purchase within our Services, (d) create user-generated content, (e) watch advertisements within our Services, (f) sign up for a newsletter, (g) contact NOVA GEIMS, OOO customer service and take part in technical-support sessions, (h) enter a contest or participate in a challenge held by NOVA GEIMS, OOO, (i) chat with other users of the Services, (j) signal interest in participating in a playtest, (k) share or contribute to our social-media channels and other community websites, or (l) apply to a job.
4102	1	Aeria Canada Studio Inc. will take all steps reasonably necessary to ensure that your data is treated securely and in accordance with this Privacy Policy and no transfer of your Personal Data will take place to an organization or a country unless there are adequate controls in place including the security of your data and other personal information.
2908	1	We will store your information in the European Economic Area. We will do our best to keep this information secure. No information security system is perfect so please remember to be careful.
3861	1	We may transfer your personal information across national borders to other countries in compliance with applicable laws.
3125	0	We use this information in order to manage and administer the Services including providing our Services to you.
10	0	The information you can view, update, and delete may change as the Services change. If you have any questions about viewing or updating information we have on file about you, please contact us at support@aminoapps.com.
4093	0	When we have location information, we use it to tailor our Games and products for you and others, like helping you to check-in and find local events or offers.
3779	1	With the purpose of providing the services, FINDNOW may transfer/assign the personal information to a series of countries and it may process them in those countries, retain/store that, may benefit from the cloud based services. FINDNOW may also subcontract the tasks such as keeping/storing and processing of your information to the subcontractors in countries other than your countr
467	0	2.4 Adherence to law, preventing the fraud and illegal activities
4195	1	We may transfer information that we collect about you to affiliated entities, or to other third parties across borders and from your country or jurisdiction to other countries or jurisdictions around the world. Please note that these countries and jurisdictions may not have the same data protection laws as your own jurisdiction, and you consent to the transfer of information to the U.S. and the use and disclosure of information about you, including personal information, as described in this Policy.
1897	1	It is possible that your personal information may be transferred outside of the EEA by Ad Networks or to Skillz. We recommend that you refer to the privacy policies and/or terms and conditions of these third parties if you are concerned about your data being transferred outside the EEA.
83	1	We will properly store your user information according to relevant laws and regulations of China and countries (regions) where our business is conducted.
2203	0	Notwithstanding the foregoing security measures, please also understand that there are no “perfect security measures” for the internet. We rely on currently available technologies and take appropriate security measures to protect your information.
2039	1	The Site is hosted in the United States. If you visit Chatous from the European Union or other regions of the world with laws governing data collection and use that may differ from laws of the United States, then please understand that you are transferring your Personal Data outside of those jurisdictions to the United States for the uses identified above in accordance with this Privacy Policy. By providing your Personal Data to Chatous you consent to that transfer.
5148	1	In particular, if we transfer personal data originating from the EEA to countries with not adequate level of data protection, we use one of the following legal bases: (i) Standard Contractual Clauses approved by the European Commission (details available here), or (ii) the EU-U.S. Privacy Shield Framework (details available here), or (iii) the European Commission adequacy decisions about certain countries (details available here).
200	0	The Apps may contain links to and from third party Apps of our business partners, advertisers, and social media sites. If you follow a link to any of these apps or websites, please note that these apps or websites have their own privacy policies and that we do not accept any responsibility or liability for their policies. Please check the individual policies before you submit any information to those apps or websites.
1488	1	NOVA GEIMS, OOO is headquartered in Russia, and we may have operations, entities and Services provided throughout the world. We have taken measures to ensure that your personal information is treated securely and lawfully, and that it receives an adequate level of protection in the jurisdictions in which we process it. If you are located in the European Economic Area (“EEA”) or Switzerland, we provide adequate protection for the transfer of personal information to countries outside of the EEA or Switzerland based on the standard contractual clauses authorised by the European Commission or other appropriate safeguards defined in Article 46, EU General Data Protection Regulation 2016/67 (GDPR).
1782	0	The current version of the Policy is available on the Overmobile website on the Internet at http://appru.nebo.mobi/nebo-support/policy-en.html.
705	0	When you interact with our Apps, we collect information that, alone or in combination with other information, could be used to identify you (“Personal Data”).
2234	1	Wuma uses servers hosted in the United States. Please note that we may be transferring your information outside of your region for storage and processing in the United States and around the globe. By using the Services you consent to the transfer of information to countries outside of your country of residence, including the United States, which may have data protection rules that are different from those of your country.
5150	1	Some of our partners are located outside the European Union and/or may store your data outside of the EU. 
2159	1	If you are located in the EEA, we comply with EU data protection law when transferring your Personal Information outside of the EEA, including to the United States where we are headquartered. To protect Personal Information transferred from the EEA or Switzerland to the U.S., we are certified to the EU-U.S. and Swiss-U.S. Privacy Shield frameworks.
214	1	In particular, if we transfer personal data originating from the EEA to countries with not adequate level of data protection, we use one of the following legal bases: (i) Standard Contractual Clauses approved by the European Commission (details available here), or (ii) the EU-U.S. Privacy Shield Framework (details available here), or (iii) the European Commission adequacy decisions about certain countries (details available here).
1426	1	AnchorFree uses servers hosted in the United States. Please note that we may be transferring your information outside of your region for storage and processing in the United States and around the globe. By using the Services you consent to the transfer of information to countries outside of your country of residence, including the United States, which may have data protection rules that are different from those of your country.
3448	0	We may share your personal information with third parties in the following circumstances:4.1.1 for marketing purposes;4.1.2 to other members of the Monster Game of companies, our partners and service providers for the purpose of: managing or administering certain aspects of our Service; for analytics purposes; and to help us develop new services;4.1.3 to protect the rights, property or safety of us or other Service users;4.1.4 where we are obliged, or permitted, to do so by law; or4.1.5 if we (or substantially all of our assets) are acquired by a third party, in which case personal information held by us about our users will be one of the transferred assets.
3681	1	Where you located in the EEA, as required by law, you hereby provide us with your express consent to transfer your data to where may be outside of EEA once you use the Service. You may withdraw your consent at any time.
908	1	"he data that we collect from you may be transferred to, and stored at, a destination outside the European Economic Area (""EEA""). It may also be processed by staff operating outside the EEA who work for us or for one of our suppliers. Such staff maybe engaged in, among other things, the fulfilment of your order, the processing of your payment details and the provision of support services. By submitting your personal data, you agree to this transfer, storing or processing. We will take all steps reasonably necessary to ensure that your data is treated securely and in accordance with this privacy policy."
539	0	• To better understand how users access and use our Applications and Services, both on an aggregated and individualized basis, in order to improve our Applications and Services, analyze player traffic and activity, respond to user desires and preferences, and for other research and analytical purposes.
1163	0	Microsoft offers a wide range of products, including server products used to help operate enterprises worldwide, devices you use in your home, software that students use at school, and services developers use to create and host whatﾡﾯs next. References to Microsoft products in this statement include Microsoft services, websites, apps, software, servers, and devices.
3405	0	This page informs you of our policies regarding the collection, use, and disclosure of personal data when you use our Applicataion and the choices you have associated with that data.
4482	1	Sharing of information sometimes involves cross-border data transfers, including transfers outside of the EEA in accordance with the law. We only transfer Personal Data to entities in third countries that have provided appropriate safeguards to ensure that their level of data protection is in agreement with this privacy policy and applicable law, for example in accordance with the rules and procedures known as the EU-US Privacy Shield, or under contractual provisions which have been deemed by the European Commission to provide sufficient safeguards for personal data.
1142	0	When you connect to the Wuma VPN, we collect your IP address, immediately encrypt it and store it only for the duration of your VPN session. Your IP address is deleted after you disconnect from the VPN. We do not associate your IP address with your online activities and we do not store or log your IP address after you disconnect from the VPN.
