	sentiment	review
2314	0	Location information, which we collect when you turn on your device’s location feature and use our location-based services. This includes your geographical position information collected via GPS or WIFI, your address information contained in the account information you provide to us, and shared information uploaded by you or others showing your current or previous location. You can turn off the location feature to prevent us from collecting your location information.
1602	0	BY USING THE SERVICE, YOU PROMISE US THAT (I) YOU HAVE READ, UNDERSTAND AND AGREE TO THIS PRIVACY POLICY, AND (II) YOU ARE OVER 16 YEARS OF AGE (OR HAVE HAD YOUR PARENT OR GUARDIAN READ AND AGREE TO THIS PRIVACY POLICY FOR YOU). If you do not agree, or are unable to make this promise, you must not use the Service. In such case, you must (a) delete your account using the functionality found in “Settings” in the App, or contact us and request deletion of your data; (b) cancel any subscriptions using the functionality provided by Apple (if you are using iOS) or Google (if you are using Android); and (c) delete the App from your devices.
4693	0	The app does use third party services that may collect information used to identify you.
4431	1	We generally retain your Information as long as reasonably necessary to provide you the Services or to comply with applicable law. However, even after you deactivate your account, we can retain copies of Information about you and any transactions or Services in which you may have participated for a period of time that is consistent with applicable law, applicable statute of limitations or as we believe is reasonably necessary to comply with applicable law, regulation, legal process, or governmental request, to detect or prevent fraud, to collect fees owed, to resolve disputes, to address problems with our Services, to assist with investigations, to enforce our Terms of Use or other applicable agreements or policies, or to take any other actions consistent with applicable law.
1892	1	7.1. We will retain your personal information for as long as required to perform the purposes for which the data was collected depending on the legal basis for which that data was obtained and/or whether additional legal/regulatory obligations mandate that we retain your personal information during the term that is required and/or permissible under applicable/relevant law.
2886	0	"When you use ""ICBC Mobile Banking"" services, the App will collect, in a way set out below, the information provided by you when using such services or generated due to use of such services, so as to render services to you, optimize our services and ensure your account security:When you register ""ICBC Mobile Banking"" services, we will collect your nickname, account picture and mobile phone number, for the purpose of helping you complete registration, protecting your App account security and rendering relevant services. If you do not provide such information, you possibly cannot use our services normally."
1196	0	To enforce our Terms of Service or other legal rights.
3721	1	Duration of retention: six months
4009	0	We want to inform users of this Service that these third parties have access to your Personal Information. The reason is to perform the tasks assigned to them on our behalf. However, they are obligated not to disclose or use the information for any other purpose.
1637	0	To improve the monetisation via in-app purchases
3130	1	● Marketing. We store information used for marketing purposes indefinitely until you unsubscribe. Once you unsubscribe from marketing communications, we add your contact information to our suppression list to ensure we respect your unsubscribe request.
3539	1	When you delete data, we follow an internal deletion policy to make sure that your data is safely and completely removed from our servers or retained only in anonymized form.
3303	0	User content, including text, images and videos you have uploaded to the site
1626	1	You may request deletion of your account at any time through the Privacy Settings in the Uber app, or via Uber's website (riders and delivery recipients here; drivers and delivery partners here).
2756	1	The Data is kept for the time necessary to provide the service requested by the User, or stated by the purposes outlined in this document, and the User can always request that the Data Controller suspend or remove the data.
4627	0	The User is empowered to request one copy of the personal data undergoing processing free of charge. Any additional copies are provided on a reimbursement basis.
415	1	At the time when we no longer need your personal data to provide you with the Services, we will remove them or they will be made anonymous.
1759	0	To be in control of your personal data, you have the following rights:Accessing / reviewing / updating / correcting your personal data. You may review, edit, or change the personal data that you had previously provided in the App in the settings section of the App.
3036	1	Duration of retention: five years
1989	1	Your personal data are processed for as long as necessary for the processing purposes mentioned above. AVCR will de-identify your personal data when these are no longer necessary for the said purposes, unless:a legitimate intrest of AVCR or a third party to archive your personal data in an identifiable form prevails over your intrest to de-identify;a legal measure, mandatory public authority measure or court order prevents such de-identification.
2816	1	Data Retention
3292	0	How Do We Use Your Personal Data?  We process Personal Data to operate, improve, understand and personalize our Services.  For example, we use Personal Data to:Create and manage user profiles
4389	0	In some cases, the site feature you choose may allow a third party to place cookies or local storage devices on your computer. The third party who places cookies on your device is responsible for how they process their data and Topface recommends that you read their privacy policies. Third parties who place cookies on your device when you use Topface include, and we have included a link to their privacy policies:Twitter, https://twitter.com/privacyFacebook, https://en-gb.facebook.com/policy.phpYouTube, http://www.google.co.uk/intl/en/policies/privacy/VK.COM, https://vk.com/privacyOK.RU, https://ok.ru/privacy
248	0	(1) Technical Information. Certain technical information regarding your device, and your use of the Software and the Service, including the type, name and version of operating system: (i) their interactions with the Software and Service, your configuration and settings of the Software and the Service, version of the Software and Service; (ii) Advertising ID (Identifier for Advertisers used in Android, such as Google advertising ID (GAID)); (iii)Country; (iv)Android ID.
2797	1	We will keep your information for as long as you are a player or customer of DoubleUGames. We may keep your information for longer for research or statistical purposes. If we do, we will make sure your information is anonymized and non-traceable to you as a person. We will also keep it for longer if we cannot delete it for legal or regulatory reasons.
3966	0	If you wish to access, correct, update or request deletion of your personal information, you can do so at any time by contacting us in-game or at:
3124	1	LLC “WebmartGroup” stores the personal data relating to the User for 1 (one) year after closing, termination of the Personal account or uninstalling the application. Upon termination of the mentioned term personal data relating to the User are subject to destruction or depersonalization to ensure anonymity of such information via deletion of the personal identifying information.
1224	1	Aeria Canada Studio Inc. will also retain Usage Data for internal analysis purposes. Usage Data is generally retained for a shorter period of time, except when this data is used to strengthen the security or to improve the functionality of our Service, or we are legally obligated to retain this data for longer time periods.
3523	0	Your use of the Services and this Site is conditioned upon your continued full compliance with these Terms. Any use of the Services in violation of these Terms will be treated as an infringement of LINEKONG HOLDINGS LIMITED’s or its Affiliates’ copyrights in and to the Services. We reserve the right to change or modify the Services, or limit the features or services on this Site at any time, with or without notice to you, without liability.
170	1	We will retain your information for as long as your account is active or as needed to provide you services. We will retain and use your information as necessary to comply with our legal obligations, resolve disputes, and enforce our agreements.
5068	0	Information you give us when you register an account. We use your mobile phone number as your account identifier, and you will need to provide it to create an imo account. You also have the option of providing your first and last name, and a username in your profile;
5158	0	protect against cheating, crime or fraud, or for other security reasons
3950	0	Consultants, lawyers, accountants and other professional service providers.
4404	1	Records relating to contracts, cancellation of service, etc.
1344	1	Your Personal Data collected through our Get in Touch forms will be deleted after 2 years from the date of receipt. Once we have deleted your Personal Data, you will not be able to exercise the right to access, the right to erasure, the right to rectification or the right to data portability.
3551	1	We will keep your Personal Data for as long as reasonably necessary for the purposes described in this Privacy Policy, while we have a legitimate business need to do so, or as required by law (e.g. for tax, legal, accounting or other purposes), whichever is the longer.
4770	0	Facebook ads preferences
976	1	When information is no longer needed, we shall delete it using reasonable measures to protect the information from unauthorized access or use.
3313	0	Specifically, our servers are located in Canada and the USA, and our third party service providers and partners operate around the world. This means that when we collect your personal information we may process it in any of these countries.
3414	1	In exceptional cases, longer storage periods may result from applicable law, e.g. tax regulations or other legal requirements imposed on us, and obligations.
1359	0	Information We Collect Automatically
3190	0	To research and analyze your use of the Service
3690	1	● Web Behavior Data. We retain any information collected via cookies, clear gifts, flash cookies, web page counters and other technical or analytic tools in our system for a certain date and time from expiry of the cookie or the date of collection.
1438	1	We take measures to delete your Personal Information or keep it in a form that does not allow you to be identified when this information is no longer necessary for the purposes for which we process it, unless we are required by law to keep this information for a longer period. When determining the retention period, we take into account various criteria, such as the type of products and services requested by or provided to you, the nature and length of our relationship with you, possible re-enrollment with our products or services, the impact on the services we provide to you if we delete some information from or about you, mandatory retention periods provided by law and the statute of limitations.
617	1	Data Retention Policy, Managing Your Information
5339	0	If you do not accept the changes introduced to the Privacy Policy, regardless of sending an e-mail to us, it will be incumbent upon us to ask you to immediately cease using our Services. We are asking for your understanding and please bear in mind that such resources are needed for the proper functioning of our Services, and that each User is subject to the same rules.
4263	1	Records relating to processing of consumer complaints and dispute resolution
567	0	protect the rights, property, and safety of us, our users, or others.
1867	0	How We May Disclose Your Information to Third Parties
3905	1	In some cases, rather than provide a way to delete data, we store it for a predetermined period of time. For each type of data, we set retention time frames based on the reason for its collection. For example, to ensure that our services display properly on many different types of devices, we may retain browser width and height for up to 12 months.
5468	0	You consent to us using your information in a certain way.
930	1	Irrespective of the above, Lima Sky may still retain some of the data to the extent such retention is necessary to resolve disputes, enforce Lima Sky user agreements, and comply with technical and legal requirements and constraints related to the security, integrity, and operation of Services.
5300	1	Data Retention: We will retain yours or your child’s information (including geo-location data) for as long as your account is active or as needed to provide services. If you wish to cancel your account or request that we no longer use your information to provide you services contact us at cs.cxzh.ltd@gmail.com. We will retain and use your information as necessary to comply with our legal obligations, resolve disputes, and enforce our agreements.
5420	1	Duration of retention: three years
1081	0	"The fact that the Service links to a website or presents a banner ad or other type of advertisement does not mean that ""Mobirix"" endorses or authorizes that third party, nor is it a representation of our affiliation with that third party."
5441	0	As we develop our business, we may buy or sell assets or business offerings. Customers’ information is generally one of the transferred business assets in these types of transactions. We may also share such information with any affiliated entity (e.g. parent company or subsidiary) and may transfer such information in the course of a corporate transaction, such as the sale of our business, a divestiture, merger, consolidation, or asset sale, or in the unlikely event of bankruptcy.
2347	1	Grounds for retention: Protection of Communication Secrets Act
1736	1	Grounds for preservation: E-Commerce Act
2211	1	We will however delete all Personal Information that is no longer necessary after a reasonable period.We will also delete Personal Information upon request.
5092	0	We automatically collect certain non-Personal Information from Users.
3613	0	Websites may require your information when you are browsing. For example when you visit online map or search engine, it may requests your location information. When you are trying to upload attachment to your mailbox, it may request to read your files. Your phone may pop-up as UC Browser requests your permission, but the information was NEVER received by UCWeb but sent to the website you visited directly.
4892	0	The Service allows you to share text messages, photos, screenshots, videos and other communications in the Service with other users, and if you choose to do so. In addition, if you choose to share these items with other Service users, we may not be able to remove them from our servers or make them unavailable to anyone you have shared them with. Sending and sharing text messages, photos, screenshots, videos or other communications in the Service is your decision. By choosing to share that information, you should understand that you may no longer be able to control how that information is used and that it may become publicly available (depending in part on your actions or the actions of others with whom you have shared the information). The Service is not responsible for any use or misuse of information you share.
1983	0	When you play one of our games, DianDian collects and stores certain personal information and non-personal information that you provide directly or through third party sources that is offering our game(s); In addition, your web browser or client software may transmit certain geographic information or information regarding your computer (capabilities, game data processing, etc.) to DianDian. Certain information regarding your game play, such as a timestamp of your last game played and your game progressions, will be collected from you and/or automatically generated based upon your use of our game services.
2119	1	Grounds for retention: E-Commerce Act
1878	1	What about the storage of payment details? The processing and storage of payment details is a matter for the relevant platform and the applicable payment method/processor. Nordeus will not receive, process or store any of your payment details. This is because the payment transactions themselves are completed through the relevant platforms (e.g. Apple’s App Store or Google Play) via the user account you have associated with that platform account. If you make in-game purchases within the Nordeus Services, we are notified by the payment processor once a transaction takes place, but we will not receive any of your actual payment details.
2902	0	The purposes of the information that is processed automatically are:(1) to operate and update the Software and the Services, and provide you with existing and new functionality and features; (2) to improve and customize the Software and the Services; (3) to maintain, test, monitor and improve the quality and operation of the Software
3287	1	If you do not use your account for 24 months, your profile and any data will be deleted. When you request the removal of your profile via an application or website, it immediately becomes unavailable and completely deleted within 30 days.
2376	1	Information we collect may be stored or processed on computers located in any country where we do business.
2572	0	Subject to limitations in applicable law, you are entitled to object to or request the restriction of processing of your Personal Data, and to request access to, rectification, erasure and portability of your own Personal Data.
