	sentiment	review
4845	0	You may have the option to disable cookies by changing the options in your browser to stop accepting cookies or to prompt you before accepting a cookie from the pages you visit.
1103	1	"Consequently, the transfers will only occur based on the following safeguards:If the entity is certified to comply with the principles for data protection under the US-EU Privacy Shield Framework (""Privacy Shield"") (you can view the entities certified under Privacy Shield at https://www.privacyshield.gov/), or"
3044	0	It is also possible for you to opt-out from third parties tracking systems, for example via Adjust Opt-Out Tracking on www.adjust.com/opt-out.
5050	1	Where will your information be stored? The information we hold will primarily be stored and processed in the EU, but there may be circumstances where we need to work with trusted third parties outside of the EU in order to provide the Nordeus Services to you (e.g. where we run games servers in the US). By submitting your personal information, you explicitly agree to such transfer, storing or processing of data outside the EU. We will take all steps reasonably necessary to ensure that this information is treated securely and in accordance with this Privacy Policy.
4847	1	Your personal information may be transferred to, and stored at, a destination outside of your country or jurisdiction, including but not limited to our data center in Korea. It may also be processed by personnel of our affiliates and third-party service provider who may operate outside of your country or jurisdiction. In such case, we will take reasonable steps to require such third party in possession of your personal information to take commercially reasonable security measures to protect the information. On the other hand, the data and privacy protection laws of other countries may not be as comprehensive as those laws in your country of residence.  By using our Services, you consent to your personal information being transferred to recipients in other countries and being stored and processed in the servers located in other countries. 
2310	1	We work in the international space and provide the Software to our users around the world. We and third-party organizations that provide automatic data processing technologies for the Software or our third-party advertising partners may transfer the automatically processed information across borders and from your country or jurisdiction to other countries or jurisdictions around the world.
2960	1	Our business may require us to transfer your Personal Data to countries to countries such as the People’s Republic of China or Singapore. We take appropriate steps to ensure that recipients of your Personal Data are bound to duties of confidentiality and security requirements.
1806	1	Please be aware that your personal information may be transferred to, stored in, and processed in Canada. The data protection and other laws of Canada have been recognised by the European Commission as providing an adequate level of protection for processing personal data. Please be aware that Ubisoft may duplicate your information within Ubisoft’s own databases for technical purposes or for the uses described in this Privacy Policy.
4590	0	To enforce our Terms of Service;
2315	1	Information of our users are stored in our data center in Canada, provided by Softlayer a company registered and operating in the USA, who acts as a data processor. For more information about this company or the privacy policy it applies, please follow the link: www.softlayer.com.
5177	0	According to relevant laws, regulations and national standards, in the following circumstances, we may collect and use your related user information without your authorization or approval:Information directly relating to national security and defense and other national interests; information directly relating to public security, public health, public right to know and other major public interests; Information directly relating to crime detection, prosecution, judgment and execution of judgment;For the purpose of safeguarding your or other persons' life, property, reputation and other major legitimate rights and interests, for which personal consent is hard to obtain;The user information collected is made public by you;The user information collected from the information disclosed to the public according to law, including legal news report, government information and other channels;Information necessary for signing and executing a contract according to your requirements;Information necessary for maintaining the safe and stable operation of products or services provided, e.g. finding and handling product or service failure;(8) Other circumstances as stipulated by laws and regulations.
5323	1	Unfortunately, the transmission of information via the internet is not completely secure. Although we will do our best to protect your personal data, we cannot guarantee the security of your data transmitted to our site; any transmission is at your own risk. Once we have received your information, we will use strict procedures and security features to try to prevent unauthorised access.
4726	0	Cookies are files with small amount of data which may include an anonymous unique identifier. Cookies are sent to your browser from a website and stored on your device. Tracking technologies also used are beacons, tags, and scripts to collect and track information and to improve and analyze our Service.
5296	1	Our business may require us to transfer your Personal Data to countries outside of the European Economic Area (“EEA”), including to countries such as the People’s Republic of China or Singapore. We take appropriate steps to ensure that recipients of your Personal Data are bound to duties of confidentiality and we implement measures such as standard contractual clauses. A copy of those clauses can be obtained by contacting our Help Center.
4237	1	The Software and Service work over the Internet. We may store and process your information in various locations throughout the world. Where you located in the EEA, as required by law, you hereby provide us with your express consent to transfer your data to where may be outside of EEA once you use the Software and/or Service. You may withdraw your consent at any time.
1789	1	5.3 As an international company, CXZH.LTD provides company information to our local branch offices all over the world to further aid in providing products and services. It is possible that the personal information you submit to us may be transmitted to these other CXZH.LTD branch offices. For example, the personal information provided by a European customer at the time of product registration may be transmitted to a server in the USA and then transmitted to one or more servers of our branch offices in Europe. Meanwhile, in some countries or regions, our subcontractors may handle your information in the process of helping CXZH.LTD provide products and services to you and/or in handling information collection, transmission, storage and processing for us.
4956	0	We may collect information about you from other sources, including from partners, and from commercially available sources (such as data aggregators and public databases). The following are examples of information we may collect from other sources:Data you authorize us to access through your use of Facebook Connect. In general, the types and amount of Personal Data we collect vary depending on the activity. Chatous endeavors to limit the collection of Personal Data to information we believe is minimally necessary to achieve our stated collection purposes.
4258	0	The content of the contract concluded between Mimo and you follows these terms and conditions as well as any additional information provided during the processes of registering and entering into a subscription or trial.
4329	1	If you are located outside Canada and choose to provide information to us, please note that we transfer the data, including Personal Data, to Canada and process it there.
4699	0	We do not rent or sell your Personal Information in personally identifiable form to anyone. We may share your Personal Information with third parties as described in this section:Information that’s been de-identified.  We may de-identify your Personal Information so that you are not identified as an individual, and provide that information to our partners. We may also provide aggregate usage information to our partners (or allow partners to collect that information from you), who may use such information to understand how often and in what ways people use our Services, so that they, too, can provide you with an optimal online experience. However, we never disclose aggregate usage or de-identified information to a partner (or allow a partner to collect such information) in a manner that would identify you as an individual person.
2889	0	Depending on your choice of registration, we process the following Data:
5343	0	to provide non-child users that have given us consent to share their advertising IDs with our ad network partners (as further specified under Sharing of Information) for the purpose of serving them with personalized advertisement in the App (behavioral advertising).
4619	1	We operate globally, thus we may for the purposes described in this Privacy Policy transfer your information to our affiliated entities and/or to other third party service providers across boarder and from your country or jurisdiction to other countries or jurisdictions around the world. Please note, that these countries and jurisdictions may not have the same data protection laws as your own jurisdiction, but wherever your personal information is transferred, stored or processed by us, we will take reasonable steps to safeguard the privacy of your personal information.
5336	1	We only transfer personal data to entities in third countries that have provided appropriate safeguards to ensure that their level of data protection is in agreement with this privacy policy and applicable law.
681	0	Please be aware, however, that no method of transmitting information over the Internet or storing information is completely secure. Accordingly, we cannot guarantee the absolute security of any information.
3033	0	To help keep our databases current and to provide you the most relevant content and experiences, we may combine information provided by you with information from third party sources, in accordance with applicable law. For example, the size, industry, and other information about the company you work for (where you have provided company name) will be obtained from sources including, professional networking sites and information service providers. 
2485	0	1.Information you give us
3595	1	Your information collected through the App may be stored and processed or any other country in which Filmigo or its subsidiaries, affiliates or service providers maintain facilities. If you are located in the European Union or other regions with laws governing data collection and use that may differ from law of the company's location, please note that we may transfer information, including personal information, to a country and jurisdiction that does not have the same data protection laws as your jurisdiction, and you consent to the transfer of information to any other country in which Company or its parent, subsidiaries, affiliates or service providers maintain facilities and the use and disclosure of information about you as described in this Privacy Policy.
3259	1	We may transfer information that we collect about you to affiliated entities or to other third parties across borders and from your country or jurisdiction to other countries or jurisdictions around the world. Please note that these countries and jurisdictions may not have the same data protection laws as your own jurisdiction, and we take steps to ensure adequate safeguards are in place to enable transfer of information to the Russian federation and the use and disclosure of information about you, including personal information, as described in this Policy.
80	0	The security of your Personal Information is important to us, and we strive to implement and maintain reasonable, commercially acceptable security procedures and practices appropriate to the nature of the information we store, in order to protect it from unauthorized access, destruction, use, modification, or disclosure.
2642	0	Adobe has its own pages on many social networking sites (for example, the Adobe® Photoshop® team’s Facebook page). We will collect information which you have made publicly available on your social networking account, such as name and interests in our products and services, when you interact with our social networking pages.
5277	1	In particular, if we transfer personal data originating from the EEA to countries with not adequate level of data protection, we use one of the following legal bases: (i) Standard Contractual Clauses approved by the European Commission (details available here), or (ii) the EU-U.S. Privacy Shield Framework (details available here), or (iii) the European Commission adequacy decisions about certain countries (details available here).
285	1	6.2. The countries to which we transfer your data may not have the same data protection laws as your jurisdiction. We take reasonable cyber security measures and/or put in place the Standartd Contractual Clauses (e.g. Model Clauses, Data Processing Agreement/Addendum) to ensure your data is adequately protected.
4207	0	o risk control service providers to assess the security of users’ accounts and transaction risks; and
1224	0	Aeria Canada Studio Inc. will also retain Usage Data for internal analysis purposes. Usage Data is generally retained for a shorter period of time, except when this data is used to strengthen the security or to improve the functionality of our Service, or we are legally obligated to retain this data for longer time periods.
1836	1	We ensure that:the personal data is transferred to countries recognised as offering an equivalent level of protection or, 
2487	0	Photos, videos, and posts shared via our Stories feature will be shared with your contacts on imo for up to 24 hours. If you share with “friends of friends”, your posts will be shared with “friends of friends” and possibly others depending on reshares and likes.
212	1	We and third-party organizations that provide automatic data processing technologies for the App or our third-party advertising partners may transfer the automatically processed information across borders and from your country or jurisdiction to other countries or jurisdictions around the world.
3611	1	We may transfer information that we collect about you to affiliated entities, or other third parties across borders and from your country or jurisdiction to other countries or jurisdictions around the world. Please note that these countries and jurisdictions may not have the same data protection laws as your own jurisdiction, and we take steps to ensure adequate safeguards are in place to enable transfer of information to the U.S. and elsewhere and the use and disclosure of information about you, including personal information, as described in this Policy.
2215	1	AVCR sends your data to the USA if and to the extent necessary for the provision of our services. The security of your personal data is regulated under the EU-US Privacy Shield (https://www.privacyshield.gov) for the recipients certified thereunder.
313	1	To run our service weﾡﾯll have to use computers all over the world. This means your information might be transferred to the US, Australia, Europe and anywhere else the service is operated.
4111	1	imo is a U.S. company and stores data in the United States. This data is subject to U.S. laws. Thus, your information may be transferred to — and maintained on — computers located outside of your state, province, country, or other governmental jurisdiction where the privacy laws may not be as protective as those in your jurisdiction. If you are located outside the United States and choose to provide information to us, imo transfers that information to the United States and processes it there. By using the Service, you understand and consent that your information may be transferred to our facilities and those third parties with whom we share it as described in this Privacy Policy. If you are from the European Union or other regions with laws governing data collection and use, please note that you are agreeing to the transfer of your information to United States and to Processing of your data globally. By providing your personal information, you consent to any transfer and Processing in accordance with this Policy.
441	1	BetterMe does business globally. We may transfer personal data to countries other than the country in which the data was originally collected in order to provide the Service set forth in the Terms and Conditions of Use and for purposes indicated in this Privacy Policy. If these countries do not have the same data protection laws as the country in which you initially provided the information, we deploy special safeguards.
2513	0	If you do not agree with all of the terms of this Privacy Policy, please do not use our service. Community safety is our number one priority and some of the above user information are mandatory in order to create a safe community for all users.
119	0	This Privacy Policy explains what personal data is collected when you use the BetterMen: Exercises Trainer mobile application (the “App”) and the services provided through it (together with the App, the “Service”), how such personal data will be used, shared.
3511	1	Your personal information may be transferred to, and processed in, countries other than the country in which you are resident. These countries may have data protection laws that are different to the laws of your country.
537	0	Trip.com collects and uses the information you provide to us directly in order to provide you with the services you request. For example, you may provide us your name, gender, birthday, mobile number, email, and other information when you register a Trip.com account. When booking flight or train tickets, or using our car rental service, you may provide passenger names, genders, ID document numbers and the contact person’s name, mobile number, email and delivery address, as well as other information. When booking hotels and tickets for tourist attractions, you may provide the travelers’ names, contact person’s name, mobile number, and email, etc. When paying for travel products, you may provide your bank card number, the mobile number previously provided to the bank, or your credit card number, cardholder name, expiry date, etc.
1581	1	Headway does business globally. We may transfer personal data to countries other than the country in which the data was originally collected in order to provide the Service set forth in the Terms and Conditions of Use and for purposes indicated in this Privacy Policy. If these countries do not have the same data protection laws as the country in which you initially provided the information, we deploy special safeguards.
5062	0	If you have any questions, comments or concerns regarding our Privacy Policy and/or practices, please contact us at support@greenpandagames.com. All other inquiries should be directed to our support page.
4969	1	If you are located in the European Union or other regions with laws governing data processing that may differ from U.S. law, please note that we may transfer information, including personal information, to a country and jurisdiction that does not have the same data protection laws as in your jurisdiction.
3260	0	The Data is processed at the Data Controller's operating offices and in any other places where the parties involved with the processing are located. For further information, please contact the Data Controller.
4021	1	International transfers of personal information
553	1	For users in Argentina: The Public Information Access agency, in its role of Regulating Body of Law 25.326, is responsible to receive complaints and reports presented by any data subjects who believes their rights have been impacted by a violation to the local data protection regulation.
1086	0	We do not use Malware Scanning.
2004	1	All information you provide to us is stored on our secure servers. Any payment transactions will be encrypted using SSL technology. Where we have given you (or where you have chosen) a password which enables you to access certain parts of our site or services, you are responsible for keeping this password confidential. We ask you not to share a password with anyone.
2172	0	The main reason we use your information is to deliver and improve the Service. Read on for a more detailed explanation of the various reasons we use your information:to operate and update the Software and the Service, and provide you with existing and new functionality and features;to improve and customize the Software and the Service;to maintain, test, monitor and improve the quality and operation of the Software;to notify you of the Software and the Service updates;to provide you with support and handle your complaints and/or feedback;to take any action in case of a dispute involving you in connection with the Software and the Service;to comply and satisfy any applicable law regulation, legal process or enforceable governmental request.
1883	1	Our business may require us to transfer your Personal Data to countries outside of the European Economic Area (“EEA”), including to countries that may not provide the same level of data protection as your home country such as the United States and China. We take appropriate steps to ensure that recipients of your Personal Data are bound to duties of confidentiality and we implement appropriate measures to ensure your Personal Data will remain protected in accordance with this Privacy Policy, such as standard contractual clauses. A copy of those clauses can be obtained by contacting DataProtection.AE@aliexpress.com (for AliExpress.com users) or DataProtection@service.alibaba.com (for Alibaba.com users).
2467	0	In cases where FINDNOW Apps are obtained from the App Store, we will only use the Permitted Contact Information so as to gather our Services more closely to You and your engagement with the FINDNOW community. In addition to the Contact Information/details, if you choose to activate the use of third party services such as social networking services, FINDNOW may collect, store and use a list of identifying information related to other services linked to the Contact Information to improve the results shared with other Users.
3307	0	AVCR Bilgi Teknolojileri A.S acts as data controller for the collection and processing of your personal data. In case of in app purchases AVCR acts together with the payment service provider, each for its own responsibilities. For example: the payment service provider, and not AVCR, is responsible for the processing of your data for the financial transaction and for invoicing your in-app purchases to you.
1373	0	When you use a mobile device like a tablet or phone to access our Service, we may access, collect, monitor, store on your device, and/or remotely store one or more device identifiers.
3056	0	Uber may also use the information to inform you about elections, ballots, referenda and other political and policy processes that relate to our services.
1962	0	You may contact us at any time for details regarding this Privacy Policy and its previous versions. For any questions concerning your account or your personal data please contact us at support@betterme.tips.
2707	0	For purposes of this Privacy Policy, «Non-Personal Information» means information that does not directly identify you. Codigames may use tools or third party analytical software to automatically collect and use certain Non-Personal Information that does not directly enable Codigames to identify you. The types of Non-Personal Information Codigames may collect and use include, but are not limited to: (i) device properties, including, but not limited to IP address, unique device identifier or other persistent or non-persistent device identifier («Device ID»); (ii) device software platform and firmware; (iii) mobile phone carrier; (iv) geographical data such as zip code, area code and approximate location; (v) game progress, time used playing, score and achievements; (vi) other Non-Personal Information as reasonably required by Codigames to enhance the Services and other Codigames products and services.
746	1	he countries to which we transfer your data may not have the same data protection laws as your jurisdiction. We take reasonable cyber security measures and/or put in place the Standartd Contractual Clauses (e.g. Model Clauses, Data Processing Agreement/Addendum) to ensure your data is adequately protected
3717	1	We may transfer your information if we are involved, whether in whole or in part, in a merger, sale, acquisition, divestiture, restructuring, reorganization, dissolution, bankruptcy or other change of ownership or control.
2726	0	In principle, we will not charge you for reasonable requests, but for repeated requests that exceed a reasonable level, we will charge you for certain costs as the case may be. We may reject requests that are repeated without just cause, require excessive technical means (such as requiring the development of a new system or a fundamental change in existing practices), expose the legitimate rights and interests of others to risks or are extremely impractical.
