	sentiment	review
718	0	We may collect technical information about your use of the Online Services through the use of tracking technologies and analytics.
5362	1	If you reside outside of North America, your relationship is with Adobe Ireland. Adobe Ireland will transfer your personal information to some organizations which are located outside the European Economic Area (EEA) and the United Kingdom and/or Switzerland, namely the US and India and other locations where we Adobe may have operations in the future.
1929	1	6.1. We may  transfer and maintain on our servers or databases some of your personal information outside the European Economic Area (EEA) including in Russia. 
4485	0	Aggregated Data: In an ongoing effort to better understand and serve the users of the Services, Chatous often conducts research on its customer demographics, interests and behavior based on the Personal Data and other information provided to us. This research may be compiled and analyzed on an aggregate basis, and Chatous may share this aggregate data with its affiliates, agents and business partners. This aggregate information does not identify you personally. Chatous may also disclose aggregated user statistics in order to describe our services to current and prospective business partners, and to other third parties for other lawful purposes.
1376	1	We process personal information inside and outside of the United States. Uber transfers information of users' outside the United States on the basis of mechanisms approved under applicable laws.
4906	0	You can opt-out of interest-based advertising on mobile applications by checking the privacy settings of your Android or iOS device and selecting “limit ad tracking” (Apple iOS) or “opt-out of interest based ads” (Android). For personalized in-game offers opt-out, you can use the options provided in the game settings.
1109	1	If we have entered into standard data protection clauses adopted by the Commission with the entity, which is deemed to offer sufficient safeguards with respect to the protection of the privacy and fundamental rights and freedoms of individuals (you can obtain a copy of the clauses by contacting SayGames).
2303	0	We use this information for certain social functions of our Services, such as to show you who of your friends play the same game as you.
4020	0	The Software may contain links to third-party websites/services or you may access the Software from a third-party site. We are not responsible for the privacy practices or the content of these third-party sites or services linked to or from our Software, including the information or content contained within them.
1776	0	We will also obtain your information from affiliates and business partners. For example, when you make a booking or reservation through the website or mobile app of one of our affiliates or business partners, your booking or reservation information with them might be forwarded to us so that we can process your booking and ensure its success. Also, we allow you to log into Trip.com with your social media account, and with your consent (you grant authorization to the social platform), your personal information will be shared with us through that social platform.
1344	0	Your Personal Data collected through our Get in Touch forms will be deleted after 2 years from the date of receipt. Once we have deleted your Personal Data, you will not be able to exercise the right to access, the right to erasure, the right to rectification or the right to data portability.
1785	0	You have the right to object, on grounds relating to your particular situation, at any time to processing of Personal data concerning you. We will no longer process the Personal data unless we demonstrate compelling legitimate grounds for the processing which override your interests, rights and freedoms or for the establishment, exercise or defence of legal claims.
1015	0	Usage Data is data collected automatically either generated by the use of the Service or from the Service infrastructure itself (for example, the duration of a page visit).
3391	1	The Software and Service work over the Internet. We may store and process your information in various locations throughout the world. Where you located in the EEA, as required by law, you hereby provide us with your express consent to transfer your data to where may be outside of EEA once you use the Software and/or Service. You may withdraw your consent at any time.
2047	1	This means that your personal information can be transferred to a third country, a territory or one or more specified sectors within that third country, or to the international organization where data protection and confidentiality regulations may not provide the same level of protection of a personal data as your country doe
2279	1	We can transfer your Personal data to so called “third countries”, that is countries outside European Economic Area (such as United States of America). In case of such transfer we will base on European Union standard contractual clauses or Privacy Shield Framework.
3874	0	Only aggregated, anonymized data is periodically transmitted to external services to help us improve the Application and our service. We will share your information with third parties only in the ways that are described in this privacy statement.
3205	1	We transfer your personal information to the US and other countries, which may be outside the country in which you live. We use European Commission approved contract clauses and Privacy Shield to help protect your personal information. Learn more.
765	1	GeoZilla is hosted in the United Stated and is intended for and directed to users in the whole world. If you are a user accessing GeoZilla from any other region with laws or regulations governing personal data collection, use, and disclosure, that differ from the United States laws, please be advised that through your continued use of GeoZilla, which is governed by the United States law, GeoZilla Privacy Policy, and Terms of Service, you are transferring your personal information to the United States and you consent to that transfer.
2263	0	If Uber has information about you that you believe is inaccurate, you have the right to request correction of your information. Please see the section titled 'Explanation, Copies and Correction' below for more information on correcting, or requesting correction of, your information.
3063	1	Eyewind may store and/or transfer your personal data to its affiliates and partners in and outside of EU/EEA member states and the United States in accordance with mandatory legislation and this Privacy Policy. Eyewind may disclose your personal data to third parties in connection with a corporate merger, consolidation, restructuring, the sale of substantially all of Eyewind’s stock and/or assets or other corporate change, including, without limitation, during the course of any due diligence process provided, however, that this Privacy Policy shall continue to govern such personal data.
2547	1	imo is a U.S. company and stores data in the United States. This data is subject to U.S. laws. Thus, your information may be transferred to — and maintained on — computers located outside of your state, province, country, or other governmental jurisdiction where the privacy laws may not be as protective as those in your jurisdiction. If you are located outside the United States and choose to provide information to us, imo transfers that information to the United States and processes it there. By using the Service, you understand and consent that your information may be transferred to our facilities and those third parties with whom we share it as described in this Privacy Policy. If you are from the European Union or other regions with laws governing data collection and use, please note that you are agreeing to the transfer of your information to United States and to Processing of your data globally. By providing your personal information, you consent to any transfer and Processing in accordance with this Policy.
4265	1	In the case of a merger, acquisition or bankruptcy liquidation, or in other circumstances involving a merger, acquisition or bankruptcy liquidation, if the transfer of personal information is involved, we will require the new company and organization holding your personal information to continue to be bound by this Policy, otherwise, we will require such company, organization and individual to seek your authorization and consent again.
4048	0	Personal Data collected for the following purposes and using the following services:  AdvertisingAdMob
4303	0	We also get information about you and your activity outside Pinterest from our affiliates, advertisers, partners and other third parties we work with, or other publicly available sources. For example:Some websites or apps use Pinterest features such as our “Save” button, or you may install our “Save” button for your browser. If so, we collect log data from those sites or apps. Learn more about these features.
4161	0	For more information on the privacy practices and policies of InMobi, please visit the InMobi Privacy Policy: http://www.inmobi.com/privacy-policy/
4398	0	Chat Data: In an ongoing effort to better understand and serve the users of the Services, Chatous often conducts research on its customer demographics, interests and behavior based on the Personal Data and other information provided to us. This research may be compiled and analyzed on an aggregate basis, and Chatous may share this aggregate data with its affiliates, agents and business partners. This aggregate information does not identify you personally. Chatous may also disclose aggregated user statistics in order to describe our services to current and prospective business partners, and to other third parties for other lawful purposes.
3443	1	Your personal information and files are stored on Adobe’s servers and the servers of companies we hire to provide services to us.
3142	1	Medium uses third-party vendors and hosting partners, such as Amazon, for hardware, software, networking, storage, and related technology we need to run Medium. We maintain two types of logs: server logs and event logs. By using the Services, you authorize Medium to transfer, store, and use your information in the United States and any other country where we operate.
4595	0	Personal Data You Give Us. When you sign up for or use the Services, you voluntarily give us certain Personal Data, including your name, email address, username, and profile picture. If you register for an account through your social media account (including Facebook and Google Sign-in), you may see which of your friends are using the Services. The information we get from these accounts depends on your settings and the privacy policies of the social media platforms, so please check those policies to understand the privacy practices of those platforms.
4837	0	In addition, the Application may collect certain information automatically, including, but not limited to, the type of mobile device you use, your mobile devices unique device ID, the IP address of your mobile device, your mobile operating system, the type of mobile Internet browsers you use, and information about the way you use the Application. 
5087	0	We will hold your personal information on our systems for as long as is necessary for the relevant service, or as otherwise described in this Privacy Policy.
