	sentiment	review
3285	1	We may transfer information that we collect about you to affiliated entities, or to other third parties across borders and from your country or jurisdiction to other countries or jurisdictions around the world.  If you are located in the United States, European Union or other regions with laws governing data collection and use that may differ from Israeli law, please note that you are transferring information, including personal information, to a country and jurisdiction that does not have the same data protection laws as your jurisdiction, and you consent to the transfer of information to Israel and the use and disclosure of information about you, including personal information, as described in this Policy.
3628	1	Trip.com is a global company that operates both inside and outside of the European Economic Area (the “EEA”). It also cooperates with third-party vendors located both inside and outside of the EEA. Therefore, Trip.com may transfer your personal information to countries outside of the EEA, including to countries which may not have in place laws that apply the same level of data protection as within the EEA. Whenever such transfer occurs, it is based on the Standard Contractual Clauses (according to EU Commission Decision 87/2010/EC or any future replacement) in order to provide your personal information a level of data protection that applies within the EEA. You can contact us at en_dataprotection@trip.com for further information.
938	0	We may use one or more of the following third-party advertising services and analytics tools: AdMob, AppAnnie, AppsFlyer, Facebook, Firebase, Google AdWords, Vungle, etc. In case you want to learn more about the services and privacy options please consult their websites and privacy policies.
3290	0	The Data processing is carried out using computers and/or IT enabled tools, following organizational procedures and modes strictly related to the purposes indicated. In addition to the Data Controller, in some cases, the Data may be accessible to certain types of persons in charge, involved with the operation of the site (administration, sales, marketing, legal, system administration) or external parties (such as third party technical service providers, mail carriers, hosting providers, IT companies, communications agencies) appointed, if necessary, as Data Processors by the Owner. The updated list of these parties may be requested from the Data Controller at any time.
2514	0	We may use the information collected from you for a variety of purposes, primarily, relating to providing our Services and information about our Services. We may also use the information for such other purpose as otherwise allowed by law. For example, we (or a supplier or our affiliate company acting on our behalf and only under our instructions) may use your personal information, including personally identifiable information, for such purposes, including but not limited to:(a) contacting you (for example as part of customer service or to send you updates about our Services);(b) managing your account and improving your experience when you use our Services;(c) researching or surveying, and asking you to participate in such research or survey, about our product or Services;(d) marketing and promotion of our Services or related products, including those of a third party’s products which are related to our Services (If you do not want us to use your data in this way, please let us know by contacting us through Customer Center found within our Website or Applications);(e) sending you offers, promotions, information, newsletters, and communication regarding our Services or products and merchandises relating to our Services;(f) creating reports, analysis or similar services for use by us for the purposes of research or business intelligence, for example to track potential problems or trends with our Services;(g) delivering relevant advertising to you and measuring and analyzing effectiveness of advertising, including advertising of third parties placed within the Services;(h) monitoring the Services, including the Website, Games, Applications, and networks, and operation thereof;(i) resolving disputes or issues;(j) tracking purchases and usage information;(k) preventing cheating, crime or fraud;(l) administering sweepstakes and contests;(m) enforcing the legal terms governing your use of our Services; and(n) any other purpose as we determine, in our sole discretion, to be necessary or required to ensure the safety and/or integrity of our users, employees, third parties, public, and/or our Services, or to comply with requirements of any applicable law.
295	1	Personal data is transferred via certified entities under the Privacy Shield or, 
2011	0	"Note that ""Mobirix"" is not required to question or contest the validity of any search warrant, subpoena or other similar governmental request that ""Mobirix"" may receive."
5466	0	Through your account settings for the Service, you may access, edit, or delete Information you’ve provided and your record of interactions with the Service. Such Information and interactions, and your ability to update them, will vary based on the Service.
3341	1	The APP and Services work over the Internet. We may store and process your information in various locations throughout the world. Where you located in the EEA, as required by law, you hereby provide us with your express consent to transfer your data to where may be outside of EEA once you use the Software and/or Services. You may withdraw your consent at any time.
20	1	You acknowledge that your information will be transferred outside of the European Economic Area, both to us and other members of our group. This includes, but is not limited to, Russia, Israel, Los Angeles USA, San Francisco USA, California USA and Georgia USA. Where we transfer your personal data outside of the EEA, we will put in place adequate measures to ensure that your information is kept secure (and such adequate measures shall include (without limitation): (i) transferring to a jurisdiction which the European Commission recognises as providing adequate protection for the rights and freedoms of data subjects in connection with the processing of their personal data; and (ii) transfers pursuant to standard contractual clauses in accordance with European Commission decisions on transferring personal data).
3138	1	We only transfer personal data to entities in third countries that have provided appropriate safeguards to ensure that their level of data protection is in agreement with this privacy policy and applicable law.
524	1	If you choose to use the Services or provide your information to us, your personal information may be transferred to, processed and maintained on servers or databases located outside of the country or jurisdiction where you are located. Such countries or jurisdictions may have data protection laws that are less protective than the laws of the jurisdiction in which you reside. If you do not want your information transferred to or processed or maintained outside of the country or jurisdiction where you are located, you should not use the Services.
2144	1	Your information may be stored and processed in any country in which we maintain facilities, including outside of Japan. In this regard, or for purposes of sharing or disclosing data as described in this Privacy Policy, we reserve the right to transfer information outside of your country. By using the Service, you consent to any such transfer of information outside of your country.
4901	0	For a better experience, while using our Service, I may require you to provide us with certain personally identifiable information. The information that I request will be retained on your device and is not collected by me in any way.
4008	1	The Software and the Services work over the Internet. We may store and process your information in various locations throughout the world. Where you located in the EEA, as required by law, you hereby provide us with your express consent to transfer your data to where may be outside of EEA once you use the Software and/or the Services. You may withdraw your consent at any time.
4239	1	Transfers of Personal Data: The Services are hosted and operated in Germany through Company and its service providers, and if you do not reside in Germany, laws in Germany may differ from the laws where you reside. By using the Services, you acknowledge that any Personal Data about you, regardless of whether provided by you or obtained from a third party, is being provided to Company in Germany and will be hosted on German servers, and you authorize Company to transfer, store and process your information to and in Germany, and possibly other countries.  You hereby consent to the transfer of your data to Germany pursuant to a data processing agreement incorporating standard data protection clauses promulgated by the EC, a copy of which can be obtained at https://eur-lex.europa.eu/legal-content/EN/TXT/?uri=celex%3A32010D0087.
5228	1	If you are located in the EEA, we comply with EU data protection law when transferring your Personal Information outside of the EEA.
5216	0	Web browser information
2531	1	In the event that Topface or any of our partners who own your data legally transfers business or changes ownership, for example, due to the takeover by another company or the merger, reorganization or sale of all or part of the assets, as well as in case of insolvency, we can be required to disclose your personal information.
405	0	If you have any questions or comments about this Policy or our privacy practices, or to report any violations of the Policy or abuse of an Application, the Services or the Site, please contact us at legalsupport@ushareit.com.
5056	0	Other users
3188	0	Last modified: 2019/03/14
4201	1	We try to make sure that the recipient of any personal data provides a proper protection of the personal data received, in accordance with the current legislation on the protection of such information. By using the App, you agree that we may transfer your personal data to any third country, a territory or one or more specified sectors within that third country, or to the international organization.
188	1	7. Transfer of Data Outside Your Territory.
4527	0	Eyewind follows generally accepted industry standards and maintains reasonable safeguards to attempt to ensure the security, integrity and privacy of the information in Eyewind’s possession. Only those persons with a need to process your personal data in connection with the fulfillment of their tasks in accordance with the purposes of this Privacy Policy and for the purposes of performing technical maintenance, have access to your personal data in Eyewind’s possession. Personal data collected by Eyewind is stored in secure operating environments that are not available to the public. To prevent unauthorized on-line access to personal data, Eyewind maintains personal data behind a firewall-protected server. However, no system can be 100% secure and there is the possibility that despite Eyewind’s reasonable efforts, there could be unauthorized access to your personal data. By using the Services, you assume this risk.
1922	1	Your consent to this Privacy Policy followed by your submission of such information represents your agreement to that transfer.
5317	0	"Cookies are not the only way to recognise or track visitors to our Platform.  We may use other, similar technologies from time to time, like web beacons (sometimes called ""tracking pixels"" or ""clear gifs"").  These are tiny graphics files that contain a unique identifier that enable us to recognise when someone has visited our Platform or opened an e-mail that we have sent them.  This allows us, for example, to monitor the traffic patterns of users from one page within our Platform to another, to deliver or communicate with cookies, to understand whether you have come to our Platform from an online advertisement displayed on a third-party website, to improve site performance, and to measure the success of e-mail marketing campaigns.  In many instances, these technologies are reliant on cookies to function properly, and so declining cookies will impair their functioning."
4131	1	We predominantly use Amazon Web Services, which is certified under the EU – US Privacy Shield Framework, for our Services: https://aws.amazon.com/compliance/eu-us-privacy-shield-faq/
846	1	Your information collected through the Service may be stored and processed in the United States or any other country in which Canva or its subsidiaries, affiliates or service providers maintain facilities. Canva may transfer information that we collect about you, including personal information, to affiliated entities, or to other third parties across borders and from your country or jurisdiction to other countries or jurisdictions around the world. As a result, we may transfer information, including personal information, to a country and jurisdiction that does not have the same data protection laws as your jurisdiction, and you consent to the transfer of information to the U.S. or any other country in which Canva or its parent, subsidiaries, affiliates or service providers maintain facilities and the use and disclosure of information about you as described in this Privacy Policy.
1284	1	All personal information that Netmarble collects is stored and transferred to a data center in Korea using secure cryptographic communication at the collection stage. Netmarble has implemented the appropriate technical and organizational security standards, including industry standard safeguards, to protect customer privacy. In particular, we received KOREA ISMS and KOREA PIMS certification.
2709	0	3.2 Transfer
5255	0	Your private message may also be monitored by us if we have reasonable grounds to believe that you are using our private messaging services for criminal activities. Your private messages (including any image or video contained) may be shared with law enforcement agencies if we are requested to do so.
572	0	(2) We will not rent or sell your personal information to the third- party, but for your better use of the services provided by third-party organizations, we may share your information with third-party organizations that provide automatic data processing technologies for the Software or providing service to the Software. We do not have power to control or influence these third- parties’ tracking technologies or how they may be used. Therefore, if you do not want to share your personal information with any third-party organizations, please do not use such service provided by that third-party organizations.
2906	0	In some cases, the third parties advertising companies that we work with will also use the data that they collect for their own purposes, for example they may aggregate your data with other data they hold and use this to inform advertising related services provided to other clients
1634	0	NUMBER FINDER, for the identification of possible system problems in the mobile application by NUMBER FINDER or connected to NUMBER FINDER and the immediate solution for these problems, can save the users' IP addresses, other contact information and the saved data in the user account in social media when necessary and use these data for the above mentioned purposes. These data/ information can be used by NUMBER FINDER for the general identification of the users and produce an extensive demographic data. NUMBER FINDER reserves the obligations of traffic data as specified in the EU Directive on the protection of individuals with regard to the processing of personal data and on the free movement of such data” dated 24.10.1995.
5232	0	Do we let third-parties, including ad networks or plug-ins collect PII from children under 13?
5211	1	In connection with the processing, we will in certain circumstances transfer your personal data to recipients in the U.S which has been declared an unsafe third country by the European Commission.
3910	0	You have the right to decide whether to accept or reject cookies. If you choose to set your web browser controls to reject cookies, you may still use our website though your access to some functionality and areas of our website may be restricted.
2673	1	We maintain servers around the world, the data that we collect from you may be transferred to and stored at, a destination outside of the country where you live. It may also be processed by staff who work for us or one of our suppliers. By using the UCWeb Services, you consent to your personal data being transferred outside of the country where you live.
75	1	Your Information may be stored and processed in any country where we have facilities, and by using an Application, the Services or the Site you consent to the transfer of your Information to countries, including the United States, which may be outside of your country of residence and may provide for different and less stringent data protection rules than in your country. If you object to your Information being transferred or used as described in this Policy, please do not use any Application, the Services or the Site and immediately delete all Applications from your User Devices.
1462	0	For registered users of the Sites, some of your information can be viewed and edited through your account, which is protected by a password. We recommend that you do not divulge your password to anyone. Our personnel will never ask you for your password in an unsolicited phone call or in an unsolicited email. If you share a computer with others, you should not choose to save your log-in information (e.g., user ID and password) on that shared computer. Remember to sign out of your account and close your browser window when you have finished your session.
1140	1	By registering for and using the Service you consent to the transfer of information to any other country in which Reports+, its Affiliates or Service Providers maintain facilities and the use and disclosure of information about you as described in this Privacy Policy.
5453	1	6 – International operations and transfers of your information
2342	0	If we are required by law to disclose your information, we may share your information with law enforcement or other competent authorities and any third party, as may be required (e.g., to detect, prevent or otherwise address fraud, security, or technical issues; to respond to claims or satisfy any legal process, subpoena, or governmental request; or to protect the rights, property, or personal safety of the Company's users, its partners, or the general public). In the event the Company goes through a business transition such as a merger or acquisition by another company, consolidation, change of control, reorganization, or sale of all or a portion of its assets, your information will be among the assets transferred.
2155	0	We strive to adhere to the generally accepted industry practices regarding the collection and the usage of information by our Partners and to limit their usage to the services they provide for us. They adhere to this Privacy Policy, but in some cases we must use their privacy policies.
2912	0	We communicate with you, for example, by push notifications. These may include reminders and motivational messages encouraging you to follow your training and nutrition plan, or other information about the App. As a result, you may, for example, receive a push notification every day at a particular time reminding you to work out. To opt out of receiving push notifications, you need to change the settings on your device.
5209	1	"Consequently, the transfers will only occur based on the following safeguards:If the entity is certified to comply with the principles for data protection under the US-EU Privacy Shield Framework (""Privacy Shield"") (you can view the entities certified under Privacy Shield at https://www.privacyshield.gov/), or"
2216	1	In order to provide Services to our users all over the world, we operate globally. You hereby authorize us to transfer, store, and use your data in any country and region we operate, including Singapore, the People’s Republic of China and the European Union. Please note that data processed in a foreign country may be subject to foreign laws and accessible by foreign authorities. However, we will use commercially reasonable efforts to ensure the security of your information.
4127	0	Attn: Privacy / Legal Department
3457	1	For personal data transferred outside of countries recognised by the National Data Protection Authority (CNIL) as having a sufficient level of protection, any of the mechanisms offering appropriate guarantees is used, for which provision is made by applicable regulations, and in particular the adoption of template contractual clauses.
1815	1	Where we transfer your information outside of the EEA, we have agreements in place with those parties which include standard data protection clauses adopted by a data protection regulator and approved by the European Commission to ensure that appropriate safeguards are in place to protect your personal data.  If you would like to find out more about these safeguards, please let us know by writing to privacypolicy@kwalee.com.
2251	0	Although our Service is a general audience Service, we require that our Users are of the legal age required to enter into a contract. This Service is not intended for use by children under 13 years of age, and we do not knowingly collect personal information from children under 13. If we learn we have collected or received personal information from a child under 13 without verification of parental consent, we will delete that information. If you believe we might have any information from or about a child under 13, please contact us Privacy@Camsurf.com.
4516	0	Our Privacy Policy DOES NOT apply to services offered by other companies or individuals, including products or sites that may be displayed to and interacted with you through the browser, or other sites linked from our services. Please refer to third party privacy policies for details.
1731	0	Should you request so by informing us on privacy@outfit7.com, we will send you all the updates of this Privacy Policy to your e-mail. We will also inform you about any material updates of our Privacy Policy with an in-app banner and a link.
156	0	Collection from your mobile device photos or photo gallery
3313	1	Specifically, our servers are located in Canada and the USA, and our third party service providers and partners operate around the world. This means that when we collect your personal information we may process it in any of these countries.
1477	0	Grounds for retention: E-Commerce Act
1945	0	You may update your account at any time by logging in and changing your profile settings. If you have any questions about reviewing or modifying your account information, please contact us directly at support@GOGO LIVE.com.
3635	1	All information we hold is stored on our secure servers (which we own or license from appropriate third parties). We use industry standard procedures and security standards to prevent unauthorised access to our servers, however no online service or website can be completely secure, so please protect the account information in your possession as well.
4120	0	We transmit Data to third parties only if this is necessary for the Purposes, due to a request from a national authority, due to a court ruling, or if you have consented beforehand.
2338	1	We work in the international space and provide our App to our Users around the world.
2857	1	Personal information that is collected and generated from our operations in the People's Republic of China and within the country will be stored within China except:(I) where specifically provided for by laws and legislations;(II) where your express consent has been obtained;(III) where you conduct proactive activities over the Internet such as cross-border live streaming/posting updates.
5428	1	Medium is hosted in the United States. By using the Services, you authorize Medium to transfer, store, and use your information in the United States and any other country where we operate. Where your data is disclosed to our processors, it is subject by contract to at least the same level of data protection as that set out in this statement.
4720	1	As part of our international operations, we may transfer personal information to our affiliates (which means subsidiaries, parent companies, joint ventures, and other corporate entities under common ownership of NOVA GEIMS, OOO from time to time for our legitimate business purposes.
946	1	6.1. We may  transfer and maintain on our servers or databases some of your personal information outside the European Economic Area (EEA) including in Russia.
2741	1	The information above applies to Adobe users who are consumers. More information is available for our business customers that want to learn more about European data transfers.
3288	1	The Services are operated in the United States. Given that we are an international business, our use of your information necessarily involves the transmission of data on an international basis. If you are located in the European Union, Canada or elsewhere outside of the United States, please be aware that information we collect may be transferred to and processed in the United States. By using the Services, or providing us with any information, you consent to the collection, processing, maintenance and transfer of such information in and to the United States and other applicable territories in which the privacy laws may not be as comprehensive as or equivalent to, those in the country where you reside and/or are a citizen.
2158	1	In connection with the processing, we will in certain circumstances transfer your personal data to recipients in the U.S which has been declared an unsafe third country by the European Commission.
