	sentiment	review
5203	0	Only part of the above mentioned data qualifies as the personal data. Some of the data we collect do not allow us to identify you, and a collection of such data is not intended for identification of an user.
2264	0	We will only collect and process Information about you where we have lawful bases. Lawful bases include consent (where you have given consent), contract (where processing is necessary for the performance of a contract with you (e.g. to deliver the Services you have requested)) and “legitimate interests”.
2639	0	We do not knowingly collect or solicit personal information from or direct or target interest based advertising to anyone under the age of 13 or knowingly allow such persons to use our Services.  If you are under 13, please do not send any information about yourself to us, including your name, address, telephone number, or email address.  No one under the age of 13 may provide any personal information.  In the event that we learn that we have collected personal information from a child under age 13, we will delete that information as quickly as possible.  If you believe that we might have any information from or about a child under the age of 13, please contact us.
3940	0	Mimo applications for Android and iOS (“apps”), websites (“websites”), and related services (together with the apps and websites, the “services”) are operated by Mimohello GmbH, Schanzstraße 14/1.1, 1150 Vienna, Austria (thereafter “Mimo,” “us,” or “we”).
3300	0	Cookies can either be “session cookies” or “persistent cookies”. Session cookies are temporary cookies that are stored on your device while you are visiting our Website or using our Service, whereas “persistent cookies” are stored on your device for a period of time after you leave our Website or Service. We use persistent cookies on our website to store your preferences so that they are available for the next visit, and to keep a more accurate account of how often you visit our Services, and how your use of the Services varies over time. For more information on cookies, including how to control your cookie settings and preferences, visit http://ec.europa.eu/ipg/basics/legal/cookies/index_en.htm, https://ico.org.uk/for-the-public/online/cookies/ and http://www.allaboutcookies.org/.
4206	1	However, some information may still be stored for a certain time period if information is necessary to comply with legal obligation (taxation, accounting, audit) or in order to maintain safety and data backup settings, prevent fraud or other malicious acts.
5273	0	Please note that because a third party site manages the purchases of virtual goods offered by the Service, we do not have access to your credit card details and billing information.
2604	1	Aeria Canada Studio Inc. will retain your Personal Data only for as long as is necessary for the purposes set out in this Privacy Policy. We will retain and use your Personal Data to the extent necessary to comply with our legal obligations (for example, if we are required to retain your data to comply with applicable laws), resolve disputes, and enforce our legal agreements and policies.
3463	1	7.2. You may request to remove your account and data on our Services by contacting the Service support (see Section 10 for details).
403	1	Following such request, Uber deletes the information that it is not required to retain. In certain circumstances, Uber may be unable to delete your account, such as if there is an outstanding credit on your account or an unresolved claim or dispute. Upon resolution of the issue preventing deletion, Uber will delete your account as described above.
4794	1	Information requested by an investigative agency pursuant to a search and seizure warrant
3709	1	We retain your personal information as long as we have an ongoing legitimate business need to do so for example to provide services or products to you, or as required or permitted by applicable laws, such as tax and accounting laws.
3367	0	This privacy policy was last modified on Dec 20, 2018.
349	1	Unless stated otherwise in this Privacy Policy, the personal data that you provide us will only be stored for as long as it is necessary for us to fulfill our obligations in respect of the provision of the Services.
1317	1	5.3 Unfortunately, the transmission of information via the internet is not completely secure. Although we will do our best to protect your personal information, we cannot guarantee the security of your information transmitted to our Service and any transmission is at your own risk.
5120	0	Appodeal, Inc. https://www.appodeal.com/privacy-policy/
1151	1	Records relating to advertisement and labelling
4333	0	To comply with legal obligations
227	1	Finally—and this is important—you should understand that users who see the content you provide can always save it using any number of techniques: screenshots, in-app functionality, or any other image-capture technology. It’s also possible, as with any digital information, that someone might be able to access messages forensically or find them in a device’s temporary storage. If any deletion of user information of our App happens, we cannot promise that deletion will occur within a specific timeframe. And we may also retain certain information in backup for a limited period of time or as required by law.
4096	1	Uber requires user profile information in order to provide its services, and retains such information for as long you maintain your Uber account.
4028	1	Lima Sky retains the data collected pursuant to this Privacy Policy for the period necessary to fulfill the purposes outlined in this Privacy Policy unless a longer retention period is required or permitted by law. Thereafter if the collected data is no longer needed for purposes specified in this Privacy Policy, Lima Sky deletes all aforementioned data in its possession within a reasonable timeframe. 
5244	1	With respect to processing of Personal Data Level Eight is Data Controller. Level Eight shall (i) Not keep the Personal Data for longer than is necessary for the purposes of performing the Agreement unless further storage is required in order to establish, exercise or defend a legal claim or to comply with applicable law, including accounting rules; (ii) Store, process and use the Personal Data for the sole purpose of performing the Agreement; and (iii) Ensure that their employees and employees of their affiliates and subcontractors involved in the performance of the Agreement comply with the provisions of this agreement (iv) Implement all reasonable technical and organizational measures to protect your Personal Data against any accidental or unlawful destruction, accidental loss, unauthorized alteration, communication or access, (v) Where applicable report to you, upon its occurrence, any unauthorized access, disclosure, use, modification or destruction of  your Personal Data, (vi) Refrain from exporting or transferring  your Personal Data to any Third Country, and from collecting, using or Processing Personal Data within any Third Country, unless prior to the transfer we have ensured that an adequate level of protection of the Personal Data has been implemented in accordance with the terms and conditions stated in section 9 of this Agreement (International Data Transfers). Personal Data are deleted or anonymized as soon as it no longer serves one of the above mentioned purposes and in any event no later than three (3) years after your interaction with us has ended.
3042	1	Usually we do not store the technology information we collected, such information will be deleted automatically once you quit from the Software. If we retain the information we collect as described in this Privacy Policy, it is only for as necessary for the provision of the Services, internal analytical purposes, or to comply with its legal obligations, resolve disputes and enforce agreements (e.g. settlement). The criteria used to determine the retention periods include: (i) how long the personal data is needed to provide the Services and operate the business; (ii) the type of personal data collected; and (iii) whether we are subject to a legal, contractual or similar obligation to retain the data (e.g., mandatory data retention laws, government orders to preserve data relevant to an investigation, or data that must be retained for the purposes of litigation or disputes).
424	1	Data retention periods for other Processors are indicated by the links above.
3971	1	Anonymous information about activity on Topface persists longer for statistical data and marketing research, but it does not correlate with you after deleting the profile, that is, becomes anonymous. This is because Topface seeks to develop its services and opportunities for more convenient communication and this period is justified by our legitimate interest.
2810	0	In accordance with data protection laws, we will only process your information where we have a lawful basis for doing so. In respect of your information, these bases are: (i) where it is necessary to provide services to you under the performance of the contract we have with you; (ii) where we are required to do so in accordance with legal or regulatory obligations; (iii) where you have given your consent; and, (iv) where it is in our legitimate interests to process your information, provided that none of these prejudice your own rights, freedoms and interests.
1944	0	We communicate with you, for example, by push notifications. These may include reminders and motivational messages encouraging you to follow your training and nutrition plan, or other information about the App. As a result, you may, for example, receive a push notification every day at a particular time reminding you to work out. To opt out of receiving push notifications, you need to change the settings on your device.
2415	1	RETENTION PERIOD OF YOUR PERSONAL INFORMATION
2534	0	If we make material changes to how we use Personal Information collected from children under age 13, we will notify parents by email in order to obtain verifiable parental consent for the new uses of the child's Personal Information.
1080	0	For some tasks we use the help of service providers (e.g. tax advisors or analytics services) which we have chosen and instructed carefully, or other third parties. Some service providers are situated in the United States. Therefore, Data is transferred to third parties in third countries, all of which adhere to the EU-US privacy shield (see https://www.privacyshield.gov/welcome for more information):Auth0, Inc., 10900 NE 8th Street Suite 700, Bellevue, WA 98004, USA;Facebook, Inc., 1601 South California Avenue, Palo Alto, CA 94304, USA (“Facebook”);Google Inc., 1600 Amphitheatre Parkway, Mountain View, CA 94043, USA (“Google”);Mixpanel, Inc., 405 Howard St., Flr 2, San Francisco, CA 94105, USA (“Mixpanel”);Peaberry Software Inc., 921 SW Washington St, Suite #820, Portland, OR 97205, USA (“Peaberry”);Segment.io, Inc., 100 California Street, Suite 700, San Francisco, CA 94111, USA;Slack Technologies, Inc., 500 Howard Street, San Francisco, CA 94105, USA;Snap, Inc., 63 Market St., Venice, CA 90291, USA;Stripe Inc., 185 Berry Street, Suite 550, San Francisco, CA 94107, USA; andZendesk, Inc., 1019 Market Street, 6th Floor, San Francisco, CA 94103, USA.
2972	1	We will only keep your personal information for no longer than three (3) years unless otherwise required by applicable laws or regulations.
2409	0	To a potential or actual acquirer, successor, or assignee as part of any reorganization, merger, sale, joint venture, assignment, transfer or other disposition of all or any portion of our business, assets or stock (including in bankruptcy or similar proceedings).
1335	1	Uber retains certain information, including transaction, location, device and usage information, for a minimum of 7 years in connection with regulatory, tax, insurance and other requirements in the places in which it operates. Once such information is no longer necessary to provide Uber's services, enable customer support, enhance the user experience or other operational purposes, Uber takes steps to prevent access to or use of such information for any purpose other than compliance with these requirements or for purposes of safety, security and fraud prevention and detection.
1399	1	We will retain your information for as long as your account is active or as needed to provide you services. If you wish to cancel your account or request that we no longer use your information to provide you services, you may delete your account. We may retain and use your information as necessary to comply with our legal obligations, resolve disputes, and enforce our agreements. Consistent with these requirements, we will try to delete your information quickly upon request. Please note, however, that there might be latency in deleting information from our servers and backed-up versions might exist after deletion. In addition, we do not delete from our servers files that you have in common with other users.
1167	1	We generally retain your personal information for as long as is necessary for the performance of the contract between you and us and to comply with our legal obligations. If you no longer want us to use your information that we physically access and store, you can request that we erase your personal information and close your account.
3318	0	Details of transactions you carry out through our site and of the fulfillment of your orders.
3462	0	Updates to this Privacy Policy
5136	0	We may also share aggregate or anonymous information with third parties, including advertisers and investors. For example, we may tell our advertisers the number of users our Application receives. This information does not contain any personal or personally identifiable information and is used to develop contents and services that we hope you will find of interest.
4094	1	We retain personal information we collect from you where we have an ongoing legitimate business need to do so (for example, to provide you with a service you have requested or to comply with applicable legal, tax or accounting requirements).
3328	0	Access and Updates. We strive to let you access and control the personal information that we have about you. There are limits though to the requests we’ll accommodate. We may reject a request for a number of reasons, including, for example, that the request risks the privacy of other users or is unlawful. You can access and update your account information right in the app by visiting the app’s Settings page. If you need to access, update, or delete any other personal information that we may have, you can put in a request here. Because your privacy is important to us, we may ask you to verify your identity or provide additional information before we let you access or update your personal information. You can also remove our service from your mobile device or process account deletion.
1859	0	service providers for advertisement services,
1717	0	If you have consented to our use of your information you may withdraw that consent at any time. Depending on the situation you can either withdraw your consent by emailing community@canva.com, or through your account settings page. Where we are using your information because of a legitimate interest to do so, you have the right to object to that use. However, if you do so it may mean that it is not possible for you to continue using the Services.
1953	0	You can contact us through the customer service channel under [Settings-Feedback and Suggestions] on the left on Tantan, and we will respond to your request within 30 days.
504	1	Imo retains the personal information we receive as described in this Privacy Policy for as long as you use our Services or as necessary to fulfill the purpose(s) for which it was collected, provide our Services, resolve disputes, establish legal defenses, conduct audits, pursue legitimate business purposes, enforce our agreements, and comply with applicable laws.
2786	1	In principle, if the Company collects a Member’s personal data, the personal data is retained from the time of sign up until the cancellation of the Member’s account (including cancellation requested by the Member and cancellation by the Company itself based on its direct authority). When a member terminates his/her account, the Company shall destroy the Member’s personal data so it cannot be viewed or used; provided, however, in circumstances where the personal data is required to achieve the Company’s purposes of collection/use and/or where retaining the personal data is required or permitted by law, the Company may retain the Member’s personal data even after his/her account is terminated. For example, under the relevant Korean laws such as the Commercial Act, Act on Consumer Protection in Electronic Commerce (“E-Commerce Act”), Electronic Financial Transactions Act, Specialized Credit Finance Business Act, Framework Act on National Taxes, Corporate Tax Act, and the Value-Added Tax Act, and the Service’s internal regulations, information that can be used to identify a transacting party (e.g., name, address) and information that can be used to verify the rights and obligations of the transacting party with respect to the transaction may be retained by the Company even if the Member withdraws his/her consent to the use of the Service. Transaction records shall be retained as follows.
1171	0	If you visit our Platform, we will automatically collect certain information from your device. In some countries, including countries in the European Economic Area, this information may be considered as personal information under applicable data protection laws. Specifically this information may include IP addresses, device type, unique device identification numbers, browser type, broad geographic location (e.g. country or city-level location), browsing patterns and details of how you have interacted with our Platform and the goods and services available on it. In addition, we gather statistical information about the Platform and visitors to the Platform including, browser software, operating system, software and hardware attributes, pages viewed, number of sessions and unique visitors. Collecting this information enables us to better understand the visitors who come to our Platform, where they come from, and what content is of interest to them.  We use this information for our internal analytics purposes and to improve the quality and relevance of our Platform. Some of this information may be collected using cookies and similar tracking technology, as explained further under the section E “COOKIES” below.
961	1	As stated above, we do not retain your IP address beyond your VPN session and do not log your online activities.
672	0	If you have previously consented to any direct marketing communication from us or subscribed to our newsletters, you can unsubscribe by clicking on a link available in each communication and newsletter we send you.
2427	0	We welcome feedback about this policy at legal@medium.com.
1864	0	We do not knowingly collect personal information from children under 18 years old (or the minimum age required for the creation of a GOGO LIVE Account absent parental consent in your country), unless permitted to do so by applicable law. Children under 18 years old are not permitted to use our Services. If we become aware that we have unknowingly collected personal information from a child, we will make commercially reasonable efforts to delete such information in our database. If you are a parent or guardian of a child, and you believe your child has provided us with their Personal Information on our Services, please contact us immediately at support@GOGO LIVE.com.
1879	1	We will retain User Provided data for as long as you use the Application and for a reasonable time thereafter. We will retain Automatically Collected information for up to 24 months and thereafter may store it in aggregate. If you’d like us to delete User Provided Data that you have provided via the Application, please contact us at support@gamebeartech.comand we will respond in a reasonable time. Please note that some or all of the User Provided Data may be required in order for the Application to function properly.
740	1	Grounds for retention: E-Commerce Act
2486	0	For more information on the privacy practices and policies of Appodeal, please visit the Appodeal Privacy Policy: https://www.appodeal.com/home/privacy-policy/
687	1	When you register for an Adobe ID account, we process and keep most personal information we have about you for as long as you are an active user of our products, services or apps. When you close your account, we begin deleting certain personal information that we no longer have a business reason to retain, such as your hashed password and your payment account data. However, we typically retain personal information related to our contract and business transactions with you for seven years after your last interaction with us.
2091	1	Alexadra Games will store your personal data for as long as necessary in order to provide you with the App or otherwise fulfil the purposes as described above, unless further storage is required in order to establish, exercise or defend a legal claim or to comply with applicable law, including accounting rules.
1690	0	We collect information from you when you or enter information on our site.
5305	1	We retain your Personal Data as long as needed to provide services or products to you, or as required or permitted by applicable laws, such as tax and accounting laws.
5031	1	Where we process personal information for marketing purposes or with your consent, we process the information until you ask us to stop and for a short period after this (to allow us to implement your requests). We also keep a permanent record of the fact that you have asked us not to send you direct marketing or to process your information so that we can respect your request in future.
2236	0	C. Social Media:Some of our Services permit you to register or log into your account via a social networking platform, including and not limited to Facebook Connect and/or Google +, or permit you to use social media plugins such as the Facebook “Like” or Google “+1” buttons. Choosing to use this functionality and share information on these third party sites is at the sole discretion of the Member.
944	1	We will retain your information for as long as your account is active or as needed to provide you services. If you wish to cancel your account or request that we no longer use your information to provide you services, contact us at support@crazymaplestudio.com. We will retain and use your information as necessary to comply with our legal obligations, resolved disputes, and enforce our agreements.
5048	1	4. Data Retention
1462	0	For registered users of the Sites, some of your information can be viewed and edited through your account, which is protected by a password. We recommend that you do not divulge your password to anyone. Our personnel will never ask you for your password in an unsolicited phone call or in an unsolicited email. If you share a computer with others, you should not choose to save your log-in information (e.g., user ID and password) on that shared computer. Remember to sign out of your account and close your browser window when you have finished your session.
3527	1	We store your information for as long as needed to provide you with our services. We may store information longer, but only in a way that it cannot be tracked back to you. We delete the information as soon as we do not need them for providing our services, unless a longer retention period is required or permitted by applicable legislation.
3326	1	We will store your personal data for as long as it is reasonably necessary for achieving the purposes set forth in this Privacy Policy (including providing the Service to you), which includes (but is not limited to) the period during which you have an account with the App. We will also retain and use your personal data as necessary to comply with our legal obligations, resolve disputes, and enforce our agreements.
774	1	NOVA GEIMS, OOO retains, uses and stores your information as long as you are playing our games or using our Services, and also for the period necessary to fulfil all the purposes described in this Privacy Policy, in compliance with the applicable laws of your country of residence. We want to inform you that a longer retention period could be required to resolve disputes, or answer regulatory or police requests. In such cases, the collected information will be used and stored until the request is closed.
4660	0	In order to preserve the family-friendly reputation of our Apps, we age-gated some of the features in our Apps, so that they are not available for use by children under 13. The age gate is being conducted after the download of some of our Apps for specific territories in order to assure the privacy and protection of younger users of our Apps. The features enabling potential collection and sharing of personally identifiable information, with the exception of persistent identifiers, are disabled for device IDs of users who did not pass the age gate. For user’s safety, it is not possible to change the age later on. We do not store the year of birth of users who have identified themselves as below the age of 13 in our Apps, but only the information that their device ID did not pass the age gate.
4995	0	Gather usage statistics of services
