	sentiment	review
984	0	We may share your information as well as information from tools like cookies, log files, and device identifiers and location data, with third-party organizations that help us provide the Service to you. Our Service Providers will be given access to your information as is reasonably necessary to provide the Service under reasonable confidentiality terms. We may share user content and your information with businesses that are legally part of the same group of companies that Reports+ is part of, or that become part of that group. Affiliates may use this information to help provide, understand, and improve the Service and Affiliates' own services.
913	1	You represent and warrant that all information you provide to us is true and correct, and relates to you and not to any other person.  
657	0	We do not include any ads and we do not sell any information (personal or other); we do not engage in tracking personal information, nor do we provide personal information to third-party software providers as detailed in our Privacy Policy.
4104	0	"The Overmobile LLC (hereinafter referred to as ""Overmobile"", ""We"") gives high respect to privacy rights and pay a lot of attention to preservation of information about users."
2169	1	Erasure, Access, and Others
2031	0	Whether you are new to UCWeb or a long-time user, please do take the time to get to know our practices, and if you have any questions please feel free to contact us.
4732	0	11.1. If you have any questions, please send your inquiries to Service support at support@beingame-mobile.com. So we can deal with your enquiry effectively, please quote this Privacy Policy. We will aim to respond to you within 30 days from receipt of request.
2800	0	Analysis of your content (e.g., activity logs, and direct feedback from you) which is sent or received using an online feature of an Adobe app or website, or which is stored on Adobe servers.
3513	0	We may also acquire information from you through (1) your access and participation in message boards on the Service, (2) your participation in surveys regarding the Service or (3) your participation in a sweepstakes or contest through the Service.
2787	1	If you are concerned about the accuracy of personally identifiable information maintained by Camel Games or wish to review, access, amend or correct it, or would like your personally identifiable information removed from Camel Games's records or otherwise deactivated, please contact us here. We may decline requests that are unreasonably repetitive, require disproportionate technical effort, jeopardize the privacy of others, or are extremely impractical.
4814	0	We use the information we have to deliver our Products, including to personalize features and content (including your News Feed, Instagram Feed, Instagram Stories and ads) and make suggestions for you (such as groups or events you may be interested in or topics you may want to follow) on and off our Products. To create personalized Products that are unique and relevant to you, we use your connections, preferences, interests and activities based on the data we collect and learn from you and others (including any data with special protections you choose to provide); how you use and interact with our Products; and the people, places, or things you're connected to and interested in on and off our Products. Learn more about how we use information about you to personalize your Facebook and Instagram experience, including features, content and recommendations in Facebook Products; you can also learn more about how we choose the ads that you see.
4592	0	Airports.
4126	1	Withdrawal of Consent: If we are processing your Personal Data based on your consent (as indicated at the time of collection of such data), you have the right to withdraw your consent at any time. Please note, however, that if you exercise this right, you may have to then provide express consent on a case-by-case basis for the use or disclosure of certain of your Personal Data, if such use or disclosure is necessary to enable you to utilize some or all of our Services.
2287	1	You may also deactivate your account. To deactivate your account, please email us indicating in English that you would like to deactivate your account and you will receive the deactivation instructions from us. You will need to complete the steps in order to deactivate your account. Once your account is deactivated, you will not be able to restore your account again and your data on LIKE will be erased after certain period of time (usually within 24 months).
1332	1	If you sign up for a Medium account, you may at any time request an export of your personal information from the Settings page.
2595	0	·      To verify the user profile information before third party suppliers,
3537	1	Access and control over most Personal Data in the Game may readily available through the profile editing tools on the webpage or the gaming platforms. End Users may modify or delete any or all of their profile information at any time by logging into their accounts. Information will be updated as soon as possible. End Users who wish to deactivate their Game account may do so in their accounts on the webpage or the gaming platforms. Removed information may persist in backup copies for a reasonable period of time but will not be generally available to other End Users or visitors of the Game. You cannot however remove communications made in any communication features in the Game, which might have been shared with other End Users (for example sending personal messages to another End Users).
4676	0	We may disclose your Personal Information to other companies and organizations. We will only do so if our partners can provide the same level of security to keep your Personal Information safe as implemented by us and if our partners can ensure that they comply with applicable laws and privacy regulations. We may share your information with the following partners:· Market Research Agencies· Game distribution platforms· Co-publishing partners· Payment providers· Companies and external consultants that help support our platform and services· Advertising partners and attribution platforms to help us understand the effectiveness of our marketing campaigns· Please note that our games or products may be advertised in other applications. If you click on one of these advertisements and install our game, you will become a User of our Services. To prevent fraud and verify the installation of the game, we may share your IDFA (iOS) and/or Advertiser ID (Android) with the relevant advertiser.· We may release your Personal Information when we are required to by a court order, according to law or in the event of a bankruptcy or other similar unfortunate event. We are not required to question or contest the validity of any search warrant, subpoena or other similar governmental request that we receive.
36	1	If you wish to use any of the rights described below, you may contact us at any time by emailing us at support@alexandragames.com.
2380	0	When using the persistent identifiers we will not contact users under the age of 13, display behavioral advertising to them, nor do any user tracking or profiling. In addition, we strive that all of our advertising partners adhere to the same standards for the collection, usage and disclosure of children’s personal information as we do, but we can not be responsible if they breach the commitments they gave to us regarding the collection of information. In case of such breaches you agree that our liability is limited to the amounts we are able to receive as indemnification for the breaches from our advertising partner. For the detailed information about disclosure to third parties please see section How do we share your information and data to third parties of this Privacy Policy. For any additional questions about third party information disclosure please refer to privacy@outfit7.com.
835	0	This Privacy policy may change from time to time. Whenever we change this Privacy policy, we will post those changes to this Privacy policy and other places that we consider appropriate. Please check and pay close attention to this Privacy Policy from time to time.
4046	0	4.4. Developers
3215	0	Some of this information may be collected using cookies and similar tracking technology, as explained further under the heading “Cookies and similar tracking technology” below.
5117	0	"Ubisoft Services, including Uplay.com, may offer a public profile feature (""Public Profile"") that allows you to publish information, including personal information, to the public Internet. Other than as stated on the applicable Public Profile site, the information you upload or input to your Public Profile will default to the privacy level you choose at sign-in, and you can choose to change the privacy settings at any time. By default, certain aspects of the Public Profile are set to ""public"". Those aspects of the Public Profile that are designated as ""public"" will be visible by everyone, including people not registered within the Ubisoft environment, and may be indexed and displayed through public search engines when someone searches for you.  If you post your personal information to a Public Profile, including a video, image or photo, you should be aware that these may be viewed, collected, copied and/or used by other users without your consent.  We are not responsible for disclosure by other users of your Personal Information, including without limitation, videos, images or photos that you choose to submit on the Ubisoft Services. Also, please remember that the Personal Information you provide to us as part of your Public Profile may reveal or allow others to identify aspects of your life that you may not choose to state on your Public Profile directly  (for example, your picture may reveal your gender). "
28	0	We may also show you advertisements in our App, and send you push notifications for marketing purposes. To opt out of receiving push notifications, you need to change the settings on your device.
480	0	Information that we obtain from third party sources
362	1	You have the right to require us to restrict our processing of your Personal Information if you contest the accuracy of your Personal Information, if the processing is unlawful but you do still not want us to erase your Personal Information, if your Personal Information is no longer needed to fulfil the purpose it was collected for or you have informed us that you do not consider us to have a legitimate interest for certain processing. 
3272	1	Deleting your personal data. You can request erasure of your personal data by sending us an email at support@betterme.tips. If you have connected your Facebook account or used your email for registration in our App or entered your name in the App, section “Manage personal data” in the App's settings will be available to you. You may select “Remove data” there and we will delete the personal data collected from you.
21	1	(d) Right to request that your personal information is erased.
2197	1	We adhere to the following COPPA tenants:      • Parents can review, delete, manage or refuse with whom their child's information is shared through contacting us directly.
458	1	Our Privacy Policy link includes the word 'Privacy' and can easily be found on the page specified above.
259	0	Chatous does not knowingly collect or retain Personal Data about persons under 13 years of age. Any person who provides their Personal Data to Chatous through the Services represents that they are 13 years of age or older. We encourage parents and legal guardians to monitor their children’s Internet usage and to help enforce our Privacy Policy by instructing their children never to provide Personal Data on the Services without their permission. If Chatous learns that Personal Data of persons under the age of 13 years has been collected on the Site without verifiable parental consent, then Chatous will take the appropriate steps to delete this information.
3811	1	We will give a reply within 30 days. If you are unsatisfied with our reply, you can also file a complaint through the customer service personnel of Tantan.
3000	0	Welcome to Canva, the online and mobile service of Canva Pty Ltd (ﾡﾰCanva,ﾡﾱ ﾡﾰwe,ﾡﾱ or ﾡﾰusﾡﾱ). Our Privacy Policy explains how we collect, use, disclose, and protect information that applies to our Service, and your choices about the collection and use of your information. Capitalized terms that are not defined in this Privacy Policy have the meaning given to them in our Terms of Use.
4890	1	Right to request access
2029	1	To address any privacy or security questions or concerns, or to make any of these requests, contact us with details about your request at en_dataprotection@trip.com.
2074	1	4.2. You may use Your rights by reading this Privacy Policy or sending requests relating to the rights provided in paras. (3)-(10) to Our e-mail specified in Chapter 1 “Contacting CarX Technologies” of this Privacy Policy.
3090	1	Under EU law you have the right to lodge a complaint regarding the processing of your personal data by Medium with the dedicated Supervisory Authority of your EU member state.
922	0	This Service does not use these “cookies” explicitly. However, the app may use third party code and libraries that use “cookies” to collection information and to improve their services. You have the option to either accept or refuse these cookies and know when a cookie is being sent to your device. If you choose to refuse our cookies, you may not be able to use some portions of this Service.
1791	1	You have the right to restrict the processing of your data where the accuracy of your personal data is contested, where the processing is unlawful, and where Overmobile no longer needs the personal data for the purposes for which Overmobile has processed it.
4392	1	You may request that Uber:Provide a detailed explanation regarding the information Uber has collected about you and how it uses that information.
3261	1	The Company can get the consent of the users, if necessary, for the usage of service of the users, and consequently provide the personal information to a third party
1769	0	Where necessary, a copy of your identity or  another document containing your name, surname, photograph, number of the principal identity document of you or your representative, payment details and another additional data, with that you may provide us, including through our support service. We may take additional verification steps where we consider reasonable in order to verify your account. We use this data in order to identify you, verify your account and prevent abuse and infringements of your or other persons' rights.
538	1	Users outside the EU may also request explanation, correction, deletion or copies of their personal data here.
2423	0	To fulfill a contract, or take steps linked to a contract: this is relevant where you register to use an Adobe app or website (whether paid, or as a free trial). This includes:Providing you with the Adobe websites and apps for which you have registered, and any other services or products that you have requested;Verifying your identity;Taking payments;Sending you necessary communications (for example, related to payments or expiration of your subscription); andProviding customer service or support.
1623	0	FINDNOW may use the collected information so as to obtain, develop, analyze and personalize the Services Users, partners and third party providers. More specifically, FINDNOW can use this information for all purposes in all projects the Company possesses, and additionally for other applications and projects which the Company does not own for the purposes indicated below:a.    To ensure use and sharing your information with respect to the use of your session or payment service providers, online services, social networking sites and utilization of other third party services,
5288	0	We may send periodic promotional or informational emails to you. You may opt-out of such communications by following the opt-out instructions contained in the e-mail. Please note that it may take up some time for us to process opt-out requests. If you opt-out of receiving emails about recommendations or other information we think may interest you, we may still send you e-mails about your account or any Services you have requested or received from us. If you want to review, delete, or change the information we have about you, no longer want us to make active use of your information, or have additional questions, please send an email to us at the following address: privacy@bolegames.com with your request and identifying information in the body of the email, including your first name, last name, e-mail address or login name you use to access our Application and Services. We will respond to your email as soon as possible. Please note that certain records, for example those relating to payments or customer service matters, will be held for legal and accounting purposes. We may not be able to delete content posted on a public forum through the Services, if applicable. If you have previously allowed us to access your geolocation data or receive push notifications, you can stop making geolocation available to us or receiving push notifications by visiting your mobile device's settings for the relevant Application or in some cases, through the Application itself. In some instances you can also stop or limit the type of cookies you allow. Please note that you may lose some of the features and functionality of our Services and Applications because accepting cookies may be necessary to track and enhance your game play and other activities.
3316	0	If we have to have ads on our site *ewww* we might use some of your info to show you appropriate ads. We may also use some of that info to send you relevant ads on other sites, like Facebook or Google.
2332	0	This Privacy Statement applies to information about you as an identifiable person that Trip.com or its mobile application collects from, or about you. This Privacy Statement does not apply to anonymous data that cannot identify you in any way.
1024	0	Provision of information from FINDNOW database is protected under the frame of the applicable laws relating to the Freedom of Expression and the scope of constitution. You may refer to the conditions of service hereunder.
2858	1	The User is also entitled to:request the access to and rectification or erasure of personal data processed by the YUMOBI TEKHNOLODZHI, OOO;restrict the processing of personal data concerning the User;object to processing of personal data concerning the User;demand for realization of the right to data portability from the YUMOBI TEKHNOLODZHI, OOO; ;exercise the right to lodge a complaint with a relevant supervisory authority.
4696	1	The right to withdraw consent
388	1	Please be aware that not all information sharing is covered by the “Shine the Light” requirements and only information on covered sharing will be included in our response.
2816	0	Data Retention
5138	0	We may make changes to this Privacy Policy. The “Last Updated” date at the bottom of this page indicates when this Privacy Policy was last revised. If we make material changes, we may notify you through the Services or by sending notification or other communication. We encourage you to read this Privacy Policy periodically to stay up-to- date about our privacy practices. Your use of the Services following these changes means that you accept the revised Privacy Policy.
3239	1	You may also request a copy of your personal data collected during your use of the App at support@betterme.tips. If you have connected your Facebook account to our App or used your email for registration in our App, section “Manage personal data” in the App's settings will be available to you. You may select “Request data” there and receive a download link on your email (please note that the link typically expires over a few days). By clicking on the link, you will download a ZIP archive in a .zip file format; the archive will contain .json files that can be easily opened with a common text editor (for example, Notepad).
875	0	(1) We will share your information with third parties only in the ways that are described in this Privacy Policy.
2883	0	12) Investigations and complaints management: We use information you provide to investigate any complaints received from you or from others about our website, or our products and services. We also use data in connection with legal claims, compliance, regulatory and investigative purposes as necessary (including the disclosure of such information in connection with legal process or litigation).
3711	0	Enable features that allow you to share information with other people, such as when you submit a compliment about a driver, refer a friend to Uber, split fares, or share your ETA.
5427	0	Your privacy is critically important to us. Our privacy policy will explain how personal information is collected, used and disclosed by the GeoZilla application and services. If you have questions or complaints regarding our privacy policy or practices, please contact us at support@geozilla.com. Our privacy policy may be modified from time-to-time. We will alert you that changes have been made by indicating on our privacy policy the date it was last updated. If we make any material changes we will notify you by email or by means of a notice on this web site prior to the change becoming effective. We encourage you to periodically review this page for the latest information on our privacy practices.
550	1	Right to request access
4369	1	We provide many choices about the collection, use and sharing of your Information.
5143	0	Cookies are files with a small amount of data that are commonly used as anonymous unique identifiers. These are sent to your browser from the websites that you visit and are stored on your device’s internal memory.
883	0	We may offer you the opportunity to submit other information about yourself (such as gender, age, occupation, hobbies, interests, zip code, language, area code, location, the time zone where a Service is used, mobile device, software, incident data, and network Media Access Control (MAC) address and connection, information about the hardware you may own, your favorite websites, friend information and fan pages), or we may be able to collect that information from social networking systems (“SNS”) on which you have used the Services (in accordance with the terms of use of those systems), which would then also be covered by this Privacy Policy.
3185	1	If we have asked for your consent to our processing of your Personal Data, you have the right to withdraw your consent at any time, in accordance with Article 7 of the GDPR. If you withdraw your consent, we will cease processing of the Personal Data for which you have withdrawn consent, unless we have a legal obligation to keep some or parts of your data. Please note that if you withdraw your consent, your right to play the Game and related services will cease automatically. The withdrawal of your consent does not affect the lawfulness of processing based on your consent before its withdrawal.
5464	1	To protect information from accidental or malicious destruction, we may maintain residual copies for a brief time period (generally several weeks). But, if you delete your account, your information and content will be unrecoverable after that time. Medium may preserve and maintain copies of your information beyond this time period when required to do so by law.
795	0	Data Controller means the natural or legal person who (either alone or jointly or in common with other persons) determines the purposes for which and the manner in which any personal information are, or are to be, processed.
736	1	You may modify your account information on your profile page at any time. If you believe the personal information we have about you is inaccurate, you may also email us at any time to update such inaccurate information.
4099	0	Please be aware that the removal of your information or content may not be complete or comprehensive, and residual copies of such removed information or content may remain on our servers.  In addition, we are not obligated to remove any posted content or information that has been copied or reposted by a third party, that has been rendered anonymous, or that we are required to keep by law.
3286	0	if you are a Buyer, we will share details of the last viewed products on the Platform to enable Sellers to contact you with details of products and/or services that might interest you. You can opt not to share this information with Sellers via the Buyer Privacy Settings here https://profile.alibaba.com/privacy/privacySettingShow.htm.
4571	0	  Location Data
4850	1	Scope. This section provides information on your rights under EU law (for these purposes, reference to the EU also includes the European Economic Area countries of Iceland, Liechtenstein and Norway).
4910	1	any legal or judicial decisions that oppose the erasure
4932	0	When required by applicable law, rule, regulation, legal process, in the process of negotiations of, any mergers and acquisitions, sale of company assets, financing or acquisition of all or a portion of our business by another company where personally identifiable information submitted to us may be transferred to the acquiring entity.
2443	0	I may update our Privacy Policy from time to time. Thus, you are advised to review this page periodically for any changes. I will notify you of any changes by posting the new Privacy Policy on this page. These changes are effective immediately after they are posted on this page.
2958	0	We use the facial tracking and mapping information we collect to enable facial effect features when using the Service.
