	sentiment	review
4380	0	We may use and disclose personal data to enforce our Terms and Conditions of Use, to protect our rights, privacy, safety, or property, and/or that of our affiliates, you or others, and to respond to requests from courts, law enforcement agencies, regulatory agencies, and other public and government authorities, or in other cases provided for by law.
326	1	You may also request a copy of your personal data collected during your use of the App at support@get-headway.com.
1937	0	These third parties have access to your Personal Information only to perform specific tasks on our behalf and are obligated not to disclose or use your information for any other purpose.
2354	1	Your Data Protection Rights (EEA). If you are located in the EEA, you have the right to request access and receive information about the Personal Information we maintain about you, to update and correct inaccuracies in your Personal Information, to restrict or object to the processing of your Personal Information, to have the information blocked, anonymized or deleted, as appropriate, or to exercise your right to data portability to easily transfer your Personal Information to another company. Those rights may be limited in some circumstances by local law requirements. In addition to the above-mentioned rights, you also have the right to lodge a complaint with a competent supervisory authority subject to applicable law.
1717	0	If you have consented to our use of your information you may withdraw that consent at any time. Depending on the situation you can either withdraw your consent by emailing community@canva.com, or through your account settings page. Where we are using your information because of a legitimate interest to do so, you have the right to object to that use. However, if you do so it may mean that it is not possible for you to continue using the Services.
4225	0	Our legitimate interests for this purpose are enforcing our legal rights, preventing and addressing fraud and unauthorised use of the Service, non-compliance with our Terms and Conditions of Use.
3298	0	When you access the Service by or through a mobile device, this Usage Data may include information such as the type of mobile device you use, your mobile device unique ID, the IP address of your mobile device, your mobile operating system, the type of mobile Internet browser you use, unique device identifiers and other diagnostic data.
378	0	There are two basic categories of Personal Information we collect:Personal Information you choose to give us
4081	1	ENFORCEMENTOF YOUR RIGHTS
4800	1	If you are accessing Our Games via Facebook, you may update, amend or delete Your information on Facebook, that we may receive from Facebook, by amending Your Facebook account information in accordance with Facebook’s terms and conditions of use.
1389	0	"While using our Service, we may ask you to provide us with certain personally identifiable information that can be used to contact or identify you. Personally identifiable information may include, but is not limited to, your name (""""Personal Information"""")."
2430	0	Depending on which game or service you use, we collect different kinds of information from or about you.
3098	0	We will not delete personal information if it is relevant to an investigation or a dispute.
4894	0	We reserve the right to change this Policy at any time. If we decide to change this Policy, we will post those changes on this page and update the date at the top of the page. We will also notify changes on various channels we might have to reach you including push notifications (if available), our Facebook page, our Company Website, or via notification directly in our apps. The changes will be effective when posted. Please check this page on a regular basis so that you remain aware of what information we collect and how we use it.
2572	1	Subject to limitations in applicable law, you are entitled to object to or request the restriction of processing of your Personal Data, and to request access to, rectification, erasure and portability of your own Personal Data.
599	0	When you contact us, we may store your correspondence/call records and content or contact details or other information left by you for the purpose of contacting you or helping you resolve issues, or recording the handling plan and outcomes of relevant issues.
2037	1	Pursuant to applicable laws and regulations in your jurisdiction, you may have some or all of the following rights:1.Access to, rectify and/or erase of your personal data retained on our system;2.Withdraw any of your consent already given to us for processing your data;3.Request a copy of your information in a structured, commonly used and machine-readable format, and transmit it to another party.
1605	1	In addition, you can request access to your personal information, request that any inaccuracies be corrected, and request that comments or explanations be added to records about you. You may also request that we transmit to another service provider (where technically feasible) copies of your personal information that is structured and in machine-readable format.
1144	0	If you want to exercise any of your rights listed above please visit Feedback Page or email us at dpo@topface.com.
2620	0	Please be aware that, although we endeavour to provide reasonable security for information we process and maintain, no security system can prevent all potential security breaches.
4131	0	We predominantly use Amazon Web Services, which is certified under the EU – US Privacy Shield Framework, for our Services: https://aws.amazon.com/compliance/eu-us-privacy-shield-faq/
4048	0	Personal Data collected for the following purposes and using the following services:  AdvertisingAdMob
5317	0	"Cookies are not the only way to recognise or track visitors to our Platform.  We may use other, similar technologies from time to time, like web beacons (sometimes called ""tracking pixels"" or ""clear gifs"").  These are tiny graphics files that contain a unique identifier that enable us to recognise when someone has visited our Platform or opened an e-mail that we have sent them.  This allows us, for example, to monitor the traffic patterns of users from one page within our Platform to another, to deliver or communicate with cookies, to understand whether you have come to our Platform from an online advertisement displayed on a third-party website, to improve site performance, and to measure the success of e-mail marketing campaigns.  In many instances, these technologies are reliant on cookies to function properly, and so declining cookies will impair their functioning."
2438	0	LLC «WebmartGroup» hereby undertakes not to conduct any disclosure or transfer of the User’s personal data to any third parties, except Processors, mentioned above, without receipt of personal consent of the User.
4637	0	use any other feature where users could appear under their real names
1336	1	Rights in relation to automated decision-making and profiling: You have the right to be free from decisions based solely on automated processing of your Personal Data, including profiling, unless this is necessary in relation to a contract between you and us or you provide your explicit consent to this use.
4638	0	When you use our Apps, we collect additional information from you by using persistent identifiers that permit identification of your device. We collect information about how you play our Apps, how you interact with our ads in other publisher’s apps and how you interact with third party ads that are shown to you in our Apps. Such information is used for delivering and improving our service, advertising, cross-promotion and analytics purposes.
3069	0	Information you submit to the Sites for publication may be made publicly available on the Sites and therefore accessible by any internet user. You should exercise caution when deciding what information you submit to us for publication.
2845	0	3032, Limassol, Cyprus
1385	0	We apply the following limitations to personal information collection for a user that is not of the minimum legal age required in their country of residence.
4189	1	We respond to all requests we receive from individuals wishing to exercise their data protection rights in accordance with applicable data protection laws.
2028	1	You may delete your chat history stored on imo’s servers by selecting the “Delete chat history” option in the settings of the imo app. You may delete your entire account, by selecting the “Delete imo account” option in the settings. Even if you delete your entire account, we may retain limited information about your mobile device for the purposes of fraud detection and enforcement of our Terms of Service.
4132	0	To manage your account and provide you with customer support
3124	0	LLC “WebmartGroup” stores the personal data relating to the User for 1 (one) year after closing, termination of the Personal account or uninstalling the application. Upon termination of the mentioned term personal data relating to the User are subject to destruction or depersonalization to ensure anonymity of such information via deletion of the personal identifying information.
731	1	We will use reasonable efforts to the extent required by law to supply, correct or delete personal information held about you on our files (and with any third parties to whom it has been disclosed to).
4777	0	Information that is received about you as the result of other users’ actions on the Services (in particular, information posted in chat rooms and forums by other users)
4270	1	1. Right to be informed: what personal data an organisation is processing and why (this notice).
3393	0	The personal data can be stored and processed after this moment for archiving purposes, scientific or historical research purposes or statistical purposes. We will process those personal data which is needed to comply with the requirements of applicable laws (e.g. tax and accounting requirements) or for our detection, investigation and prevention of cheating in the Game and EULA violations.  Also We can process anonymous information for purposes, specified in this Privacy policy, after you request give up Game usage or request Us to delete your personal data.
3652	0	You may enable/disable location sharing with your driver at any time through the Privacy Settings menu in the Uber app. You may use the Uber app if you have not enabled location sharing, but it may be more difficult for your driver to locate you.
5097	1	To register with Adobe, to create an Adobe ID, and to use some Adobe websites, apps, products or services, the provision of some information is mandatory: if relevant information is not provided, then we will not be able to administer an Adobe account to you, or provide you with the websites, apps, products or services requested. All other provision of your information is optional. Providing optional information will help us offer you a better experience, such as more personalized or tailored content or offerings.
2370	1	Through your account settings, you may access, and, in some cases, edit or delete the information you’ve provided to us.
4996	0	Log file information is automatically reported by your browser each time you make a request to access a web page or app. It can also be provided when the content of the webpage or app is downloaded to your browser or device. We may also collect similar information from emails sent to our Users which then help us track which emails are opened and which links are clicked by recipients. The information allows for more accurate reporting and improvement of the Service.
5067	1	Under the applicable laws, you may have the rights of access to Personal Data held by us and other rights.  If you are a Visitor from the European Union, please refer to section I. VISITORS FROM THE EUROPEAN UNION below for more information.
2326	0	We are the controller of the personal information collected. We only collect, use, store and transfer (“process”) your personal information in accordance with applicable data protection legislation, including but not limited to, the (EU) General Data Protection Regulation (2016/679) (“GDPR”) and applicable national data protection legislation.
3146	1	You have the right to withdraw consent that you have given to the collection and processing of your personal data at any time. If you do withdraw your consent to the collection and processing of your personal data, that withdrawal shall not affect the lawfulness of any processing by Overmobile that is based on the consent you have given before you withdrew it.
2461	1	Where the use of your information is based on consent, you can withdraw this consent at any time without affecting the lawfulness of processing based on consent before its withdrawal. Requests should be submitted by contacting us through [dpo@ushareit.com].
1604	1	Where required by law, we obtain your consent for the processing of certain Personal Information collected by cookies or similar technologies, or used to send you direct marketing communications, or when we carry out other processing activities for which consent may be required. If we rely on consent for the processing of your Personal Information, you have the right to withdraw it at any time and free of charge. When you do so, this will not affect the lawfulness of the processing before your consent withdrawal.
154	1	In compliance with legal provisions, you have a general right to access, edit and delete your personal information which have been collected pursuant to your access to and/or use of the Service. In order to exercise this right, please contact us through the email displayed below.
4573	0	Please also see the Adobe Terms of Use and any additional Terms of Use or Product License Agreements that may apply to the app or website you are using. 
2896	1	the personal data have to be erased for compliance with a legal obligation in Union or Member State law,
3277	0	We will only process or use your data to the extent you have consented. We reserve the right to require you to renew your consent, if we believe that any process or usage is outside the scope of the purposes to which you initially consented. In which case, we may additionally request consent through in-app communications, or other means you have authorized us to contact you by. At all times, you may withdraw your consent to any use or processing of your data by contacting us at Privacy@Camsurf.com in which event your request will be directed to our Privacy Officer.
3283	1	Not all personal data processed by Microsoft can be accessed or controlled via the tools above. If you want to access or control personal data processed by Microsoft that is not available via the tools above or directly through the Microsoft products you use, you can always contact Microsoft at the address in the How to contact us section or by using our web form.
4740	1	Please note that we may ask you to verify your identity before responding to such requests.
2533	0	Personal Data
3303	1	User content, including text, images and videos you have uploaded to the site
4848	0	When you use the Service, we may employ clear GIFs (also known as web beacons) which are used to anonymously track the online usage patterns of our Users. In addition, we may also use clear GIFs in HTML-based emails sent to our users to track which emails are opened and which links are clicked by recipients. This information allows for more accurate reporting and improvement of the Service.
1753	1	You have choices with respect to cookies. By modifying your browser preferences, you can choose to accept all cookies, to be notified when a cookie is set, or to reject all cookies. If you choose to reject all cookies, some parts of our Services may not work properly.
3595	0	Your information collected through the App may be stored and processed or any other country in which Filmigo or its subsidiaries, affiliates or service providers maintain facilities. If you are located in the European Union or other regions with laws governing data collection and use that may differ from law of the company's location, please note that we may transfer information, including personal information, to a country and jurisdiction that does not have the same data protection laws as your jurisdiction, and you consent to the transfer of information to any other country in which Company or its parent, subsidiaries, affiliates or service providers maintain facilities and the use and disclosure of information about you as described in this Privacy Policy.
314	0	Last updated: 1 September 2018
895	0	Communications. If you contact us directly, we may receive additional information about you. For example, when you contact our customer support team, post in chat sessions or request to receive updates about our product launches, we may receive your name, email address, phone number, the contents of a message or attachments that you may send to us, and other information you choose to provide.
3923	0	Methods for destroying personal data
880	1	You can always opt not to disclose information to us, but keep in mind some information may be needed to register with us or to take advantage of some of our features.
2475	0	We may process, use, or share your data when the law requires it, in particular, if a law enforcement agency requests your data by available legal means.
1492	1	5.1. If and to the extent applicable data protection regulation provides so, you have the right to access, rectify and erase the personal data we hold about you and to restrict or object to our processing of your personal data.
2025	1	Although imo makes good faith efforts to provide Individuals with access to their personal information, there may be circumstances in which imo is unable to provide access, including but not limited to: where the information contains legal privilege, would compromise others’ privacy or other legitimate rights, where the burden or expense of providing access would be disproportionate to the risks to the Individual’s privacy in the case in question or where it is commercially proprietary. If imo determines that access should be restricted in any particular instance, we will provide you with an explanation of why that determination has been made and a contact point for any further inquiries. To protect your privacy, imo will take commercially reasonable steps to verify your identity before granting access to or making any changes to your personal information.
186	1	You may correct information associated with your account from the Settings page, and the Customize Your Interests page to update your interests.
2429	0	Certain usage related information regarding your use and interaction with the Software and the Service, such as how frequency you use them, your search queries and the time and date of your searches.
1871	0	  Use of Data
3233	0	3.4 Exceptions to Obtaining Prior Authorization and Consent when Sharing, Transferring and Publicly Disclosing Personal Information
5185	0	We also collect information you choose to provide to us when you complete any “free text” boxes in our forms (for example, support request or survey submission). In addition, we may collect Personal Data disclosed by you on our forums, blogs and our other areas of the Services to which you can post information and materials.
3573	1	Access to Personal Information
308	0	We communicate with you, for example, by push notifications. These may include reminders and motivational messages encouraging you to continue reading books’ summaries, or other information about the App. As a result, you may, for example, receive a push notification every day at a particular time reminding you to do read a summary on a book. To opt out of receiving push notifications, you need to change the settings on your device.
3631	1	10.2. You may also withdraw Your consent for Us to process Your data at any time by notifying Us in writing by contact e-mail, specified in this Privacy Policy (Chapter 1 “Contacting CarX Technologies” of this Privacy Policy). But if You withdraw Your consent to all or certain types of processing described above We may be unable to maintain Your membership of the Games and you may no longer be able to access the Games, if it will be technically or practically impossible.
890	0	Candivore (‘we’, ‘us’ and ‘our’) respects the privacy of everyone who plays our games and is dedicated to protecting the privacy rights of our users. This Privacy Policy describes how and what information we collect, store and use, and how we manage the information, including personal information, that you provide or we collect only in connection with our websites or any Candivore game provided on a mobile platform.
180	0	Mobile advertising identifiers are identifiers used by mobile operating systems (Apple and/or Android) and made available to advertising providers to gather metrics on mobile apps (Apple’s IDFA or Google’s AAID) to help advertisers provide ads that may be more relevant to your interests.
174	0	To collect aggregated data from your chat history. We use the data to build language models which help us improve the Service. We will only collect this data on an aggregated basis, and in a manner which does not reveal any personally identifiable information about any individual user. We will use this data to help us understand our users’ interests, analyze trends, and customize the user experience.
3419	1	You have the following data protection rights:You may opt-out of receiving promotional communications, such as marketing emails we send you, at any time. If you wish to do so, please e-mail us at the address provided in the “Contact Us” section below. You can turn off push notifications by visiting the“options”or“settings”page within the relevant game.
4963	1	In certain circumstances, you have the following data protection rights:The right to access, update or to delete the information we have on you. Whenever made possible, you can access, update or request deletion of your Personal Data directly within your account settings section. If you are unable to perform these actions yourself, please contact us to assist you.
5046	1	When you request deletion of your personal data, we will use reasonable efforts to honor your request. In some cases we may be legally required to keep some of the data for a certain time; in such event, we will fulfill your request after we have complied with our obligations.
492	1	You can request a download of your account information. To request a download, navigate to the “Request Account Info” button inside the Settings section of the app. You may edit your account information via the app.
2541	0	We at Narvii know you care about how your personal information is used and shared, and we take your privacy seriously. Please read the following to learn more about our Privacy Policy. By using or accessing the Services in any manner, you acknowledge that you accept the practices and policies outlined in this Privacy Policy, and you hereby consent that we will collect, use, and share your information in the following ways.
2247	1	If we decide to respond to your request for deletion, we will also exercise our best efforts to notify the parties who have obtained your personal information from us, and request them to delete the personal information in a timely manner, except as otherwise provided for by laws and legislations, or when these parties have obtained your separate authorization.
1381	0	Please note: You can find published age recommendations on: Apple’s App Store on iTunes, Google Play, Amazon App Store and Windows App Store . However, these age or maturity classifications refer only to the content in our games (similar to movie ratings G, PG or PG-13 in the U.S., but related to gameplay, animations, etc.). For more on how these categories are defined, visit these support websites for Apple, Google, Amazon and Windows.
4973	0	Wherever we rely on your consent, you will always be able to withdraw that consent, although we may have other legal grounds for processing your data for other purposes, such as those set out above. In some cases, we are able to send you direct marketing without your consent, where we rely on our legitimate interests. You have an absolute right to opt out of direct marketing, or profiling we carry out for direct marketing, at any time. You can do this by contacting us using the details set out below.
3465	1	In some circumstances Canva may not be able to comply with a request that you make in respect of your personal data. For example, we may not be able to provide a copy of your information where it infringes on the rights of another User. We may also be required to retain certain information that you ask us to delete for various reasons, such as where there is a legal requirement to do so. In some cases, you may have shared your information with third parties, such as by publishing a design on a third partyﾡﾯs website. In that case Canva will not be able to delete the information, and you will need to contact that third party directly.
4500	1	You have the right to access your personal information, except in exceptional circumstances provided for by laws and legislations. You can access your personal information on your own by the following means:Profile-If you wish to access or edit the nickname, profile photo, signature, job and address information, interests, questions and answers, etc., in your profile, you can view the profile by clicking the profile photo on the left side of the page on Tantan
4317	1	The User is empowered to request one copy of the personal data undergoing processing free of charge. Any additional copies are provided on a reimbursement basis.
