	sentiment	review
3586	1	9.1.3 Cookies are also used to trace your access to our websites. We will acquire information in personal, identifiable modes including your IP address. However, such information will merely be used for analysis and will be limited to the use according to the minimum requirement for the execution of such analysis.
4071	0	Sharing with Data Processors
1042	1	Members’ options regarding cookies
2046	1	You may change your browser settings or take other steps to disable, limit, delete or otherwise manage cookies. Disabling or limiting cookies may cause some parts of our Services not work as intended and some features may not be available. We currently do not recognize or respond to “Do Not Track” signals.
3749	1	"We and our marketing and outsourcing partners, affiliates, or analytics service providers use technologies such as cookies, beacons, scripts, and tags to identify a user's computer/device and to ""remember"" things about your visit, such as your preferences or a user name and password.  Information contained in a cookie may be linked to your personal information, such as your user ID, for purposes such as improving the quality of our Services, tailoring recommendations to your interests, and making the Service easier to use.  You can disable cookies at any time, although you may not be able to access or use features of the Service."
3269	1	You are not obligated to accept cookies. The Help portion of the toolbar on most browsers will tell you how to prevent your browser from accepting new cookies or how to disable cookies altogether. Please note that if you refuse to accept cookies, you may not be able to access many of the travel services offered on our site.
5076	1	Web beacons. The Game may use a variety of technical methods for tracking purposes, including “Web beacons” etc. Web beacons are small pieces of data that are embedded in images on the pages of the Game. We may also use these technical methods to analyze the traffic patterns in the Game such as the frequency with which End Users accesses various parts of the Game etc. These technical methods may involve the transmission of information either directly to us or to another party authorized by us to collect information on our behalf. The information from use of these technical methods may be collected in a form that is personally identifiable.
968	1	Google Analytics Help Center: https://developers.google.com/analytics/devguides/collection/analyticsjs/cookie-usage
990	1	Advertisers may also place cookies in your browser that may allow them to collect certain information about your browsing history. To find out more about how to exercise choices with respect to certain third party cookies, including opting out of receiving such cookies, visit the Digital Advertising Alliance’s Self-Regulatory Program for Online Behavioral Advertising at www.aboutads.info, or the Network Advertising Initiative at www.networkadvertising.org. If you use Tunnellight VPN VIP, the VIP subscription based version of our product, we will not serve any ads and thus no information will be collected by our third party ad partners on the Tunnellight VPN Premium product.
1489	1	Our website uses cookies and similar technologies to make the site work and improve your user experience. By using this website, you consent to the use of cookies. Read our updated Cookie Policy to learn more.
3938	0	SayGames has the following contact information:SayGames LLC
4888	0	We sometimes use capitalized terms in this Privacy Policy; if they’re not defined here, they’re defined in our Terms of Service. PageBites, Inc. is the legal name for imo, however, we will use imo throughout this Privacy Policy when referring to the imo communication service that we provide through applications that we offer on various mobile operating systems and on Windows and Mac personal computer operating systems (collectively, the “Service”).
3799	0	the categories of personal data concerned
3910	1	You have the right to decide whether to accept or reject cookies. If you choose to set your web browser controls to reject cookies, you may still use our website though your access to some functionality and areas of our website may be restricted.
234	0	"We collect and use your personal information for the following purposes:verifying your identity and conducting security, KYC (know-your-customer) and anti-money laundering diligence and background checks in order to set up user accounts;verifying your eligibility to register as a Platform user in accordance with our Terms of Use here;setting up / administering user accounts, including providing log-in IDs and developing a Platform profile; providing users with customer service support; responding to queries, feedback, and managing claims and/or disputes;facilitating communication between Buyers and Sellers via the Platform, processing transactions and settlement between Buyers and Sellers made over the Platform, assessing fund withdrawal requests from Sellers;providing logistics and warehousing services (including, without limitation, customs clearance declarations via the Platform);facilitating customs clearance declarations / applications via the Platform;assessing and monitoring account security and transaction risks of users of Alibaba.com, detecting and preventing fraud, money laundering and other security incidents;personalizing our marketing and communications with you based on your browsing records, and your order history; performing research or statistical analysis in order to improve the content and layout of the Platform, and to improve the product offerings and services on Alibaba.com, including, for example, using anonymized data for machine learning purposes; identifying, developing and marketing and advertising products and services that we believe you will value, including across browsers and devices, in accordance with applicable laws. Cookies or other similar technologies may be used to provide you with advertising based upon your browsing activities and interests (see section E. ""COOKIES"" below).  Where we are required by applicable law, we will seek your consent prior to sending you communications for marketing purposes; "
2357	1	We employ or our third party tracking utility partner employs a software technology called clear gifs (a.k.a. Web Beacons/Web Bugs), that help us better manage content on our site by informing us what content is effective. Clear gifs are tiny graphics with a unique identifier, similar in function to cookies, and are used to track the online movements of Web users. In contrast to cookies, which are stored on a user’s computer hard drive, clear gifs are embedded invisibly on Web pages or e-mails and are about the size of the period at the end of this sentence. We may associate this information with your IP address or device identifier but do not tie the information gathered by clear gifs to our customers’ personal information.
5436	0	You may update your account information by logging into your account and changing your profile settings. You can also stop receiving promotional email communications from us by clicking on the ﾡﾰunsubscribe linkﾡﾱ provided in such communications. We make every effort to promptly process all unsubscribe requests. You may not opt out of Service-related communications (e.g., account verification, purchase and billing confirmations and reminders, changes/updates to features of the Service, technical and security notices). If you have any questions about reviewing or modifying your account information, you can contact us directly at community@canva.com.
1733	1	Cookies will expire once the user closes the browser or logs out of the browser.
2458	1	This Service does not use these “cookies” explicitly. However, the app may use third party code and libraries that use “cookies” to collect information and improve their services. You have the option to either accept or refuse these cookies and know when a cookie is being sent to your device. If you choose to refuse our cookies, you may not be able to use some portions of this Service.
5094	1	IP addresses. Ubisoft also keep tracks of Internet Protocol (IP) addresses for safety and security reasons. An IP address is a number that is used by computers on the network to identify your computer every time you log on to the Internet.
3774	1	Clear gifs/web beacons information
84	0	You may also reach us by the following address:Bigo Technology Pte. Ltd.
2462	1	The only cookies we use are those to operate and provide our Services on the web. We do not use cookies for profiling or advertising. The cookies we use are small text files that allow us to provide and customize our Services, and in doing so provide you with an enhanced user experience. Your browser should allow you to control these cookies, including whether or not to accept them and how to remove them. You may choose to block cookies with your web browser, however, if you do disable these cookies you will not be able to log in to Telegram Web.
3556	1	6.4 You can find out more about internet advertising by visiting the following websites:www.allaboutcookies.org, www.yourchoicesonline.eu, andwww.networkadvertising.org. Some of these sites enable you to opt out of online behavioural advertising and other tracking cookies (in addition to the control settings on your browser).
4982	0	Public information can be seen by anyone, on or off our Products, including if they don't have an account. This includes your Instagram username; any information you share with a public audience; information in your public profile on Facebook; and content you share on a Facebook Page, public Instagram account or any other public forum, such as Facebook Marketplace. You, other people using Facebook and Instagram, and we can provide access to or send public information to anyone on or off our Products, including in other Facebook Company Products, in search results, or through tools and APIs. Public information can also be seen, accessed, reshared or downloaded through third-party services such as search engines, APIs, and offline media such as TV, and by apps, websites and other services that integrate with our Products.
166	1	You are entitled to choose whether or not you would like to use cookies. If you do not approve to the use of cookies, please be sure to opt out, as in block or disable them using your browser settings. If you disable cookies, however, you may not be able to use all portions or functionalities of the Services.
5317	1	"Cookies are not the only way to recognise or track visitors to our Platform.  We may use other, similar technologies from time to time, like web beacons (sometimes called ""tracking pixels"" or ""clear gifs"").  These are tiny graphics files that contain a unique identifier that enable us to recognise when someone has visited our Platform or opened an e-mail that we have sent them.  This allows us, for example, to monitor the traffic patterns of users from one page within our Platform to another, to deliver or communicate with cookies, to understand whether you have come to our Platform from an online advertisement displayed on a third-party website, to improve site performance, and to measure the success of e-mail marketing campaigns.  In many instances, these technologies are reliant on cookies to function properly, and so declining cookies will impair their functioning."
5435	1	Do Not Track (“DNT”) is a privacy preference that users can set in certain web browsers and devices. DNT is a way for users to inform websites and services that they do not want certain information about their webpage visits collected over time and across websites or online services. Please note that we do not respond to or honor DNT signals or similar mechanisms transmitted by web browsers.
3383	1	Advertising Cookies. Advertising Cookies are used to serve you with advertisements that may be relevant to you and your interests.
5222	0	With your consent
3876	0	Third parties as part of a merger or acquisition
1559	0	Compliance with Laws and Law Enforcement Requests; Protection of Peekaboo Moments's Rights. We may disclose to parties outside Peekaboo Moments files stored in your Peekaboo Moments and information about you that we collect when we have a good faith belief that disclosure is reasonably necessary to (a) comply with a law, regulation or compulsory legal request; (b) protect the safety of any person from death or serious bodily injury; (c) prevent fraud or abuse of Peekaboo Moments or its users; or (d) to protect Peekaboo Moments’s property rights. If we provide your Peekaboo Moments files to a law enforcement agency as set forth above, we will remove Peekaboo Moments’s encryption from the files before providing them to law enforcement. However, Peekaboo Moments will not be able to decrypt any files that you encrypted prior to storing them on Peekaboo Moments.
4549	0	We respond to all requests we receive from individuals wishing to exercise their data protection rights in accordance with applicable data protection laws.
218	0	Business Transfers. Your Personal Information may also be used by us or shared with our affiliates controlled by the Organization for internal reasons. If another entity acquires us or all or a portion of our assets, Personal Information, Usage Information, and any other information that we have collected about the users of the Services may be disclosed to such entity as part of the due diligence process and will be transferred to such entity as one of the transferred assets. Should such a sale or transfer occur, we will use reasonable efforts to direct the transferee to use information you have provided through the Services in a manner that is consistent with this Policy. Also, if any bankruptcy or reorganization proceeding is brought by or against us, all such information may be considered an asset of ours and as such may be sold or transferred to third parties.
2893	1	We may feature advertisements served by third parties that deliver cookies to your computer/device so the content you access and advertisements you see can be tracked. Since the third party advertising companies associate your computer/device with a number, they will be able to recognize your computer/device each time they send you an advertisement. These advertisers may use information about your visits to our Service and third party sites and applications in order to measure advertisement performance and to provide advertisements about goods and services of interest to you. This Policy does not apply to, and we are not responsible for the data collection practices of these third party advertisers, and we encourage you to check their privacy policies to learn more about their use of cookies and other technology.
2977	0	If you contact us by email and other means (Twitter, Facebook etc) we may keep a record of your contact information and correspondence and will use these contact info and correspondence if we respond to you.
4109	0	Content Information, i.e. photos, pictures, video and audio files, documents and other data that you upload using the App.
1646	1	When you access the Service by or through a mobile device (including but not limited to smart-phones or tablets), we may access, collect, monitor and/or remotely store one or more ﾡﾰdevice identifiers,ﾡﾱ such as a universally unique identifier (ﾡﾰUUIDﾡﾱ). Device identifiers are small data files or similar data structures stored on or associated with your mobile device, which uniquely identify your mobile device. A device identifier may be data stored in connection with the device hardware, data stored in connection with the deviceﾡﾯs operating system or other software, or data sent to the device by Canva. A device identifier may convey information to us about how you browse and use the Service. A device identifier may remain persistently on your device, to help you log in faster and enhance your navigation through the Service. Some features of the Service may not function properly if use or availability of device identifiers is impaired or disabled. Device Identifiers used by Canva include the Android Advertising ID and iOS Advertising Identifier.
297	1	By adjusting the web browser, the Members can choose whether to accept all cookies, to be notified when cookies are installed, or deny all cookies; provided, however, if a Member refuses to install cookies, he/she cannot use some of the services that require the Member to log in.
1480	1	Authentication These cookies help us to identify our members so that when you’re logged in, you can enjoy Topface s offerings, experiences and various features, such as uploading photographs, chatting and can localise your experience, such as when you’ve requested to view Topface’s site in your local language or when you’ve asked Topface to ‘remember me’. These cookies also help to remember who invited you to join Topface
1236	0	NUMBER FINDER may provide links to other websites through the mobile applications by NUMBER FINDER or connected to NUMBER FINDER. NUMBER FINDER can publish the advertisements, application forms, announcements, surveys of 3rd parties which had an agreement with. NUMBER FINDER may lead the Users through these forms, announcements, surveys and advertisers to websites / services / to mobile applications of the advertising or negotiated 3rd parties. NUMBER FINDER bears no liability in relation to any kind of privacy practices and policies of the third party web sites and / or mobile applications accessed through this link, and also for any visual, textual or any kind of content that they contain.
2435	0	The rights listed above may not apply in all cases. For example, if you ask us to delete information which we are required by law to keep or have compelling legitimate interests in keeping, we may not be able to delete all of your personal information, in which case we will inform you of the relevant exceptions.
945	1	"In addition we also use social media cookies. Some pages on our Sites allow you to ""share"" content through social media such as Facebook and Twitter. Sometimes we embed videos from websites like YouTube. These websites set their own cookies on which we have no influence. To refuse their cookies, please follow the instructions on their websites. In addition, these websites have their own privacy policy, which you can find on the respective websites."
1909	0	California residents under the age of 18 have the right to request removal of any content or information that he or she posted anywhere within our Services, such as public forum or message boards in our Websites or Applications.  You can make this request by contacting us at netmarbles@igsinc.co.kr.
1844	0	For external processing
679	0	a. Personal Information. We do not collect Personal Information. &ldquo;Personal Information&rdquo; is information that identifies you or another person, such as your first name and last name, physical addresses, email addresses, telephone, fax, SSN, information stored within your device.
5143	1	Cookies are files with a small amount of data that are commonly used as anonymous unique identifiers. These are sent to your browser from the websites that you visit and are stored on your device’s internal memory.
2758	1	Personalization cookies may also include social media cookies which are used to enable you to log into our Platform using your social media accounts and to share pages and content that you find interesting on our Platform through third party social networking and other websites.  These cookies may also be used for advertising purposes too.
3195	1	Information we automatically collect when you use our Services:  Some Personal Data is automatically collected when you use our Services, such as the following:Device identifiers
476	1	We use cookies and similar technologies such as local storage within our apps to provide and optimise our Service. You can control which cookies you get and which you keep on your device through your browser settings. Unless you have adjusted your browser settings so that it will refuse our cookies, our system will issue cookies when you visit our website. However, if you do not accept cookies you may not be able to take advantage of many of the special features of the Service
2220	0	We provide you with the ability to access, rectify, port and erase your data. Learn more in your Facebook Settings and Instagram Settings.
4495	0	Advertising network companies in order to serve contextual advertisements (the data include your IP-address, Device ID and advertising ID).
2442	1	You can find out more about our use of cookies and such technologies in our Cookie Policy here. The Cookie Policy forms part of this Privacy Policy.
5057	1	Cookie data.  We also use “cookies” (small text files sent by your computer each time you visit our website, unique to your Pinterest account or your browser) or similar technologies to capture log data. When we use cookies or other similar technologies, we use session cookies (that last until you close your browser) or persistent cookies (that last until you or your browser delete them). For example, we use cookies to store your language preferences or other settings so you don‘t have to set them up every time you visit Pinterest. Some of the cookies we use are associated with your Pinterest account (including information about you, such as the email address you gave us) and other cookies are not. For more detailed information about how we use cookies, please review our Cookies Policy.
5395	0	We also collect data for:Advertising
2608	1	Analyzing site traffic and trends, and generally understanding the online behaviors and interests of people who interact with our services We may also allow others to provide audience measurement and analytics services for us, to serve advertisements on our behalf across the Internet, and to track and report on the performance of those advertisements. These entities may use cookies, web beacons, SDKs, and other technologies to identify your device when you visit our site and use our services, as well as when you visit other online sites and services. Please see our Cookie Statement for more information regarding the use of cookies and other technologies described in this section, including regarding your choices relating to such technologies.
168	1	Cookies. We use “cookies” – small data files – to collect this information, which allows us to identify your browser and to improve your use of our services when you access our website. You can reset your web browser to refuse all cookies or to indicate when a cookie is being sent, however, some features of our services may not function properly if the ability to accept cookies is disabled.
1930	0	4. Right to erasure: you have the right to have your data deleted in certain circumstances.
5348	0	This Privacy Policy may be updated from time to time for any reason. We will notify you of any changes to our Privacy Policy by posting the new Privacy Policy here and informing you via email or text message. You are advised to consult this Privacy Policy regularly for any changes, as continued use is deemed approval of all changes. You can check the history of this policy by clicking here.
4893	0	903 26 Umeå
3373	1	"A cookie is a small data file that LONG TECH NETWORK LIMITED transfers to users’ computer’s hard disk, generally to quickly identify a user's computer and to ""remember"" things about the user's visit, such as the user’s preferences or a user’s name and password. The Service sends cookies to users’ computers when users access or view content of an LONG TECH NETWORK LIMITED game. Information contained in a cookie may be linked to users’ personal information for purposes such as improving the quality of our service, tailoring recommendations to users’ interests, and making the Service easier to use. Users can disable cookies at any time, although users may not be able to access or use features of the Service."
4165	1	We and/or our web-space providers collect data about every access to our services (that includes our websites) (via what is referred to as server log files). This data includes: user’s activity data in applications, including progress in the game, ID numbers generated automatically, the user’s operating system, the referrer URL (the previously visited page), the IP address and the requesting provider. We only use the log data for analyses, bug tracking, for the purposes of operating, fraud prevention, securing and optimizing the offer and/or the product.
2281	1	Medium doesn’t track you across the Internet. We track only your interactions within the Medium network (which encompasses Medium.com and custom domains hosted by Medium).
5169	0	The right to object
4389	1	In some cases, the site feature you choose may allow a third party to place cookies or local storage devices on your computer. The third party who places cookies on your device is responsible for how they process their data and Topface recommends that you read their privacy policies. Third parties who place cookies on your device when you use Topface include, and we have included a link to their privacy policies:Twitter, https://twitter.com/privacyFacebook, https://en-gb.facebook.com/policy.phpYouTube, http://www.google.co.uk/intl/en/policies/privacy/VK.COM, https://vk.com/privacyOK.RU, https://ok.ru/privacy
5064	1	The specific categories of first and third party cookies served through our Platform and the purposes they perform are described in the table below (please note that the specific cookies served may vary):Types of cookie
4918	0	marketing partners (in particular, social media networks, marketing agencies, email delivery services)
