	sentiment	review
3920	1	Uber and its partners use cookies and other identification technologies on our apps, websites, emails, and online ads for purposes described in this policy.
2947	1	 Provide personalized service to Members on their next visit/use by tracking content that the Members showed an interest in.
1971	0	Uber may provide information to its vendors, consultants, marketing partners, research firms, and other service providers or business partners. This may include, for example:Payment processors and facilitators.
1632	0	"Ubisoft may also collect personal information on third party network, platform or service: by playing a Ubisoft game through a social network or other third party platform, or by connecting to such a third party network, platform or service via one of our products and/or Services, you are authorizing Ubisoft to (1) collect, store, and use, in accordance with this Privacy Policy, any and all personal information that you agreed the social network or other third party platform could provide to Ubisoft based on your settings on the third party social network or platform and (2) share any and all of your personal information with the social network or other third party platform, through the social network/third party platform’s Application Programming Interface (API).  Your agreement to this takes place when you connect with the third party network, platform or service via our products and/or services, and/or when you connect with, ""accept"" or ""allow"" (or similar terms) one of our applications through a social network, or other third party platform or service."
1535	1	"You can determine if and how a cookie will be accepted by configuring the privacy setting of the browser you are using to access the Platform or the ""privacy setting"" of your device. As the means by which you can refuse cookies through your web browser controls vary from browser-to-browser, you should visit your browser's help menu for more information. If you adjust the privacy setting in the browser, your device will continue collecting data unless you adjust the privacy setting of the device, and vice versa"
2316	0	You have the right to request access to your Personal Data collected through our Services. Following your request, we will provide you a copy of your Personal Data in an electronic format.
2390	1	9.1.4 If you do not want CXZH.LTD to transfer Cookies into your web browser, you may change your web browser setting to refuse Cookies or notify you when any website is attempting to this transaction. This refusal shall affect your option to use certain products and/or services provided on our websites.
4730	1	More information on how third parties may use cookies in our Services go to Appendix A and Appendix B further below.
4679	0	·      To protect the rights of users of FINDNOW or any other persons’ rights or security,
1303	1	Do we use 'cookies'?
36	0	If you wish to use any of the rights described below, you may contact us at any time by emailing us at support@alexandragames.com.
2974	0	We use this information in order to manage and administer the Services including providing our Services to you.
780	0	Public Posting/ Shared Content: Some of our Games allow users to post, share, communicate with, or otherwise transmit content publicly, such as by participating in player forums, message boards, news feeds, status updates, sending messages or invitations to other users, chatting with other users, and/or posting photos (collectively, “Public Postings”). We may collect and store archives of such Public Postings on Netmarble servers, and all Public Postings are subject to this Privacy Policy.
2782	1	"A cookie is a small text file that we transfer to your computer and/or device, to identify a user's computer/device and to ""remember"" things about your visit, such as your preferences or a user name and password."
3912	1	We use cookies and other technologies to track the use of our websites and apps. To learn about opportunities to choose not to allow cookies, click here. If you are using our Site in a browser, this information is also available in our Cookies Policy.
2882	0	During the course of your usage of the Service, in order to access features, or enable certain services, that may be offered now or in the future. You may be required to provide us with Personal Information which may include your name, e-mail address, physical address, and phone number.
4339	0	The withdrawal of your consent does not affect the lawfulness of processing based on your consent before its withdrawal.
1902	0	4.2 We have an industry-leading data security management system addressing the data lifecycle with data at the core, and improve the security of the whole system in multiple dimensions ranging from organizational development, system design, personnel management, product technology and other aspects.
3619	1	Do Not Track (“DNT”) is a privacy preference that users can set in certain web browsers and devices. DNT is a way for users to inform websites and services that they do not want certain information about their webpage visits collected over time and across websites or online services. Please note that we do not respond to or honor DNT signals or similar mechanisms transmitted by web browsers.
3679	1	"This section explains how we use cookies and similar technologies (we'll refer to them collectively as ""cookies"") to recognize you when you visit our Platform. It explains what these technologies are and why we use them, as well as your rights to control them. "
1513	0	These ones speak for themselves.
3403	1	Whenever you interact with our Services, we automatically receive and record information on our server logs from your browser or device, which may include your IP address, device identification, “cookie” information, the type of browser and/or device you’re using to access our Services, the page or feature you requested and the Content that you have already accessed. “Cookies” are identifiers we transfer to your browser or device that allow us to recognize your browser or device and tell us how and when pages and features in our Services are visited and by how many people.  You may be able to change the preferences on your browser or device to prevent or limit your device’s acceptance of cookies, but this may prevent you from taking advantage of some of our features.
4419	1	6.3 All of the major browsers offer tips and guidance for managing the cookies available on your browser. There are also lots of different third party browser plugins and extensions available which you can download to make it easier to see and control your cookies.
891	0	For Canva users in the the European Economic Area (EEA) Canva processes your information in accordance with European laws and regulations such as the General Data Protection Regulation (GDPR). The GDPR governs how Canva may process your information, and the rights that EEA users have in relation to it. This means that Canva will collect and use your information only where:
5180	0	We may use Your information for the following purposes:(a)to administer Your membership account and identify You as the user of the Game;(b)to enable Us to provide You with access to the Games and Services and adjust You to the Game ID;(c)to enable You to download information and materials from the Games and Services;(d)to provide You with services You subscribed to;(e)to display Your username and contact details (for example, your nickname) to other players;(f)to enable other members of the Games to contact You;(g)to provide customer service in relation to Your use of the Games;(h)to administer, support, improve and develop the Games;(i) to control the quality of the Games;(j) to conduct the internal analytics (including without limitation for displaying advertisement and Our promotions).
3093	1	Cookies are files with a small amount of data that are commonly used as anonymous unique identifiers. These are sent to your browser from the websites that you visit and are stored on your device's internal memory.
1151	0	Records relating to advertisement and labelling
1499	1	We want to inform you that whenever you use our Service, in a case of an error in the app we collect data and information (through third party products) on your phone called Log Data. This Log Data may include information such as your device Internet Protocol (“IP”) address, device name, operating system version, the configuration of the app when utilizing our Service, the time and date of your use of the Service, and other statistics.
3016	0	Right to data portability: You have the right to obtain your Personal Data from us that you consented to give us or that was provided to us as necessary in connection with our contract with you. We will give you your Personal Data in a structured, commonly used and machine-readable format. You may reuse it elsewhere.
4505	0	If you are based in the European Union, you have the following rights in relation to your information:(i) a right to access your information as held by us;(ii) a right to receive certain information in machine-readable format;(iii) a right to object to processing where the lawful basis is that it is in our legitimate interests, but please note that we may still process your information where there are other relevant lawful bases or where we have compelling grounds to continue processing your information in our interests which are not overridden by your rights, interests or freedoms;(iv) a right to have inaccurate information rectified;(v) a right to have certain information erased where it is no longer necessary for us to process it, where you have withdrawn your consent pursuant to paragraph (viii), where you have objected pursuant to paragraph (iii), where your information has been unlawfully processed, or where erasing your information is required in accordance with a legal obligation;(vi) a right to request an explanation of the logic involved where we make decisions about you solely through automated means;(vii) a right to complain to your national data protection regulator;(viii) where we have specifically requested your consent to process your information and have no other lawful conditions to rely on, you have the right to withdraw this consent; and(ix) a right to object to direct marketing, which can be done by opting-out of direct marketing either through your account or by opting out via the communication itself. You also have a right to object to any profiling to the extent that it relates to direct marketing only.
4646	1	How can I control cookies?
4267	1	9.4 We use mobile analytics software to allow us to better understand the functionality of our Mobile Software on your phone. This software may record information such as how often you use the application, the events that occur within the application, aggregated usage, performance data, and where the application was downloaded from. We do not link the information we store within the analytics software to any personal identifiable information you submit within the mobile applications.
2793	1	We may use persistent cookies, which will help us to ensure we have identified the same device is logging into the correct account. These types of cookies also help with our anti-spam measures and may help us to prevent phishers, scammers, unauthorised log -in attempts to your account and accessing any hacked accounts.
116	1	Google Analytics To understand how people use our site, and to discover areas on our site with issues, we use Google Analytics. Most websites use some sort of analytics program like this. The data it collects helps us see things like how many people visit our site, which country they are from, how many pages they visited, how fast our site loaded, and so on. All data collected is completely anonymous, it does not identify you as an individual in any way. You can find morre information about the Google Analytics cookies in the Google Developers web page.
3246	1	Most Microsoft sites use cookies, small text files placed on your device which web servers in the domain that placed the cookie can retrieve later. We use cookies to store your preferences and settings, help with sign-in, provide targeted ads, and analyze site operations. For more information, see the Cookies and similar technologies section of this privacy statement
4047	1	Some cookies are necessary to enable a game to function properly and to allow your gameplay experience to continue from one session another. Other cookies can show, for instance, which parts of our games are the most popular, how much time users are spending there, and how they are interacting with the content.
4479	0	4.1. We take technical and organizational measures to ensure that your data is safe. Please note that by the posting your personal information (if there is such technical  possibility in the Services and where it is accessible by other users of the Services) you have manifestly made this information public, and this may become available to other Service users and internet users and be copied and/ or disseminated by such users.
2549	1	Cookies and similar technologies
1625	1	More information on the use of cookies on our Easybrain.com website can be found in our Cookie Policy
542	1	Similarly, third-party advertising companies may provide us with pixel tags (also called “clear gifs” or “beacons”) to help manage and optimize our online advertising. Beacons enable us to recognize a browser’s cookie when a browser visits the site on which the beacon is located, and to learn which banner ads bring Users to a given site.
436	1	Non-personal Information. DVloper (DVapps AB) collect your non-personal information when you visit our website, including your device information, operation system, logs. For example, as many websites, we may use “cookies” to obtain the above information when your web browser accesses dvloperapps.weebly.com.
5013	0	We will share your information with third parties only in the ways that are described in this Privacy Policy
4922	0	We process personal information for the purposes set out in this Privacy Policy, as described above. Our legal basis for processing personal information will depend on the personal information concerned and the specific context in which we collect it. However, we will normally collect and process personal information about you only where it is:necessary for providing the services pursuant to the agreement between you and Alibaba.com Singapore E-Commerce Private Limited and/or its affiliates (for example, to provide you with the services you request and to identify and authenticate you so you may use the Platform); necessary to comply with legal requirements (for example, to comply with applicable accounting rules and to make mandatory disclosures to law enforcement);necessary for our legitimate interests and not overridden by your rights; and/orwhere it is based on your consent.
2451	1	"We use ""cookies"" to store specific information about you and track your visits to the Sites, either through a compute or via a mobile device. It is not uncommon for websites to use cookies to enhance identification of their visitors"
1728	0	Green Panda Games does not share your personal information except as approved by you or as described herein. We may share information we collect or derive with third parties for the following purposes:With service providers that perform services on our behalf, including the ones referenced above under “Third Party Services”;With our affiliates;For analytics and research purposes;In response to subpoenas, court orders, or other legal processes;To protect our or a third party’s legal rights, investigate fraud, or to defend against a legal claim;As part of a business transfer such as a merger, acquisition, or at bankruptcyWe may share aggregate or anonymous information about you with advertisers, publishers, business partners, sponsors, and other third parties;We may use analytics services provided by third parties, including Google Analytics ,Facebook Analytics, GameAnalytics, Amplitude. These service providers may use cookies to collect information about your online activities across this and other sites over time for non-advertising purposes.
1354	0	We may disclose and transfer (whether within or outside the jurisdiction of the Alibaba entity that is the controller) your Personal Data to our partners and to service providers engaged by us to assist us to provide services to you or who otherwise process Personal Data for purposes described in this Privacy Policy or notified to you when we collect your Personal Data.  Examples of these partners or service providers include: our business partners (for example, in order for them to provide you with discounts or offers that may interest you);marketing platforms, such as Google, Twitter, Facebook, Instagram, and VKontakte, and providers of analytics services relating to users’ behavior, in order to tailor the content you see when visiting our Sites.  These marketing platforms may combine information they collect on our Sites with data on their platforms and data they collect from other websites or through other sources in order to conduct targeted advertising.  The activities of these third party marketing platforms are governed by their own privacy policies, not this Privacy Policy;payment service providers to assist with payment for transactions or providing withdrawing service for sellers.  The activities of payment service providers may be governed by their own privacy policies, not this Privacy Policy;credit risk assessment providers to conduct risk assessment on sellers to determine whether a seller can be permitted to make an advance withdrawal;logistics partners for providing delivery services for buyers, including return and exchange of products, and warehousing services for sellers;custom agents for customs clearances purposes; cloud computing service providers to provide cloud storage serviceswarranty service providers to provide warranty services;customer service providers to provide after-sale services; and risk control service providers to assess the security of members’ accounts and transaction risks.
796	1	Cookies are small text files that are stored on your browser or device by websites, apps, online media, and advertisements. Uber uses cookies and similar technologies for purposes such as:Authenticating users
3561	0	For the purposes described above under point h and i AVCR invokes its legal obligations (including art. 32 GDPR, security of processing personal data).
4996	1	Log file information is automatically reported by your browser each time you make a request to access a web page or app. It can also be provided when the content of the webpage or app is downloaded to your browser or device. We may also collect similar information from emails sent to our Users which then help us track which emails are opened and which links are clicked by recipients. The information allows for more accurate reporting and improvement of the Service.
1039	0	Our legitimate interest for this purpose is our interest in improving our Service so that we understand users’ preferences and are able to provide you with a better experience (for example, to make the use of the App easier and more enjoyable, or to introduce and test new features).
2221	1	When you visit the Service, we may send one or more cookies ﾡﾪ a small text file containing a string of alphanumeric characters ﾡﾪ to your computer that uniquely identifies your browser and lets Canva help you log in faster and enhance your navigation through the site. A cookie may also convey information to us about how you use the Service (e.g., the pages you view, the links you click and other actions you take on the Service), and allow us or our business partners to track your usage of the Service over time.
936	0	your first and last names;
4912	0	Non-Personal Information is any information that relates to you but from which it is not practicable to directly or indirectly identify you, which may include the information about your devices (such as Your hardware model, operating system version, unique device identifiers, and mobile network information), the list of installed apps on your devices, and technical information about users means of connection to our apps, such as the versions of phone model and other similar information.
3645	0	If you have any questions about this Privacy Policy, please contact us online at privacy@imo.im
3785	1	Our advertising partners may also transmit cookies to your device, when you click on ads that appear on the Services. Also, if you click on a link to a third party website or service, a third party may also transmit cookies to you. Again, this Privacy Policy does not cover the use of cookies by any third parties, and we aren’t responsible for their privacy policies and practices. Please be aware that cookies placed by third parties may continue to track your activities online even after you have left our Services, and those third parties may not honor “Do Not Track” requests you have set using your device.
4458	0	Duration of retention: six months
4059	1	"The IP address that your browser will pass on to Google Analytics will not be associated with any other data stored by Google. Through your browser settings, you can block cookies; however, this can lead to problems with the use of some functionalities of the website. Through the add-on ""Google Analytics Opt-out"" you can through your current web browser opt-out to the use of Google Analytics from then on: http://tools.google.com/dlpage/gaoptout?hl=en "
80	0	The security of your Personal Information is important to us, and we strive to implement and maintain reasonable, commercially acceptable security procedures and practices appropriate to the nature of the information we store, in order to protect it from unauthorized access, destruction, use, modification, or disclosure.
3532	1	You can choose to have your computer warn you each time a cookie is being sent, or you can choose to turn off all cookies. You do this through your browser settings. Since browser is a little different, look at your browser's Help Menu to learn the correct way to modify your cookies.
1719	1	This section only applies to users of our Services that are located in the European Economic Area, United Kingdom and/or Switzerland (collectively, the “Designated Countries”) at the time of data collection. We may ask you to identify which country you are located in when you use some of the Services, or we may rely on your IP address, MCC (mobile county code) to identify which country you are located in.
4327	1	Camel Games's products, services and sites may employ cookies and other technologies such as web beacons and pixel tags. Cookies are bits of electronic information that can be transferred to a user's hard drive to customize a person's use of a product or online site, keep records of a user's access to an online site or product, or store information needed by the user on a regular basis. Use of cookies is typically associated with websites. For example, when you sign in to Camel, Camel Games stores your user id and a combination of your IP address and time of login as a cookie on your hard drive. This cookie allows you to move from page to page without having to sign in again on each page. Similarly, if you enter information during your session, such as age verification data, this will be stored as a cookie and you will not have to re-enter such information during that session. We may also use third party web site analytic tools that employ cookies to collect certain non-personally identifiable information concerning use of our websites, such as referring web site addresses, page views and browser types.
550	0	Right to request access
1861	1	Cookies and other tracking technologies (e.g. web beacons, pixel tags, SDKs, etc.)
4390	1	Please note that third parties delivering advertisements through the Services may also use cookies or other technologies and it will be a subject to their own privacy policies.
1588	1	Our use of cookies and local share devices, including the specific cookie names, may change over time, but will generally fall into the above categories. We will notify you of any important changes to our use of cookies and local storage devices If you would like to know more about cookies, including flash cookies/local storage devices, the following websites provide useful information:www.allaboutcookies.orgwww.youronlinechoices.euhttp://helpx.adobe.com/flash-player/kb/disable-local-shared-objects-flash.html
1098	1	Personalisation and Service Cookies: These cookies are used to remember your computer or mobile device when you visit a website. They remember your registration and login details and your settings and preferences such as language and region. They are also used to ensure you don’t have to login every time you use your browser to comment on articles and to ensure interactive services work effectively. Personalization cookies are also used to recommend content we think you'll be interested in by serving and measuring relevant advertising, based on what you've looked at before.
5241	1	Google uses the data on behalf of Alibaba.com to evaluate your use of the Platform, to compile reports on website activity for the website operators and for other website activity and internet usage services. Google may disclose this information to third parties under the terms of the law or for further processing by third parties on behalf of Google. For more information about Google Analytics cookies, visit:
