	sentiment	review
2870	1	Cookie Functions Cookie Purposes
525	0	If you have any questions about this Privacy Policy, please contact us at ferroentertainment@gmail.com
848	1	In the event of contact with our technical department, we can process other information that we will need, in order to provide you with technical assistance, in particular data collected in crash logs, from your device or the technical parameters of the equipment you use to use the Services.
1379	1	Where we rely on your IP address or MCC, we cannot apply the terms of this section to any user that masks or otherwise obfuscates their location information so as not to appear located in the Designated Countries. If any terms in this section conflict with other terms contained in this Policy, the terms in this section shall apply to users in the Designated Countries.
1959	1	I want to inform you that whenever you use my Service, in a case of an error in the app I collect data and information (through third party products) on your phone called Log Data. This Log Data may include information such as your device Internet Protocol (“IP”) address, device name, operating system version, the configuration of the app when utilizing my Service, the time and date of your use of the Service, and other statistics.
5274	1	Cookies are small text files containing a string of alphanumeric characters. We may use session cookies, persistent cookies and targeting cookies, as well as Google Analytics (a web analytics service provided by Google, Inc.). A session cookie disappears after you close your browser. A persistent cookie remains after you close your browser and may be used by your browser on subsequent visits to our Services.
3660	1	We use cookies and similar technologies to facilitate and customize your use of our Services. A cookie is a small data file, which we store on your computer or mobile device that can later be retrieved to identify you to us. We may use cookies and similar technologies, among other things, to:(a) allow us to recognize you and your device;(b) allow our Services to interact with a third-party social network or platform (where you have chosen to allow such interaction);(c) allow our payment processors to process your payment instructions;(d) provide you with more customized Services, for example to provide our Services in your preferred language; or(e) obtain data which will allow us to understand how people are using our Services so that we can improve them.
2807	0	If you have any questions or suggestions about our Privacy Policy, do not hesitate to contact us.
3801	1	Any use of Cookies - or of other tracking tools - by this Application or by the owners of third party services used by this Application, unless stated otherwise, serves to identify Users and remember their preferences, for the sole purpose of providing the service required by the User.
4957	0	You can sign in to some Adobe apps or websites using a social networking account, such as a Facebook account. Where you give appropriate permissions, we will receive information about you from your social networking account, such as name, location, basic demographic information.
5090	1	Cookies and similar technologies. When you use the App, we may use cookies and similar technologies like pixels, web beacons, scripts to collect information about how you use our App and provide features to you. A cookie is a text file containing small amounts of information which is downloaded to your device when you access the App. The text file is then sent back to our server each time you use the App. This enables us to operate the App more effectively. For example, we will know how many users access specific areas or features within our App and which links or ads they clicked on. We use this aggregated information to understand and optimize how our App is used, improve our marketing efforts, and provide content and features that are of interest to you. We may ask advertisers or other partners to serve ads or services to the App, which may use cookies or similar technologies.
1132	1	Most web browsers have cookies enabled. Please review your web browser’s “Help” file to learn the proper way to modify your cookie settings. Please note that if you delete or choose not to accept cookies from the Service, you may not be able to utilize the features of the Service to their fullest potential.
1044	0	If you have a privacy concern, complaint, or question for the Microsoft Chief Privacy Officer or EU Data Protection Officer, please contact us by using our web form. For more information about contacting Microsoft, including Microsoft Ireland Operations Limited, see the How to contact us section of this privacy statement.
1730	1	 We use both first party cookies (cookies that are set by us at Alibaba and serve mainly to enable basic functionality on our Sites, including web analytics cookies that help us understand how users use our web pages and how we can improve their use) and third party cookies (these cookies are not set by Alibaba, but by our selected partners)
582	1	We and our advertising networks and their partners may use cookies and similar technologies, such as mobile “SDK”, to provide and personalize our Services and to provide targeted advertisements. Some of these technologies can synchronize behavior across different mobile apps, devices, and websites so that advertisements can be tailored to your interests. This process is called personalized advertisement experience. In addition, we and certain advertising networks may access your inventory of installed apps to avoid advertising already installed apps. If you'd like to opt-out from having advertisements personalized in this way on your mobile device, please see below ‘Opt-out of targeted advertising’.
1321	1	In addition, you may see our games advertised in other services.  After clicking on one of these advertisements and installing our game, you will become a user of our Service.  In order to verify the installs, a device identifier, Advertiser ID or IDFA may be shared with the advertiser
3935	1	Information contained in a cookie may be linked to your personal information, such as your user ID, for purposes such as improving the quality of our Service, tailoring recommendations to your interests, and making the Service easier to use. You can disable cookies at any time, although you may not be able to access or use features of the Service.
3038	1	9.3 By means of various tracing technologies as mentioned above, we can trace the domain names, IP addresses and the type of explorer used by the users who access our websites and use our products or services. We use such information to trace the traffic modes congregating on the whole CXZH.LTD website. Such information is independent of any personal information the user may otherwise provide in using CXZH.LTD’s products and services.
2362	0	BeNX Corporation (hereinafter referred to as the “Company”) holds the personal data of its Weply service (hereinafter referred to as the “Service”) users (hereinafter referred to as the “Members”) to the upmost importance. Therefore, the Company has a strict privacy policy. Through this privacy policy (hereinafter referred to as the “Privacy Policy”), we inform our Members of the purpose and manner for which their personal data is being used and security measures the Company implements to safeguard the personal data. This Privacy Policy may be amended pursuant to changes in the applicable laws, regulations, and/or the Company’s policy, so please check the Privacy Policy from time to time for possible changes when using the Service.
1779	1	Cookies and logs etc.
2039	0	The Site is hosted in the United States. If you visit Chatous from the European Union or other regions of the world with laws governing data collection and use that may differ from laws of the United States, then please understand that you are transferring your Personal Data outside of those jurisdictions to the United States for the uses identified above in accordance with this Privacy Policy. By providing your Personal Data to Chatous you consent to that transfer.
3438	1	The Internet pages use what are known as cookies Cookies are small text files that are stored on your computer and saved by your browser. Cookies as such cannot be used to identify the user. Cookies do not harm your computer and do not contain viruses.
466	0	We provide personal information to our affiliates or other trusted businesses or persons to process it for us, based on our instructions and in compliance with our Privacy Policy and any other appropriate confidentiality and security measures.
4967	1	You may choose to delete cookies or other tracking mechanisms on your browser anytime you want through your browser's settings. You may also choose to have non-essential cookies (and similar technologies) not used by us when you access and use UCWeb Services by amending your settings at your browser's settings (if applicable).
22	1	 In addition, most advertising networks offer you a way to opt out of targeted advertising.  If you would like to find out more information, please visit http://www.aboutads.info/choices/ or http://www.youronlinechoices.com
346	0	Data Processor (or Service Provider) means any natural or legal person who processes the data on behalf of the Data Controller.
2625	1	D. Information on Cookies:We collect information through technology to make our Services more interesting and useful to you and for various purposes related to our internal business. For instance, when you visit https://learnwithhomer.com, we collect your IP address. An IP address is associated with the access point through which you access the internet, and is typically controlled by your Internet Service Provider (ISP). Standing alone, your IP address is not personally identifiable information. We may use the IP address to assist in populating registration forms. We may use IP addresses to collect information regarding the frequency with which our guests visit various parts of our sites, and we may combine IP addresses with PII.
2132	0	"We may change this Privacy Policy from time to time. If we make any changes to this Privacy Policy that we think materially alter your rights, then we will post the latest policy to this site and change the ""Last Updated"" date below. We encourage you to review this Privacy Policy whenever you visit the Funimate App to understand how your personal information is used."
1233	0	A new version of the Policy comes into force upon posting on the Overmobile website unless otherwise stipulated by this new version of the Policy.
2135	0	We never share your information with third parties. All the information we collect is only for the purpose of optimizing our product and is safely stored in our server in an encrypted format. The information will not be disclosed to any third parties.
2006	1	Cookies are files with a small amount of data that are commonly used as anonymous unique identifiers. These are sent to your browser from the websites that you visit and are stored on your device's internal memory.
4602	1	Remembering user preferences and settings
2714	1	Cookies. A cookie is a small string of text that we, or service providers acting on our behalf, send to your computer’s or mobile device’s browser. Other types of cookies exist, but the cookies in the Services are only used to obtain browser or device-specific information.
5181	0	Mobile advertising identifiers are identifiers used by mobile operating systems (Apple and/or Android) and made available to advertising providers to gather metrics on mobile apps (Apple’s IDFA or Google’s AAID) to help advertisers provide ads that may be more relevant to your interests.
1269	1	9.1.2 Cookies are used to personalize webpages and / or recognize you when you are accessing our websites, in order to conveniently browse and access our websites after having registered for our products, services and/or other support services.
3729	1	Security Cookies. We use Security Cookies for security purposes.
3972	0	4(C) Provide Customer Support
5004	1	Log file information is automatically reported by your browser or mobile device each time you access the Service. When you use our Service, our servers automatically record certain log file information. These server logs may include anonymous information such as your web request, Internet Protocol (ﾡﾰIPﾡﾱ) address, browser type, referring / exit pages and URLs, number of clicks and how you interact with links on the Service, domain names, landing pages, pages viewed, and other such information.
1920	0	Objection: You can contact us to let us know that you object to the further use or disclosure of your Personal Data for certain purposes, such as for direct marketing purposes.
1152	1	Other passively collected information. UBISOFT may on its own, or with the help of third party analytics tools, collect non-personally identifiable information concerning your and other users’ gaming hardware, habits, behaviours and use of our Services. UBISOFT collects such information to better adapt our Services to users’ interests and for a better quality of our Services. The information collected may contain the following, without limitation: device unique identity, including MAC address, console, mobile, tablet and console unique identifier or other device identifiers and settings, internet provider, carrier, operating system, hardware information, localization information, date and time spent on the Services, game scores, game metrics, achievements, rankings, time played and statistics, feature usage, advertising conversion rates, monetization rate, purchase history and other similar information. UBISOFT uses third party ad serving technologies that may collect information as a result of ad serving in the Services and that may display behavioural and non-behavioural advertisements on our Services. The information collected and used for the targeted advertising may contain the following, without limitation: age and gender, number views of an advertisement, device unique identity or other device identifiers and settings, information about Your use of the products and Services, Compatible Mobile Terminal, and other Internet sites (including third party web pages and mobile Internet sites) viewed by you (as well as date and time viewed), advertisement(s) served, the advertisement(s)’ in game location and length, and your response to the advertisement(s) (if any). The analytics tools and ad serving technologies may use server log files, web beacons, cookies, tracking pixels and other technologies to collect said information and may combine the information collected on other UBISOFT Services with information collected from other third party websites, products and services and with demographic, advertisement, market and other analytics surveys. Standing alone, this information is not personal data; however, if UBISOFT combines any of this information with personal data, UBISOFT will treat this information as personal data pursuant to this Privacy Policy. You will find a list of our partners whose analytic tools and ad serving technologies are used in our Services at https://legal.ubi.com/cookies/. UBISOFT makes its best efforts to provide You with the links to our partners’ own privacy policies according to which their tools and technologies are used and when available the link to allow You to opt-out from their services
3380	1	This Service does not use these “cookies” explicitly. However, the app may use third party code and libraries that use “cookies” to collect information and improve their services. You have the option to either accept or refuse these cookies and know when a cookie is being sent to your device. If you choose to refuse our cookies, you may not be able to use some portions of this Service.
5106	0	Research and development
4896	1	You can control or reset your cookies through your web browser, which will allow you to customise your cookie preferences and to refuse all cookies or to indicate when a cookie is being sent. However, some features of the Service may not function properly if the ability to accept cookies is disabled.
3482	0	This Privacy Policy applies only to the processing of your Personal Information by Wuma. You may see third-party links or integrations on the Services. Keep in mind that this Privacy Policy does not address, and we are not responsible for, the privacy, information or other practices of any third parties, including any third party operating any site or service to which the Services link. The inclusion of a link on the Services does not imply endorsement of the linked site or service by us or by our affiliates.
4262	1	Any use of Cookies – or of other tracking tools – by this Application or by the owners of third party services used by this Application serves the purpose of providing the service required by the User, in addition to any other purposes described in the present document and in the Cookie Policy, if available.
827	1	Like many websites, we use “cookies” to collect information.A cookie is a small data file that we transfer to your computer’s hard disk for record-keeping purposes. We use cookies for two purposes. We utilize session ID cookies to enable certain features of the Services, to better understand how you interact with the Services and to monitor aggregate usage by Users and web traffic routing on the Services. Unlike persistent cookies, session cookies are deleted from your computer when you log off from the Services and then close your browser. Third party advertisers on the Services may also place or read cookies on your browser.
4699	0	We do not rent or sell your Personal Information in personally identifiable form to anyone. We may share your Personal Information with third parties as described in this section:Information that’s been de-identified.  We may de-identify your Personal Information so that you are not identified as an individual, and provide that information to our partners. We may also provide aggregate usage information to our partners (or allow partners to collect that information from you), who may use such information to understand how often and in what ways people use our Services, so that they, too, can provide you with an optimal online experience. However, we never disclose aggregate usage or de-identified information to a partner (or allow a partner to collect such information) in a manner that would identify you as an individual person.
5331	0	Enable Accessibility features that make it easier for users with disabilities to use our services, such as those which enable deaf or hard-of-hearing drivers to alert their riders of their disabilities, allow only text messages from riders, and to receive flashing trip request notifications instead of sound notifications.
2042	1	Who serves these cookies
4171	0	By using the Software, you agree that we may treat your information in the ways we describe in this Privacy Policy. If you do not agree with any term of this Privacy Policy, you may not use the Software.
4148	0	Users providing your information in connection with referral programs.
2627	0	• When you visit our websites, we may collect device-specific information, such as the unique mobile ID, hardware model, operating system version, browser type, language, internet service providers and mobile network names. We only use it to provide and improve the website, troubleshoot, and perform analytics.
5312	1	"We use first and third party cookies for several reasons. Some cookies are required for technical and/or security reasons in order for our Platform to operate, and we refer to these as ""essential"" or ""strictly necessary"" cookies. First party cookies are mainly served to enable basic functionality on our Platform; including web analytics cookies that help us understand how users use our web pages and how we can improve their use. For example we use essential or strictly necessary cookies to enable us to remember goods added to your Alibaba.com shopping basket and to recognize you when you sign into your Alibaba.com account."
2413	1	"Logfiles. Log files are files that log actions that have occurred on a website. Level Eight may collect data in the form of log files and may use such log files to gather statistics about End Users user habits and to assess overall Game activity, including how many ""hits"" a particular web page is getting and other navigational data. These entries are generated anonymously, and enable Level Eight to track interest in specific promotions, troubleshoot technical concerns, and provide End Users with content that may be of interest to them. Log files are used internally only, and are not associated with any particular user, computer, or browser."
3734	1	This Service does not use these “cookies” explicitly. However, the app may use third party code and libraries that use “cookies” to collection information and to improve their services. You have the option to either accept or refuse these cookies and know when a cookie is being sent to your device. If you choose to refuse our cookies, you may not be able to use some portions of this Service.
5059	1	We use cookies to store visitors preferences, customize Web page content based on visitors browser type or other information that the visitor sends. Cookies are required to use Todoist.
4453	0	Customer happiness: We use information about you, information that you provide to our customer happiness team, and information about your interactions with the Service to resolve technical issues you experience with the Service, and to ensure that we can repair and improve the Service for all Canva users.
2564	0	For example, some of our services require you to sign up with your social media account or phone number. When you do, we’ll ask for personal information like your email address, telephone number to store with your account. If you want to take full advantage of the sharing features we offer, we might also ask you to register with a Facebook account or telephone number, which may include your Facebook name and photo.
1851	1	Cookies: We collect technical information and usage data, which may be linked and identified with your account, by using cookies and other tracking technologies. We may use cookies to store certain types of information each time you use our Services. To find out more about how we use cookies, please review the additional information in this Privacy Policy under the Section entitled “Do we use cookies or other tracking technologies?”
835	0	This Privacy policy may change from time to time. Whenever we change this Privacy policy, we will post those changes to this Privacy policy and other places that we consider appropriate. Please check and pay close attention to this Privacy Policy from time to time.
4370	1	We want to inform you that whenever you use our Service, in a case of an error in the app we collect data and information (through third party products) on your phone called Log Data. This Log Data may include information such as your device Internet Protocol (“IP”) address, device name, operating system version, the configuration of the app when utilizing our Service, the time and date of your use of the Service, and other statistics.
1283	0	We value your trust in providing us your Personal Information, thus we are striving to use commercially acceptable means of protecting it. But remember that no method of transmission over the internet, or method of electronic storage is 100% secure and reliable, and we cannot guarantee its absolute security.
2737	1	Cookies. A cookie is information a website places on your computer’s hard drive so that the website is able to remember your preferences and/or which pages you visited on the website and make your visit more efficient and enjoyable. Level Eight may use cookies to determine the number of unique players of the Game over a given period, or to remember user account details, etc. so that the need for multiple log-ins is eliminated. It may combine information collected through cookies to any Personal Data submitted online when using the Game to help personalize a user’s access to and playing of the Game. Cookies may be disabled on your computer by indicating this in the preferences or options menus in your browser.
2123	1	Cookies
4603	1	This site uses third-party cookies to discover how users use the site. Here is a list of the cookies it uses
1241	0	We may share some or all of your Personal Data in connection with, or during negotiation of, any merger, financing, acquisition or dissolution, transaction or proceeding involving sale, transfer, divestiture, or disclosure of all or a portion of our business or assets. In the event of an insolvency, bankruptcy, or receivership, Personal Data may also be transferred as a business asset. If another company acquires our company, business or assets, that company will possess the Personal Data collected by us and will assume the rights and obligations regarding your Personal Data as described in this Privacy Policy.
5286	1	Our site and Services may use cookies and tracking technology which are useful for gathering information such as browser type and operating system, tracking the number of visitors to the site, and understanding how visitors use the Services. Personal information cannot be collected via cookies and other tracking technology, however, if you previously provided personally identifiable information, cookies may be tied to such information. Third parties such as our advertisers may also use cookies to serve ads to you based on your visit to our site and other sites on the internet.
