	sentiment	review
3606	1	This Policy does not apply to, and we are not responsible for the data collection practices of these third party advertisers, and we encourage you to check their privacy policies to learn more about their use of cookies and other technology. You may visit https://help.chartboost.com/legal/privacy for information about Chartboost, http://www.admob.com/home/privacy for information about Google AdMob, and https://www.facebook.com/about/privacy/advertising for information about Facebook. We reserve the right to work with advertising networks other than those mentioned above.
1556	0	If yo have any questions or concerns about our Privacy Policy or data processing, please contact us at [facehunterlee@gmail.com]. We may modify, update and publish this Privacy Policy in the Software from time to time. Please continue to play close attention to this Policy.
3402	1	"In addition we also use social media cookies. You may register for Platform membership and ""share"" Platform content through social media such as Facebook and Twitter. Sometimes we embed videos from websites like YouTube. These websites have their own privacy policies which govern their use of information, which you can find on the respective websites."
2093	0	In connection with legal proceedings
2557	1	To ensure the normal operations of the website, secure easier access for you and recommend content that may be of interest to you, we will store small data files called cookies on your computer or mobile device. Cookies often contain identifiers, site names and some numbers and characters. Cookies allow the website to store your preferences and other data.
475	0	5.4 By submitting your personal information to us, you agree that we may retain your information for as long as is necessary (up to 5 years) to fulfill any of the services we provide or to comply with applicable legislation, regulatory requests and relevant orders from competent courts.
2927	1	We may feature advertisements served by third parties that deliver cookies to your computer/device so the content you access and advertisements you see can be tracked. Since the third party advertising companies associate your computer/device with a number, they will be able to recognize your computer/device each time they send you an advertisement. These advertisers may use information about your visits to our Service and third party sites and applications in order to measure advertisement performance and to provide advertisements about goods and services of interest to you. This Policy does not apply to, and we are not responsible for the data collection practices of these third party advertisers, and we encourage you to check their privacy policies to learn more about their use of cookies and other technology.
4251	0	"We will not use the ""address list"", ""photos"" or information on other APIs with access to user data to create the database of your contact persons for self-use or distribution to a third party, nor will we collect other Apps installed in your device for the purposes of, among other, analyzing or launching advertising/marketing. Meanwhile, we will not contact you by collecting information via the ""address list"" or ""photos""."
2045	0	You can also opt out of the sharing of your personal information to third parties for any purpose by contacting us through support@ngames.mobi
5140	0	Beginning May 25, 2018, the processing of personal data of users in the European Union is subject to the EU General Data Protection Regulation ('GDPR'). This section provides information as relates to EU users' rights, and Uber's responsibilities, under this regulation.
5322	0	We do not actively share personal information with third party advertisers for their direct marketing purposes unless you give us your consent.
1644	1	We may use cookies, including Flash cookies, transparent GIFs, server log analysis and other tracking technologies, currently existing and as they are developed, to enhance your experience with the Applications and Services and track information about your use of our Applications and Services. Like many websites, our Site and third parties acting on our behalf, like Google Analytics, also store log files and use cookies and other tracking technologies to collect information. A cookie is a small data file that is transferred to your computer’s hard drive or mobile device for record-keeping purposes. Some cookies allow us to make it easier for you to navigate our Site and use our Applications and Services, while other cookies are used to enable a faster log-in process or to allow us to track your activities at our Site and Applications. Third party advertisers may also use, place or read cookies or other technologies on your browser, and those practices are subject to their own policies. We automatically collect the following information about you from your use of our Applications and Services through these technologies: language information, referring and exit pages, and URLs; your geo-location (with your permission), unique device identifier (as permitted), your computer or mobile device’s operating system and platform, the communication network associated with your computer or mobile device, and mobile device name and model, the date and time of your use of the Site, Applications and Services, and the length of time you play our Applications, and/or visit or use our Site and Services. We may use this information in the aggregate or we may combine it with personal information about you.
272	0	We use personal data to enforce our agreements and contractual commitments, to detect, prevent, and combat fraud. As a result of such processing, we may share your information with others, including law enforcement agencies (in particular, if a dispute arises in connection with our Terms and Conditions of Use).
1276	0	Provide Customer Support. We process your personal information when you contact us to help you with any questions, concerns, disputes or issues, or to provide us with your feedback. Without your personal information, we cannot respond to you or ensure your continued use and enjoyment of the Services.
3625	0	What do we use your information for ?
2378	1	Information We Collect Automatically; Cookies and Other Tracking Technologies
1487	1	The Company uses cookies to save and occasionally search through data related to Members. Cookies are small text files sent from website servers to the user’s computer browser (e.g., Internet Explorer, Safari, Chrome, Firefox). Cookies identify the computers used by the Members but do not identify the individual Members themselves.
25	1	Web Beacons. Certain pages on the Services may contain “web beacons” (also known as Internet tags, pixel tags, tracking beacons and clear GIFs). A web beacon is a transparent graphic image placed on a web page or in an email, which indicates that a page or email has been viewed or that an email has been forwarded. In addition, a web beacon allows third parties to obtain information such as the IP address of the computer that downloaded the page on which the beacon appears, the URL of the page on which the beacon appears, the time the page containing the beacon was viewed, the type of browser used to view the page, and the information in cookies set by the third party. A web beacon may also tell your browser to get content from another server.
3494	1	When you visit the publicly available sections of Topface, a session ID cookie is placed on your computer that only lasts while you’re visiting. We also place persistent cookies (also known as local storage devices) on members’ computers, so that Topface remembers them and makes their login experience faster and easier. We may use persistent tracking cookies on your mobile device, mainly for security protection purposes, such as to prevent phishers, scammers, unauthorised log in attempts, and to help you access your hacked account. We do not use any information whilst you are logged off.
236	1	Cookies are files with small amount of data that is commonly used an anonymous unique identifier. These are sent to your browser from the website that you visit and are stored on your device internal memory.
4861	1	Information passively collected by Ubisoft may be used in an aggregated form or to identify specific patterns of you or any individual.
1121	0	Provide measurement, analytics, and other business services.
2028	0	You may delete your chat history stored on imo’s servers by selecting the “Delete chat history” option in the settings of the imo app. You may delete your entire account, by selecting the “Delete imo account” option in the settings. Even if you delete your entire account, we may retain limited information about your mobile device for the purposes of fraud detection and enforcement of our Terms of Service.
3999	0	Welcome to Trip.com! This Privacy Statement, together with our Terms Of Use, sets out the approach that we at Trip.com take with regards to the collection and handling of any identifiable information about you, and applies to all Trip.com websites (including any affiliated sites), mobile apps, and other services operated by us (hereafter collectively referred to as the “Services”).
4559	1	The Websites may use cookies, small text files that are placed on your computer, smartphone and/or stored by the browser. If the respective server of our Website is again accessed by you, your browser sends the afore received cookie back to the server. The server can evaluate the information received in this manner in various ways. Cookies can, for example, be used in order to manage advertisements on the Website or to facilitate navigation on a webpage.
4876	1	The Game doesn`t use cookies to ensure proper.
4827	0	If you have any questions regarding privacy while using the Application, or have questions about our practices, please contact us via email: solovpn.co@gmail.com
5239	1	We need to use certain cookies and local storage devices to ensure our members have the best possible experience, such as assisting with your navigation of our site, ensuring pages load up quickly and respond faster to your requests for Topface services
3745	1	You may set your browser and your mobile settings to block cookies and local storage devices, but if you do so, you may not be able to access the features that Topface offers.
4416	0	1.1 Installation and Use
552	0	You have certain rights with respect to your information as further described in this section.
3493	0	While you are browsing the Site, your computer's operating system, Internet Protocol (IP) address, access times, browser type and language and referring Web site addresses may be logged automatically.  We may use this information to monitor, develop and analyze your use of the Service. 
250	0	We collect and process the following data from you:Information that you provide by filling in forms on our services (like: first name, last name, your email address, your username, your photo). This includes information provided at the time of registering to use our services, subscribing to our service, posting material or requesting further services. We may also ask you for information, and when you report a problem with our services.
4635	0	The Service is not directed to children under the age of thirteen (13) years old and we do not knowingly collect personally identifiable information from children under the age of thirteen (13) years old as part of the Service. If we become aware that we have inadvertently received personally identifiable information from a user under the age of thirteen (13) years old as part of the Service, we will delete such information from our records. If we change our practices in the future, we will obtain prior, verifiable parental consent before collecting any personally identifiable information from children under the age of thirteen (13) years old as part of the Service.
4828	1	For some of our Apps we use third party tracking and data collection tools from our service providers for the purposes of tracking performance, ad visibility and privacy compliance of third party SDKs in our Apps.
3234	1	Cookies are small text files placed on your device to store data that can be recalled by a web server in the domain that placed the cookie. We use cookies and similar technologies for storing and honoring your preferences and settings, enabling you to sign in, providing interest-based advertising, combating fraud, analyzing how our products perform, and fulfilling other legitimate purposes. Microsoft apps use additional identifiers, such as the advertising ID in Windows described in the Advertising ID section of this privacy statement, for similar purposes.
371	0	As required by Adobe to conduct our business and pursue our legitimate interests, in particular:Providing you with the Adobe websites and apps for which you have registered and any other products and services you have requested;Analyzing your use and measuring effectiveness of our websites and apps to better understand how they are being used so we can improve them and engage and retain users;Sending you information about Adobe products and services, special offers and similar information, and sharing your information with third parties for their own marketing purposes (where your consent is not required);Analyzing your use of our websites and apps, and interaction with our communications, to tailor and customize the website or app, and marketing communications (learn more);Using automated systems to analyze your content using techniques such as machine learning in order to improve our services and the user experience (where your consent is not required);Diagnosing problems in our apps and websites;Conducting surveys and market research about our customers, their interests, the effectiveness of our marketing campaigns, and customer satisfaction (unless we need consent to undertake such surveys, in which case we will only do this with your permission);Investigating and responding to any comments or complaints that you may send us;Checking the validity of the sort code, account number and card number you submit if you use a credit or debit card for payment, in order to prevent fraud (we use third parties for this – see “Does Adobe share my personal information?” below); andIn connection with legal claims, compliance, regulatory and investigative purposes as necessary (including disclosure of information in connection with legal process or litigation).
292	1	You have the right to decide whether to accept or reject cookies. If you choose to set your web browser controls to reject cookies, you may still use our website though your access to some functionality and areas of our website may be restricted
1613	0	We use information from third party service providers, such as a social networking sites or an application store. Third party service providers help us verify your identity by registering and remembering your device information (such as the model, operating system, browser version and IP address), which is used to confirm device identification.
4154	1	Performance/Analytical Cookies: Performance/Analytical Cookies allow us to understand how users use our Services such as by collecting information on how often users use a particular feature of the Services. These aggregated statistics are used internally to improve the Services in a way that makes the Services interesting to as many users as possible. Performance/Analytical Cookies also help us measure the performance of our advertising campaigns in order to help us improve our campaigns and the Services’ content for those who engage with our advertising.
125	1	We also use ﾡﾰweb beaconsﾡﾱ to help deliver cookies and gather usage and performance data. Our websites may include web beacons, cookies, or similar technologies from third-party service providers.
5298	0	Our mission is to constantly improve our App and provide you with new experiences. As part of this mission, we use your information for the following purposes:(a) To make our service available. We use information that you submit and information that is processed automatically to provide you with all requested services.(b) To improve, test and monitor the effectiveness of our App. We use information that is processed automatically to better understand user behavior and trends, detect potential outages and technical issues, to operate, protect, improve, and optimize our App.(c) To provide you with interest-based (behavioral) advertising or other targeted content. We may use information that is processed automatically for marketing purposes (to show ads that may be of interest to you based on your preferences). We provide personalized content and information to you, which can include online ads or other forms of marketing.(d) To communicate with you. We use the information we have to communicate with you through newsletters, i.e. to send you marketing notifications, receive your feedback about our App experience, and let you know about our policies and terms. We also use your information to respond to you when you contact us.(e) To prevent fraud and spam, to enforce of law. We really want our App to be free of spam and fraudulent content so that you feel safe and free. We may use your information to prevent, detect, and investigate fraud, security breaches, potentially prohibited or illegal activities, protect our trademarks and enforce our Terms of Use.
186	0	You may correct information associated with your account from the Settings page, and the Customize Your Interests page to update your interests.
177	0	For the Apps on iOS and Android we use Facebook Analytics. This allows us to track and analyze which marketing channels or sources, in connection with Facebook, are producing the best results for directing users to download the Services and to help us understand how our users are using our Apps. For this purpose, Facebook Analytics processes mobile identifiers such as the IDFA, GAID or similar mobile identifiers. For more information on Facebook Analytics, see https://developers.facebook.com/docs/analytics. The basis for the processing of Data is Art 6 sec 1 subsec f GDPA.
3715	0	Our services may contain third party tracking tools from our service providers, examples of which include Google Analytics and Kochava. Such third parties may use cookies, APIs, and SDKs in our services to enable them to collect and analyze user information on our behalf. The third parties may have access to information such as your device identifier, MAC address, IMEI, locale (specific information where a given language is spoken), geo-location information, and IP address for the purpose of providing their services under their respective privacy policies. Our privacy policy does not cover the use of tracking tools from third parties. We do not have access or control over these third parties.
2992	0	8.2. You also have a right to independently remove personal information on your account and make changes and corrections to your information, provided that such changes and corrections contain up-to-date and true information. You can also view an overview of the information we hold about you.
3062	0	The English language version of the Privacy Policy shall control in the event of any conflict with any translated versions.
5042	1	In addition, our Partners may use their own tracking technologies (including and without limitation: SDKs, cookies, Web beacons, HTTP cache, local shared objects and other technologies) in order to track impressions, clicks, installs or other advertising campaign performance indicators for the purposes of measuring third party advertising campaign performance.
1106	0	From time to time, we may update this Privacy Policy to clarify our practices or to reflect new or different privacy practices, such as when we add new features.  We reserve the right to modify and/or make changes to this Privacy Policy at any time.
5127	0	We employ administrative, physical and electronic measures designed to protect your information from unauthorized access, however, despite these efforts, no security measures are perfect or impenetrable and no method of data transmission can be guaranteed against any interception or other type of misuse. In the event that your personal information is compromised as a result of a breach of security, we will promptly notify you if your personal information has been compromised, as required by applicable law.
3018	0	When you use our live video streaming service, imo users will be able to see you, your username, your country (based on your phone number), and profile. We will store a list of your live stream followers and a list of people you follow. We may monitor live streams to improve the quality of the service and to enforce our terms of service.
1997	0	Mobirate may share your information in connection with any merger, sale of our assets, or a financing or acquisition of all or a portion of our business to another company.  You will be notified via email and/or notice on our Site of any change in ownership or users of your personal information.
1712	0	You have the right to be informed about the collection and use of your personal data.
1699	1	We use two types of cookies: session cookies (which are erased once you close the browser or shut down the device) and persistent cookies (which remain even after closing the browser or shutting down the device/application and which are activated each time you visit the Sites).  The session cookies use encrypted data to unambiguously authenticate you. The persistent cookies do not store account numbers or passwords.
4065	1	You can delete cookies that already exist on your computer from your hard disk manually at any time.
496	0	hen you choose to use third-party apps, websites, or other services that use, or are integrated with, our Products, they can receive information about what you post or share. For example, when you play a game with your Facebook friends or use a Facebook Comment or Share button on a website, the game developer or website can receive information about your activities in the game or receive a comment or link that you share from the website on Facebook. Also, when you download or use such third-party services, they can access your public profile on Facebook, and any information that you share with them. Apps and websites you use may receive your list of Facebook friends if you choose to share it with them. But apps and websites you use will not be able to receive any other information about your Facebook friends from you, or information about any of your Instagram followers (although your friends and followers may, of course, choose to share this information themselves). Information collected by these third-party services is subject to their own terms and policies, not this one.
3950	0	Consultants, lawyers, accountants and other professional service providers.
3894	1	 Provide differentiated information depending on the individual’s area of interest.
556	0	Marketing Communications. We do not require that you provide us with your email or any contact information to use our Services. But if you do provide us an email, from time to time you may receive marketing email messages from us consistent with your choices. If you no longer want to receive such emails from us on a going forward basis, you may opt-out via the “unsubscribe” link provided in each such email. Please be aware that, even after you opt out from receiving commercial messages from us, you may continue to receive necessary administrative messages regarding the Services.
589	0	We may let other companies use cookies, web beacons, and similar tracking technologies on the services. These companies may collect information about how you use the services and other websites and online services over time and across different services. This information may be used to, among other things, analyze and track data, determine the popularity of certain content, and better understand your online activity.
1398	0	We'll notify you before we make changes to this policy and give you the opportunity to review the revised policy before you choose to continue using our Products.
2202	0	Overmobile doesn’t intentionally collect User’s Data from children younger than 16, it doesn’t request it and doesn’t allow them to use the Applications. Persons under 16 are not allowed to provide User’s Data. If Overmobile gets to know that the information was collected from a child under 16, Overmobile shall immediately delete such information. If you think we could have obtained any information from a child or about a child under 16, please, contact us through e-mail support@overmobile.ru.
5105	0	"We also may share your information as well as information from tools like cookies, log files, and device identifiers and location data, with third-party organizations that help us provide the Service to you (""Service Providers""). Our Service Providers will be given access to your information as is reasonably necessary to provide the Service under reasonable confidentiality terms."
2089	1	We collect information by placing cookies on a computer or mobile phone. Cookies is a piece of text stored on your device by your web browser. Cookies stores information about visiting a website, recognizes you and your preferences every time you visit Topface, and provides the functionality of the site, allowing us to provide services to our users upon request.
2845	0	3032, Limassol, Cyprus
119	0	This Privacy Policy explains what personal data is collected when you use the BetterMen: Exercises Trainer mobile application (the “App”) and the services provided through it (together with the App, the “Service”), how such personal data will be used, shared.
