	sentiment	review
1964	1	We consider ourselves to be family oriented, however we have decided to voluntarily implement higher child protection standards even though our products and services are not directed to, and we do not knowingly collect personal information from children under 13, with the sole exception of persistent identifiers as described below. If we learn that we have collected personal information other than persistent identifier of a child under the age of 13, we will take all reasonable steps to delete the information as soon as possible. If you become aware that your child has provided us with personal information without your consent, please contact us at privacy@outfit7.com.
134	0	Additional data you provide when you edit your Services profile or settings section such as avatar picture and language preferences.
5342	1	PlanB Labs does not knowingly collect Personal Data from children under the age of 13. If you have reason to believe that a child under the age of 13 has provided Personal Data to PlanB Labs through the Services please contact us at support@languagedrops.com and we will endeavour to delete that information from our databases.
955	0	We also share Personal Data when we believe it is necessary to:Comply with applicable law or respond to valid legal process, including from law enforcement or other government agencies
1721	1	Where a parent has provided consent, a child may be able use our Services much like any other user, including some services that enable the child to publicly disclose personal information or communicate with other users of all ages. Once we have a parent’s consent, we may collect from the child the same types of personal information, and use and share that information for the same purposes, as described in this Privacy Policy.  If we make any material changes in the way we process your child's personal information, we will notify parents by email or by in-game notice to obtain verifiable parental consent for the new uses of your child's personal information.
325	0	If you ask us to delete your data or to be removed from our marketing lists and we are required to fulfil your request, we will keep basic data to identify you and prevent further unwanted processing.
1771	0	Under this legal basis we:Provide our Service (in accordance with our Terms and Conditions of Use)
2024	1	The Service offered by us are not intended for children under 13 or other statutory minimum age according to the applicable laws and regulations in your country (the “Minimum Age”). Anyone under the Minimum Age should not use the Service. With this in mind, we do not willingly collect personal data from children under the Minimum Age. All the same, if the collection of such data is brought to the attention of us, we will take all useful measures possible to delete the corresponding data. If you believe that we might have any information from or about a child under the Minimum Age, please contact us through the email displayed below.
4995	0	Gather usage statistics of services
4960	1	When we intend to collect personal information from children, we take additional steps to protect children’s privacy, including:Notifying parents about our information practices with regard to children, including the types of personal information we may collect from children, the uses to which we may put that information, and whether and with whom we may share that information
1939	1	Please be aware of the open nature of certain social networking and other open features of the Services Trials of Heroes may make available to you. You may choose to disclose data about yourself in the course of contributing user generated content to the Services. Any data that you disclose in any of these forums, blogs, chats or the like is public information, and there is no expectation of privacy or confidentiality. Trials of Heroes is not responsible for any personal data you choose to make public in any of these forums.
1895	0	When we refer to personal data (or personal information) we mean any information of any kind relating to an identified or identifiable natural person.
2418	0	We use third-party automatic data processing technologies (such as Google and Facebook) to analyze certain information sent by your device or our App. Automatic data processing technologies (advertising or analytics tools) provide us with the data described below. We do not control, supervise or respond for how the third parties providing your information process your personal data, and any information request regarding the disclosure of your personal information to us should be directed to such third parties.
2494	0	Camel Games may release personally identifiable information to comply with court orders or laws that require us to disclose such information. In the event of a reorganization, sale or merger we may transfer personally identifiable information to the relevant third party with the user's consent if required by law.
2023	0	Facebook, Inc.
3289	0	Device signals: Bluetooth signals, and information about nearby Wi-Fi access points, beacons, and cell towers.
2644	1	To the extent you are a User of these Services without a registered account, such requests may be made, but Camsurf reserves discretion to determine the manner in which such requests may be handled, certain opt-out provisions that may not be available to unregistered Users may be accomplished by discontinuing use of these Services.
2248	1	We do not collect and keep personal information online from children under the age of 13 without consent of a parent or legal guardian, except in limited circumstances authorized by law and described in this policy. HOMER Learning might collect an e-mail address and first name from your child under 13 without your consent, but only in the following special cases:If a child under 13 sends a request to us, we keep their e-mail address for long enough to respond to them. HOMER Learning deletes this information from our system after we answer their question.
2430	0	Depending on which game or service you use, we collect different kinds of information from or about you.
1824	1	California’s Shine the Light law gives California residents the right to ask companies once a year what personal information they share with third parties for those third parties' direct marketing purposes. Learn more about what is considered to be personal information under the statute.
4530	0	We use third parties to help us operate and improve our Services. These third parties assist us with various tasks, including hosting and maintenance, on-going development, analytics, customer care, marketing, advertising. We may also share information with advertising partners who distribute advertising in our Services.
1178	1	These Services do not address anyone under the age of 13. I do not knowingly collect personally identifiable information from children under 13. In the case I discover that a child under 13 has provided me with personal information, I immediately delete this from our servers. If you are a parent or guardian and you are aware that your child has provided us with personal information, please contact me so that I will be able to do necessary actions.
613	0	We process your personal data:To provide our Service
5361	1	The Services and this Site are offered and made available only to users 13 years of age or older. YOU MUST BE 13 YEARS OF AGE OR OLDER TO USE THE SERVICES AND THIS SITE. By accessing and using this Site, you represent that you are 13 years old or older; and if you are between the ages of 13 and 18, you represent that your legal guardian has reviewed and agreed to these Terms.
2269	1	 What about children? We recognise we have a special obligation to protect personal information obtained from children. Legally you must be at least 13 years old to use the Nordeus Services as per our User Agreement. We do not and will not knowingly collect personal information from any child under the age of 13 without consent from their parent or guardian. If you are a parent or guardian and are concerned about the transfer of personal information about your child, please contact support@nordeus.com.
726	1	These Services do not address anyone under the age of 13. We do not knowingly collect personally identifiable information from children under 13. In the case we discover that a child under 13 has provided us with personal information, we immediately delete this from our servers. If you are a parent or guardian and you are aware that your child has provided us with personal information, please contact us so that we will be able to do necessary actions.
3441	1	Beginning May 25, 2018, the processing of personal data of users in the European Union is subject to the EU General Data Protection Regulation (“GDPR”).
2455	0	upport Related Information. If you communicate with us via our support section or via email, we may collect your email address, and any information voluntarily submitted by you in connection with such support.
2034	0	Location Information
3885	1	Outfit 7 is a member of the PRIVO Kids Privacy Assured COPPA Safe Harbor Certification Program (“the Program”). The Program certification applies to the digital properties listed on the validation page that is viewable by clicking on the PRIVO Seal. PRIVO is an independent, third-party organization committed to safeguarding children's personal information collected online. The PRIVO COPPA certification Seal posted on this page indicates Outfit7 has established COPPA compliant privacy practices and has agreed to submit to PRIVO’s oversight and consumer dispute resolution process. If you have questions or concerns about our privacy practices, please contact us at privacy@outfit7.com. If you have further concerns after you have contacted us, you can contact PRIVO directly at privacy@privo.com
666	1	The Service offered by us are not intended for children under 13 or other statutory minimum age according to the applicable laws and regulations in your country (the “Minimum Age”). Anyone under the Minimum Age should not use the Service. With this in mind, we do not willingly collect personal data from children under the Minimum Age. All the same, if the collection of such data is brought to the attention of us, we will take all useful measures possible to delete the corresponding data. If you believe that we might have any information from or about a child under the Minimum Age, please contact us through the email displayed below.
906	0	We bear no liability for the consequences of use of the information which, due to the Services nature, is available to any internet user.
5249	0	If you are aware of changes or inaccuracies in your information, you should inform us of such changes so that our records may be updated or corrected.
4536	1	Parents can review, delete, manage or refuse with whom their child's information is shared through contacting us directly.
3484	0	In addition, you may get useful information and opt out of some interest-based advertising, by visiting the following links: Network Advertising Initiative – http://optout.networkadvertising.org/
1002	1	When we collect personal information, we do not know the age of our players. If a player has a social media account and has logged into a game, we may obtain the age information from the player through that. If we learn that we have collected personal data about a child under age 13, we will delete that data as promptly as possible. 
1340	0	We may employ third party companies and individuals to facilitate our Service (“Service Providers”), to provide the Service on our behalf, to perform Service-related services or to assist us in analyzing how our Service is used.
1138	0	We’re constantly trying to improve our Services, so we may need to change this Privacy Policy from time to time as well, but we will alert you to changes by placing a notice in our mobile applications, by sending you an email, and/or by some other means. Please note that if you’ve opted not to receive legal notice emails from us (or you haven’t provided us with your email address), those legal notices will still govern your use of the Services, and you are still responsible for reading and understanding them.  If you use the Services after any changes to the Privacy Policy have been posted, that means you agree to all of the changes.  Use of information we collect now is subject to the Privacy Policy in effect at the time such information is collected.
1377	0	If we ask you to provide Personal Data to comply with a legal requirement or to enter into a contract with you, we will make this clear at the relevant time and advise you whether the provision of your Personal Data is mandatory or not (as well as of the possible consequences if you do not provide your Personal Data). In some instances, you may be required to provide us with Personal Data for processing as described above, in order for us to be able to provide you all of our services, and for you to use all the features of our Sites.
3793	0	If you wish to exercise any of these rights, kindly contact us using the details in section 12 below.
1841	1	Our Service does not address anyone under the age of 18 (“Children”).
4060	0	We may update our Privacy Policy from time to time. Thus, you are advised to review this page periodically for any changes. We will notify you of any changes by posting the new Privacy Policy on this page. These changes are effective immediately after they are posted on this page.
3714	1	Such a user cannot:display his/her real name or any information in the games
3852	1	We do not knowingly process personal data from persons under 16 years of age. If you learn that anyone younger than 16 has provided us with personal data, please contact us at support@betterme.tips.
1436	0	Identifiers associated with cookies or other technologies that may uniquely identify your device or browser.
1982	0	For our business purposes, such as audits, security, fraud monitoring and prevention
892	1	Microsoft adheres to the principles of the EU-U.S. and Swiss-U.S. Privacy Shield frameworks. To learn more, visit the U.S. Department of Commerceﾡﾯs Privacy Shield website.
661	1	We do not knowingly collect or solicit personal information from anyone under 13 years old or knowingly allow such persons to register. If You are under the age of 13 years, please do not attempt to access the Games or send any information about Yourself to Us including, without limitation, Your name, address, telephone number, or email address. No person under the age of 13 may provide any personal information to Us or the Games. In the event that We learn that We have collected personal information from anyone under the age of 13, We will delete that information as soon as practicable. If You believe that We might have any information from or about a child under the age of 13, please contact Us in writing by using the e-mail specified in Chapter 1 “Contacting Nekki” of this Privacy Policy.
755	1	As noted in the Terms of Use http://narvii.com/tos, we do not knowingly collect or solicit personal information from anyone under the age of 13 or under the age of 16 in countries subject to the EU General Data Protection Regulation (the “GDPR”), unless exempted by individual country exceptions (for more information, please see “EU Residents” below). If you are under 13, or 16 where applicable, please do not attempt to register for the Services or send any personal information about yourself to us. If we learn that we have collected personal information from a child under the required minimum age, we will delete that information as quickly as possible. If you believe that a child under the required minimum age may have provided us personal information, please contact us at legal@aminoapps.com.
3969	1	Please be aware that not all information sharing is covered by the “Shine the Light” requirements and only information on covered sharing will be included in our response.
3854	0	Telegram is a communication service. You provide your mobile number and basic account data (which may include profile name, profile picture and about information) to create a Telegram account.
2129	1	The only personal information we collect from users who have identified themselves as below the age of 13 for the purposes of offering our services are persistent identifiers (such as device ID, IDFA, IDFV, advertising ID, IP address). Such persistent identifiers are used and shared with third parties solely for providing support for the internal operations meaning to place contextual advertisement (including frequency capping), to authenticate users of or personalize the content on Apps, to maintain or analyze the functioning of the Apps, personalize the content of the App (such as sending push notifications), to perform network communications to protect the security or integrity of the user or the App, to ensure legal or regulatory compliance.
259	1	Chatous does not knowingly collect or retain Personal Data about persons under 13 years of age. Any person who provides their Personal Data to Chatous through the Services represents that they are 13 years of age or older. We encourage parents and legal guardians to monitor their children’s Internet usage and to help enforce our Privacy Policy by instructing their children never to provide Personal Data on the Services without their permission. If Chatous learns that Personal Data of persons under the age of 13 years has been collected on the Site without verifiable parental consent, then Chatous will take the appropriate steps to delete this information.
2825	1	We recognize the need to provide further privacy protections with respect to personal information we may collect from children on our Sites and Games. Some of the features on our Sites and Games are age-gated so that they are not available for use by children, and we do not knowingly collect personal information from children in connection with those features.
1357	0	to comply with legal obligations.
4721	0	"To the extent this services, makes use of, or contains links to other third-party websites (""Third Party Services""). We are not responsible for the privacy practices or the content of the Third Party Services, Camsurf is not responsible for the Privacy Practices or content of those other websites or Services, and it is your responsibility to review the Privacy Policies at those websites to confirm that you understand and agree with their policies."
593	0	Album: Sending and saving pictures
538	0	Users outside the EU may also request explanation, correction, deletion or copies of their personal data here.
3861	0	We may transfer your personal information across national borders to other countries in compliance with applicable laws.
909	1	All of our games are made for people who are at least 13 years of age.
1637	0	To improve the monetisation via in-app purchases
4443	0	What type of data we collect and process?
3975	1	If you are a parent or guardian of a user of our Services who is under 13, or 16 where applicable, you may contact us at any time to ask that (a) we stop collecting Personal Data from such user and (b) we delete any Personal Data already collected from such user. Please contact us at legal@aminoapps.com to request deletion of the account of an underage user. Be advised that we may ask for additional verification and documentation to confirm your identity and authorization to make this request.
312	1	Lima Sky does not knowingly collect Personal Information from persons under the age of 13 without parental consent. Lima Sky requires device owners to specify their age before any Personal Information is collected. If it comes to Lima Sky’s attention that Personal Information has been collected from a person under the age of 13, Lima Sky will delete this information as quickly as possible. If you believe that Lima Sky may have Personal Information from or about a child under the age of 13, please contact Lima Sky at info@limasky.com.
713	0	Please note that Level Eight may provide links to other games and websites that are operated and hosted by third parties who may have their own information collection practices. Those other games and websites are governed by their own privacy policies, which may be substantially different from Level Eight’ policies. Visitors to other games and websites are encouraged to review the privacy policies and information collection practices of those websites.
656	1	6. Privacy Policy Concerning Children
502	0	GOGO LIVE uses cookies to store and sometimes track information about you. A “cookie” is a small amount of data that is sent to your browser or device from a web server and stored on your device’s hard drive. Generally, GOGO LIVE uses cookies to collect additional service usage data, to improve the GOGO LIVE Services, and to personalize your experience. Using cookies helps ensure a safe experience; prevent spam, scanners, and phishers; and facilitate user-to-user interactions, such as chatting, posting and sharing content, and providing links to third-party services.
4581	0	Revoking permissions. If you let us use your information, you can always change your mind and simply revoke your permission by changing the settings on your device if your device offers those options. Of course, if you do that, certain services may lose full functionality.
1231	1	2. Grounds for Processing
1749	0	We may collect and process your personal information as described below:data that you provide to us through our Services;data you provide to us in connection with your contacting us or reporting a problem with our Services;information about your activity as a User of our Services, which we collect automatically (such as IP address, country of origin, shopping)
3808	0	If you have any questions or concerns about our use of your personal information, please contact us at:The data controller of your personal information is A Thinking Ape Entertainment Ltd.© 2017–2018 A Thinking Ape Entertainment Ltd.
4277	0	Last Updated: March 7, 2019
2044	0	We put your right of privacy first and that’s why your personal data is processed by us in accordance with applicable regulations.
537	0	Trip.com collects and uses the information you provide to us directly in order to provide you with the services you request. For example, you may provide us your name, gender, birthday, mobile number, email, and other information when you register a Trip.com account. When booking flight or train tickets, or using our car rental service, you may provide passenger names, genders, ID document numbers and the contact person’s name, mobile number, email and delivery address, as well as other information. When booking hotels and tickets for tourist attractions, you may provide the travelers’ names, contact person’s name, mobile number, and email, etc. When paying for travel products, you may provide your bank card number, the mobile number previously provided to the bank, or your credit card number, cardholder name, expiry date, etc.
3814	1	"Our Services are not directed to children under 16 or other statutory minimum age according to the applicable laws and regulations in your country (the ""Minimum Age""). We do not knowingly collect PII from children under the Minimum Age. If a parent or guardian becomes aware that his or her child has provided us with information without their consent, he or she should promptly contact us and we take reasonable steps to ensure that such information is deleted from our files."
2076	1	6.1. We do not knowingly collect or solicit personal information from anyone under 3 years old or knowingly allow such persons to register.
2433	1	We do not use the Application to knowingly solicit data from or market to children under the age of 16. If a parent or guardian becomes aware that his or her child has provided us with information without their consent, he or she should contact us at dvloper.apps@gmail.com .
2614	0	to advertisers and third party advertising networks and analytics companies as described in the section below
2345	0	Restaurant partners.
589	0	We may let other companies use cookies, web beacons, and similar tracking technologies on the services. These companies may collect information about how you use the services and other websites and online services over time and across different services. This information may be used to, among other things, analyze and track data, determine the popularity of certain content, and better understand your online activity.
4818	1	If you are users located in the EEA , we provide you an opportunity to manage your information,  you can learn more in our Information Management Guide.
4078	1	We do not use our Online Services to knowingly solicit information from or market to children under the age of 13. Our terms of use prohibit users aged under 13 years from accessing our Online Services.  In the event that we learn that we have collected personal information from a child under 13 years of age we will delete that information as quickly as possible. If you believe that we might have any information from or about a child under 13 years of age please contact us at privacypolicy@kwalee.com.
3686	0	You may opt out of the use of the DoubleClick Cookie for interest-based advertising by visiting the Google Ads Settings web page: http://www.google.com/ads/preferences/
1576	0	The Service may contain links to other websites.
2698	1	If you wish to review or change the information we have about your children, email us at privacysupport@pikpok.com.
4227	1	If you have additional questions about SayGames's privacy practices related to children under the applicable minimum age, please contact us at info@saygames.by.
