	sentiment	review
4716	1	"COPPA: HOMER Learning adheres to the Children's Online Privacy Protection Act (“COPPA”). COPPA is a law in the United States that regulates the way in which online Websites may collect and use information from children. We do not collect or use information in a manner that is inconsistent with the COPPA. In fact, as stated fully below, no personal information is required from you to visit our Sites. For more information on the COPPA please visit Children's Online Privacy Protection Rule (""COPPA"") or consult this simple one-page informational guide from the kidSAFE Seal Program. "
1091	0	You recognize and agree that the analytics companies utilized by Trials of Heroes may combine the information collected with other information they have independently collected from other services or products relating to your activities. These companies collect and use information under their own privacy policies
4187	0	Process or facilitate payments for those services.
3489	1	Kids Privacy Assured by PRIVO: COPPA Safe Harbor Certification
2360	0	" If you have questions about or need further information concerning the legal basis on which we collect and use your personal information, please contact us using the contact details provided under section H. ""HOW TO CONTACT US""  below."
6	1	B. Parental Access
1106	0	From time to time, we may update this Privacy Policy to clarify our practices or to reflect new or different privacy practices, such as when we add new features.  We reserve the right to modify and/or make changes to this Privacy Policy at any time.
1025	0	Partners offering goods and services in our Products.
3950	0	Consultants, lawyers, accountants and other professional service providers.
5463	1	access the chat, leaderboard, forums, SNS (Facebook, Game Center, etc)
4538	0	If our app has your permission, we collect contact information from your mobile address book to connect you to your friends on imo.
600	1	In September 2013, California enacted amendments to the California Online Privacy Protection Act (California Business & Professions Code §§22575-22579) which require operators of websites to disclose how they respond to “do not track” (DNT) signals from browsers used by consumers or other mechanisms that provide consumers a choice regarding the collection of personally identifiable information about the consumer’s online activities over time and across different websites or online services. While some newer browsers have incorporated “Do Not Track” features which, when turned on, send a signal or preference to the web sites you visit indicating that you do not wish your online activity to be tracked, a DNT protocol that can be implemented across multiple devices and sites has not yet been widely adopted. Currently, our computer system does not support, and cannot act on DNT signal headers that we may receive; accordingly, the choices that we provide you concerning out collection and use of personally identifiable information will continue to operate as described in this policy.
2140	0	Therefore, you are encouraged to review the privacy policies of all third parties' services. Without limiting anything in the following section, we are not liable in any way for the actions, inactions or policies of any external services. 
2645	0	n the unlikely event of a data breach affecting your personal information, we will inform you in accordance with laws and regulations by email or other means.
4201	0	We try to make sure that the recipient of any personal data provides a proper protection of the personal data received, in accordance with the current legislation on the protection of such information. By using the App, you agree that we may transfer your personal data to any third country, a territory or one or more specified sectors within that third country, or to the international organization.
5232	1	Do we let third-parties, including ad networks or plug-ins collect PII from children under 13?
1189	0	1. Non-personal Data
3078	0	The core of our service is the SuperVPN Private Network which provides private and secure data transmission. If you are using the SuperVPN Virtual Private Network (VPN) Service, we route all of your Internet traffic through our network. In each case, our software client establishes and maintains an encrypted tunnel between your device and our network
2175	0	You may also participate in referral programs or sweepstakes. Doing so will also mean providing us with your name and contact information. In addition to this, you can provide us with feedback or ask for help with using Trip.com’s travel services.
4799	1	As noted in the Terms of Use, we do not knowingly collect or solicit personal information from anyone under the age of 13. If you are under 13, please do not attempt to register for the Services or send any personal information about yourself to us. If we learn that we have collected personal information from a child under age 13, we will delete that information as quickly as possible. If you believe that a child under 13 may have provided us personal information, please contact us at support@inkitt.com.
1594	1	If you are under 15 years of age or a minor in your country of residence, please ask your legal guardian’s permission to use or access the Services. Magic Seven takes children’s privacy seriously, and encourages parents and/or guardians to play an active role in their children's online experience at all times. Magic Seven does not knowingly collect any personal information from children below the aforementioned age and if Magic Seven learns that Magic Seven has inadvertently gathered personal data from children under the aforementioned age, Magic Seven will take reasonable measures to promptly erase such personal data from Magic Seven’s records.
1186	1	Protecting the privacy of young children is especially important. HOMER Learning takes special care to ensure the privacy of users who are children under the age of 13. For that reason, we do not knowingly collect or maintain personally identifiable information from persons under 13 years of age without the express authorization of a parent or guardian.
850	1	"If you are in the EEA the data controller of your personal information is Alibaba.com Singapore E-Commerce Private Limited (incorporated in Singapore with Company Reg. No. 200720572D). For contact details, please see section H. ""HOW TO CONTACT US"" below. "
1410	0	Friends Matching:  With your consent, we may periodically access your contacts and friends list on your mobile device and/or your social network account(s) that you use to sign in to our Website or Application.  We will use your contacts’ information to help you find your friends and play our Games socially with them.  
1308	1	"We encourage parents to visit the GetNetWise.org site and look through the ""Kids Safety"" section together. Your efforts to instill responsible information practices will help steer your children to age-appropriate sites and will go a long way toward ensuring that your children have enriching experiences online."
434	1	This Kids Apps Privacy Policy is appointed to provide the legal guardian of a child under the age of 13 with guidance regarding our privacy policies that concern collecting, using and disclosing personal information of children under 13.
1193	1	The Services are not directed to children under 13 years of age, and imo does not knowingly collect Personally Identifiable Information from children under 13 years of age. If you learn that your child has provided us with personal information without your consent, you may delete your child’s entire account, by selecting the “Delete imo account” option in your child’s imo app settings or alert us at privacy@imo.im. If we learn that we have collected any personal information from children under 13 (and in certain jurisdictions under the age of 16), we will promptly take steps to delete such information and terminate the child’s account.
4782	0	Examples of these legitimate interests include:Operation and improvement of our business, products and services
2089	0	We collect information by placing cookies on a computer or mobile phone. Cookies is a piece of text stored on your device by your web browser. Cookies stores information about visiting a website, recognizes you and your preferences every time you visit Topface, and provides the functionality of the site, allowing us to provide services to our users upon request.
2537	0	4(B) Send Service-related Communications
1292	1	8.3. Under California law, California residents who have an established business relationship with us have the right to request certain information with respect to the types of personal information we have shared with third parties for their direct marketing purposes, and the identities of those third parties, within the immediately preceding calendar year, subject to certain exceptions. All requests for such information must be in writing and sent to: Nordeus Limited, 3rd Floor, Kilmore House, Park Lane, Spencer Dock, Dublin 1, Ireland. This same California law permits us to provide you, in response to your written request, with a cost-free means to choose not to have your information shared rather than providing the above described information.  You may exercise that choice by contacting us at the address above.
3659	0	- We will not sell, rent or transfer your Personal Information to third parties without your prior consent. 
5272	0	By tapping “Accept” button below you explicitly agree to the Terms and Conditions of Use, Privacy Policy (in particular, to sending your data to third parties, as described above and in the Privacy Policy).
3052	1	(a) If you are located outside of the United States of America this Agreement shall be governed by and construed in accordance with the laws of Sweden, without giving effect to any principles of conflicts of law, and the parties hereby consent to the sole and exclusive jurisdiction of the courts of Sweden, with the district court of Umeå (Umeå Tingsrätt) as first venue, to resolve any disputes arising out of or relating to this Agreement.
2325	0	This Privacy Policy explains the different kinds of information Nordeus can collect from you when you’re using the Nordeus Services. Legally, we cannot and will not collect personal information about children below 13 without parental/guardian involvement. We will comply with applicable privacy laws.
5344	1	The Service is not geared toward children under the age of 13 and we do not knowingly collect personal information from children under the age of 13. If we learn that a child under 13 has provided us with personal information we will delete such information from our files as quickly as possible. 
1989	0	Your personal data are processed for as long as necessary for the processing purposes mentioned above. AVCR will de-identify your personal data when these are no longer necessary for the said purposes, unless:a legitimate intrest of AVCR or a third party to archive your personal data in an identifiable form prevails over your intrest to de-identify;a legal measure, mandatory public authority measure or court order prevents such de-identification.
5401	0	How do we use your information?
2526	0	The cases that require legal compliance with the legislations in force and international agreement that are also effective in the domestic law.
3534	1	LIKE has zero tolerance to any form of child abuse or exploitation. Your data (including private messages) may be shared with law enforcement agencies if we have reasonable grounds to believe that you have engaged in child pornography, or if we are requested to do so by law enforcement agencies.
3447	0	Some of the Services may be characterized by interaction with our Trusted Partners. Therefore, we may share some of your personal information with our Trusted Partner, which will be protected based on their privacy policies. Due to the optionality of such access, it will be preceded by your explicit consent, which you can always withdraw.
1898	0	Right to rectification: If your Personal Data is inaccurate or incomplete, you are entitled to ask that we correct or complete it. If we shared your Personal Data with others, we will tell them about the correction where possible. If you ask us, and where possible and lawful to do so, we will also tell you with whom we shared your Personal Data so you can contact them directly.
2288	1	If you are a parent of a child who is under 13 years of age (or under another age specified by applicable regulations) and believe your child has provided us with information, please contact us at  support@ngames.mobi  and we will delete the information from our system.
498	1	To obtain this information from us, please send an email message to support@betterme.tips which includes “Request for California Privacy Information” on the subject line and your state of residence and email address in the body of your message. If you are a California resident, we will provide the requested information to you at your email address in response.
689	1	These Services do not address anyone under the age of 13. I do not knowingly collect personally identifiable information from children under 13. In the case I discover that a child under 13 has provided me with personal information, I immediately delete this from our servers. If you are a parent or guardian and you are aware that your child has provided us with personal information, please contact me so that I will be able to do necessary actions.
1338	1	"This Privacy Policy covers our treatment of personally identifiable information (""Personal Data"") that we gather when you are accessing or using our Services, but not to the practices of companies we don’t own or control, or people that we don’t manage. We gather various types of Personal Data from our users, as explained in more detail below, and we use this Personal Data internally in connection with our Services, including to personalize, provide, and improve our services, to allow you to set up a user account and profile, to contact you and allow other users to contact you, to fulfill your requests for certain products and services, and to analyze how you use the Services. In certain cases, we may also share some Personal Data with third parties, but only as described below."
1528	1	We do not knowingly process personal data from persons under 16 years of age. If you learn that anyone younger than 16 has provided us with personal data, please contact us at support@get-headway.com.
1756	0	Who you may choose to share your User Content with
5292	0	We do not keep logs of your online activities and never associate any domains, or applications that you access while the Wuma VPN is connected with you, your device.
4572	1	For Users in the EEA, where we transfer your information to a third party provider that is not located in the EEA, and is not subject to an adequacy decision by the EU Commission, we will require those third party providers to enter into an agreement that provides appropriate safeguards for your information. From time to time we may also seek your consent to transfer your information to a third country outside the EEA.
1041	1	Like many other things in life, parents and guardians have control over how children use Canva. We donﾡﾯt want children to upload personal information and weﾡﾯll delete that information if we learn about it.
37	1	We do not collect information from children under 13
2854	1	Under California Civil Code Sections 1798.83-1798.84, California residents are entitled to contact us to prevent disclosure of Personal Data to third parties for such third parties' direct marketing purposes; in order to submit such a request, please contact us at legal@aminoapps.com.
3870	1	Our services are not intended for—and we don’t direct them to—anyone under 13. And that’s why we do not knowingly collect personal information from anyone under 13. If we need to rely on consent as a legal basis for processing your information and your country requires consent from a parent, we may require your parent’s consent before we collect and use that information.
2407	1	Parents can review the personal information we have collected from their child and request them to be deleted.  Parents can also revoke their previously provided consent to collection or use of the child’s information.  If you are a parent and wish to review, modify, or delete your child’s personal information, or withdraw consent, you can submit a request to our Privacy Administrator at the address, e-mail address or telephone number provided below.
4100	1	As used herein, the “child” or “children” means under the age of 13, and the term “parent” includes legal guardians.
3266	1	Under California law, California residents who have an established business relationship with us have the right to request certain information with respect to the types of personal information we have shared with third parties for their direct marketing purposes, and the identities of those third parties, within the immediately preceding calendar year, subject to certain exceptions. All requests for such information must be in writing and sent to: Nordeus Limited, 3rd Floor, Kilmore House, Park Lane, Spencer Dock, Dublin 1, Ireland. This same California law permits us to provide you, in response to your written request, with a cost-free means to choose not to have your information shared rather than providing the above described information.  You may exercise that choice by contacting us at the address above.
5222	0	With your consent
3838	1	If a child states that his/her age is under 13, we will seek consent from the child’s parent before collecting personal information from the child; except we may collect and use certain information from the child for limited purposes without obtaining parental consent where permitted to do so by law. 
444	1	California Civil Code Section 1798.83 permits registered Account Holders of Camsurf that are California residents to request certain information regarding our disclosure of personal information to third parties, or to change privacy settings to the extent they are available. You may opt-out of communications, or request privacy related changes by contacting us at Privacy@Camsurf.com.
2380	1	When using the persistent identifiers we will not contact users under the age of 13, display behavioral advertising to them, nor do any user tracking or profiling. In addition, we strive that all of our advertising partners adhere to the same standards for the collection, usage and disclosure of children’s personal information as we do, but we can not be responsible if they breach the commitments they gave to us regarding the collection of information. In case of such breaches you agree that our liability is limited to the amounts we are able to receive as indemnification for the breaches from our advertising partner. For the detailed information about disclosure to third parties please see section How do we share your information and data to third parties of this Privacy Policy. For any additional questions about third party information disclosure please refer to privacy@outfit7.com.
3108	0	The Application obtains the information you provide when you download, register and use the Application. Registration with us is mandatory in order to be able to use the basic features of the Application.
1184	1	We ensure that we comply with the applicable law and regulation regarding children's online privacy protection, and does not knowingly collect personal information about users directed to children under the age of thirteen (13). If you are in the EEA, our Services are not directed to children under 16 and we do not knowingly collect personal information from children under 16. If a parent or guardian becomes aware that his or her child has provided us with information without their consent, he or she should promptly contact us and we take reasonable steps to ensure that such information is deleted from our files.
877	1	We do not knowingly collect personally identifiable information from anyone under the age of 18. If you are a parent or guardian and you are aware that your child has provided us with Personal Data, please contact us. If we become aware that we have collected Personal Data from children without verification of parental consent, we take steps to remove that information from our servers.
4570	1	You may be required to open an Account directly with LINEKONG GROUP by completing the registration process and providing true, accurate, current and complete information about yourself. LINEKONG GROUP do not knowingly solicit any personally identifiable information from children under the age of 13. If we determine, in our sole discretion, that a person is under the age of 13, based on the information provided during the registration process, that person will not be permitted to register.
1038	0	Tunnellight VPN does not share your IP address, browsing history, or any other information you choose Tunnellight VPN to provide, with advertisers. Nevertheless, advertisers may be able to collect certain information independently from you or your device when serving ads from the Tunnellight VPN application, including your device’s advertising ID, IMEI, MAC address, and wireless carrier.
2268	0	We use the information we have (including your activity off our Products, such as the websites you visit and ads you see) to help advertisers and other partners measure the effectiveness and distribution of their ads and services, and understand the types of people who use their services and how people interact with their websites, apps, and services. Learn how we share information with these partners.
2655	1	We encourage parents to instruct their children about privacy and the way they use their information on the Internet. Children should never disclose their name, address or phone number, or any personal information, without their parents’ prior permission.
4211	1	Our Services are not designed for persons under 18. We do not knowingly collect information from persons under 18, including children under 13 in particular. If we discover that a child under 13 has provided us with personal information, we will delete such information from our systems.
5313	1	In accordance with applicable law, obtaining consent from parents for the collection of personal information from their children, or for sending information about our products and services directly to their children
5364	0	We want to make sure that your personal information is accurate and up to date. You may ask us to correct or remove your personal information by contacting us at netmarbles@igsinc.co.kr. You may also update your account information by logging into your account.
533	0	Whenever you use our services, we aim to provide you with access to your personal information. If that information is wrong, we strive to give you ways to update it quickly or to delete it – unless we have to keep that information for legitimate business or legal purposes.
5332	0	c – Information we obtain from our partners
5147	1	Topface deliberately does not collect any information about minors. We do not engage or encourage the use of our service by persons under the age of majority. If we become aware of the registration of a user under the age of majority, the statutory residence of an EU citizen and the provision of their personal data, we will take measures to remove such profile and any information about it from Topface.
4193	0	You have the right to obtain (i) confirmation as to whether or not your Data is being processed by us and, if so, (ii) more specific information on the Data. The more specific information concerns, among others, processing purposes, categories of Data, potential recipients or the duration of storage.
1520	1	We do not knowingly and directly collect and store on its servers any personal information from children under the age 13 as that would be a violation of COPPA. Some information may be collected by third party providers of services (advertising networks, etc.) or certain products.
3319	0	Page view and actions statistics
4161	0	For more information on the privacy practices and policies of InMobi, please visit the InMobi Privacy Policy: http://www.inmobi.com/privacy-policy/
179	1	We do not knowingly collect or solicit personal data from anyone under the age of 16 or knowingly allow such persons to use our Services. If you are under 15, please do not send any information about yourself to us, including your name, address, telephone number, or email address. No one under the age of 16 may provide any personal data. In the event that we learn that we have collected personal data from a child under age 15, we will delete that information as quickly as possible. If you believe that we might have any information from or about a child under the age of 16, please contact us.
4253	1	The Internet offers a world of opportunity for children. Your guidance and involvement are essential to help ensure that children have a safe and rewarding online experience. We encourage you to stay involved in and informed about what your child is doing online. Your efforts to instill responsible information practices will help steer your children to age-appropriate sites and will go a long way toward ensuring that your children have enriching experiences online.
