	sentiment	review
1894	1	If you live in a country in the European Economic Area (EEA), the Services are provided by Telegram, which for the purposes of applicable data protection legislation is the data controller responsible for your personal data when you use our Services. However, as Telegram is located outside the EEA, we have designated one of our EEA-based group companies, Telegram UK Holdings Ltd (71-75 Shelton Street, Covent Garden, London, England, WC2H 9JQ), as a representative to whom you may direct any issues you have relating to our processing of your personal data.
334	1	If you located in the EEA, as required by law, you hereby grant your consent to us to use or process your personal information only for the purpose described above once you use the Software or the Service. And you may withdraw your consent at any time by contacting us.
3180	1	We do not knowingly collect personal information from children under 18 years of age. If you are under 18 years old, please do not provide any personal information to us.
358	0	Social networks
343	0	AdJust GmBH https://www.adjust.com/terms/privacy-policy/
917	1	California’s Shine the Light law gives California residents the right to ask companies once a year what personal information they share with third parties for those third parties' direct marketing purposes. Learn more about what is considered to be personal information under the statute.
4587	1	If we consider that any of our Services are directed at users under the minimum legal age required in their country of residence, we can block such users from using the Services or from providing information and/or limit the collection of information from such users as more particularly described below.
3732	0	We will store your Personal data for the period of execution of the contract between you and us. We will be however entitled to store your data after termination of the contract for the period prescribed in law (e.g. tax regulations). Of course, if we collect and process your personal data on your consent, we can do this as long as the contract between us is valid or until you withdraw your consent.
5303	1	We appreciate the need to provide extra privacy protections to users who are children. Our Services are intended for general audiences over the age of 16 years. We do not knowingly collect personal information from children under 16 years of age. In order to request the deletion of personal data, for any reason, please use the in-app support feature in our Services or contact us at the address provided below and we will take reasonable measures to promptly delete such personal data from our records.
2124	0	Information such as billing information, IP addresses, mobile numbers and e-mail addresses is retained to combat fraud and spam as long as it is relevant. Usually this period is determined by the period of validity of the method of payment.
2075	0	Communications data
479	1	If you are between 13 and 16 years old, we will not collect Your personal data without the explicit consent of a person that is the holder of parental responsibility over You. The consent of the holder of parental responsibility shall be given through the e-mail or other ways.
3641	0	We will record your installed app information, only for handling DMCA complaints. If we receive a DCMA complaint, we will analyze installed app information of the abuser so that we can block all applications that may cause DMCA complaints.
933	0	Information we get from third parties
5006	0	collect any personal information you may disclose through messages you choose to send to another user or defined group of users through our message, chat, post or other in-game function, as well as to collect necessary personal information of the user(s) you are contacting, in order to facilitate the communication (Note: We will never collect any information sent outside of the functionality of our Services, including through emails or text messages)
435	0	If you wish to make a complaint over the processing of your personal data, you have the right to lodge a complaint to the relevant supervisory authority.
189	1	We do not use the Application to knowingly solicit data from or market to children under the age of 13. If a parent or guardian becomes aware that his or her child has provided us with information without their consent, he or she should contact us at walli@shanga.co. We will delete such information from our files within a reasonable time.
2650	0	Information we collect automatically through the app
1293	0	The Service may contain links to other websites. The fact that the Service links to a website or presents a banner ad or other type of advertisement does not mean that LONG TECH NETWORK LIMITED endorses or authorizes that third party, nor is it a representation of our affiliation with that third party. LONG TECH NETWORK LIMITED is in no way responsible for the privacy policies of these other websites to which users choose to access from the Service. Please be sure to read the privacy policies of those websites when exiting the Service.
1071	0	To learn more about how we use cookies in connection with Facebook Business Tools, review the Facebook Cookies Policy and Instagram Cookies Policy.
2421	1	If you are a resident of the European Union, and if you are not satisfied with our resolution of your complaint, you may complain to an applicable data protection authority where you live or where you believe a breach may have occurred, as the case may be.
4311	1	SHAREit does not knowingly collect any personal identification information from children under the age of 13 (or such legally required age of consent for Juveniles as defined under applicable laws) or knowingly allow such person to register on SHAREit. In the event that we are notified that we have collect personal information from a child under the age of 13 (or such legally required age of consent for Juveniles as defined under applicable laws) without parental consent, we will suspend the account and delete relevant information as quickly as possible. If you believe that we might have any information from a child under 13(or such legally required age of consent for Juveniles as defined under applicable laws), please contact us at legalsupport@ushareit.com.
5345	1	We have to protect children’s privacy and safety online which includes complying with restrictions on marketing to those under 13. Without their legal guardians’ consent, children under 13 cannot use any of our apps. In addition, they may not install, use or access these apps, or are requested to erase them from their device in case of previous installation if they or their legal guardians disagree with any term in this Privacy Policy.
3043	1	A minor must not create his or her own user account without the consent of his or her parent or guardian. If you are a minor, we recommend that you ask your parent or guardian to read this Privacy Policy carefully, and obtain the consent of your parent or guardian before using our services or providing us with information.
4049	0	If you wish to delete your contact information that we received from you when you contacted us, please send an e-mail to privacy@outfit7.com and your contact information will be deleted from our database.
1418	0	Additionally, this Privacy Policy, and our organizations Data Handling and Privacy Protocols are the result of input from a range of experts in the fields of security, legal, and technical and product engineering. Foremost, we want you to understand that your privacy is very important to us, and we will work with you to protect it, and the safety and enjoyment of our community.
3574	0	The Games may also contain third party tracking tools from service providers. We may use these third parties' tools in our Games, which may enable these third parties to analyse user information (including your personal data). While these third parties may have access to your personal information in connection with the performance of Games and other related services, they may not use such information for any purpose other than providing their services.
3191	0	We may send the information to the suppliers, service providers and other partners that provide support to our businesses, where such support includes but is not limited to providing technical infrastructure services, analyzing how our services are used, measuring the effectiveness of advertisements and services, providing customer service, facilitating payments or carrying out academic research and surveys. We will enter into strict data protection agreements with companies, organizations and individuals with which and whom we share personal information and require them to process the personal information in accordance with our instructions, this Privacy Policy and any other relevant confidentiality and security measures.
1949	0	Other parties authorized by you
868	1	California’s Shine the Light law gives California residents the right to ask companies once a year what personal information they share with third parties for those third parties' direct marketing purposes. Learn more about what is considered to be personal information under the statute.
5427	0	Your privacy is critically important to us. Our privacy policy will explain how personal information is collected, used and disclosed by the GeoZilla application and services. If you have questions or complaints regarding our privacy policy or practices, please contact us at support@geozilla.com. Our privacy policy may be modified from time-to-time. We will alert you that changes have been made by indicating on our privacy policy the date it was last updated. If we make any material changes we will notify you by email or by means of a notice on this web site prior to the change becoming effective. We encourage you to periodically review this page for the latest information on our privacy practices.
2973	0	Information about your game progress and activity
528	0	In processing personal data, the Company may take reasonable safety measures to ensure that personal data is not lost, stolen, leaked, altered, or damaged. The Company may use the following technical measures for such purpose.
2205	0	the personal data have been collected in relation to the offer of information society services.
4180	0	The Tunnellight VPN network is a no-log network. Except for the limited exceptions below, we do not collect any information transmitted through our network.
5190	0	Contact you about Service announcements, updates or offers
2751	0	To provide you with information, products or services (in particular the apps we develop) that you request from us or which we feel may interest you, where you have consented to be contacted for such purposes.
1880	1	We do not knowingly collect personal information from children under 18 years of age. If you are under 18 years old, please do not provide any personal information to us.
3851	0	Information we collect automatically through the app
282	1	If we deleted your profile because you violated our minimum age rule, we can save your email and IP addresses so you do not try to bypass our rules by creating a new profile.
2163	0	Your account, and registration information are protected so that only you can access your account. All personally identifiable information that we collect about you is stored in limited-access servers. The Service has technical, administrative, and physical security measures in place to protect against the loss and misuse of the information which is under our control. While we are committed to implementing reasonable and appropriate safeguards to protect your information against foreseeable risks, no computer system or information can ever be fully protected against any possible risk, and we cannot guarantee that unauthorized third parties will not be able to circumvent those safeguards, or access and/or use your personal information for improper purposes.
1654	1	We do not provide service focus on Children. If you are under 18, you may use our website when you are with a parent or guardian.
2382	0	Information We Collect
1715	1	The Sites and their contents are not targeted to minors (those under the age of 18) and we do not intend to sell any of our products or services to minors. If a minor has provided us with Personal Data without parental or guardian consent, the parent or guardian should contact DataProtection.AE@aliexpress.com (for AliExpress.com users) or DataProtection@service.alibaba.com (for Alibaba.com users) to remove the information.
11	1	Once a user indicates that he or she is under the age of 13, we will not collect any personal information from that user except certain limited information permitted by the law.  For example, we may ask for the name and online contact information of a child user’s parent in order to provide notice and obtain a parental consent.  In addition, we may collect certain information permitted by the law to support and protect the security, integrity and operation of our Services.
4579	0	You have a number of rights under European Data Protection law if you are an EU citizen.
309	1	Magic Seven may store and/or transfer your personal data to its affiliates and partners in and outside of EU/EEA member states and the United States in accordance with mandatory legislation and this Privacy Policy. Magic Seven may disclose your personal data to third parties in connection with a corporate merger, consolidation, restructuring, the sale of substantially all of Magic Seven’s stock and/or assets or other corporate change, including, without limitation, during the course of any due diligence process provided, however, that this Privacy Policy shall continue to govern such personal data.
3606	0	This Policy does not apply to, and we are not responsible for the data collection practices of these third party advertisers, and we encourage you to check their privacy policies to learn more about their use of cookies and other technology. You may visit https://help.chartboost.com/legal/privacy for information about Chartboost, http://www.admob.com/home/privacy for information about Google AdMob, and https://www.facebook.com/about/privacy/advertising for information about Facebook. We reserve the right to work with advertising networks other than those mentioned above.
1281	0	If you need to get in touch with our customer service team, or reach out to us through other means (such as through social media) we will collect information from you there too, such as your name and contact information.
4635	1	The Service is not directed to children under the age of thirteen (13) years old and we do not knowingly collect personally identifiable information from children under the age of thirteen (13) years old as part of the Service. If we become aware that we have inadvertently received personally identifiable information from a user under the age of thirteen (13) years old as part of the Service, we will delete such information from our records. If we change our practices in the future, we will obtain prior, verifiable parental consent before collecting any personally identifiable information from children under the age of thirteen (13) years old as part of the Service.
5306	0	We do not attribute any specific website visits or app usage to any specific user. We do not keep logs of your online activities and never associate any domains or applications that you use with you, your device, or email. Websites visited via our servers are aggregated and stored to: (1) Perform analytics on our services, including measuring whether our users, in aggregate, are able to successfully access certain websites or apps; (2) Troubleshoot service issues and improve service quality.
1222	0	If you have any questions or concerns regarding our Policy, please send us a detailed message at the address below, and we will try to resolve your concerns.
2552	0	Via third party IBA provider:MoPub http://www.mopub.com/optout/;Facebook Audience Network https://www.facebook.com/about/privacy/update?ref=old_policy;Facebook Ad Campaigns https://www.facebook.com/about/privacy/update?ref=old_policyInMobi http://www.inmobi.com/page/opt-out/;AppLovin https://www.applovin.com/optout;Google (Adx) https://www.google.com/ads/preferences/html/mobile-about.html;Google (AdMob) https://www.google.com/ads/preferences/html/mobile-about.html;My.Com https://target.my.com/privacy/;OpenX http://openx.com/legal/privacypolicy/interestbasedadvertising/;Inneractive - Please see Section MANAGE YOUR PRIVACY of Inneractive's privacy policy available at http://inner-active.com/privacy-policy/;Machine Zone http://www.networkadvertising.org/mobile-choices;Madgic http://www.madgic.com/opt-out-and-identifier-reset/;AerServ https://www.aerserv.com/third-party-opt-out/;Triapodi Ltd., dba Appreciate http://appreciate.mobi/page.html#/appoffers-opt-out;Smaato https://www.smaato.com/privacy/#section4;SMARTSTREAM.TV http://www.smartstream.tv/optout/cookieOptOut.php;Maiden Marketing PTE Ltd, dba Pokkt - Please see Section “10. Your choices and opting-out” of Maiden Marketing PTE’s privacy policy available at https://www.pokkt.com/privacy;Vungle https://vungle.com/opt-out/;PubMatic https://pubmatic.com/legal/opt-out/#IBA;AdAction https://www.networkadvertising.org/mobile-choices;AdColony https://www.adcolony.com/privacy-policy/#targetingchoices;Apple (Search Ads) https://support.apple.com/en-us/HT202074;Google (Ad Words) https://support.google.com/ads/answer/2662922?hl=en;Chartboost www.chartboost.com/useroptout;Motive Interactive http://motiveinteractive.com/privacy#opt-out;Max Advertising Systems, Inc., dba MAX http://maxads.io/optout.html;  Matomy Media Group Ltd., dba Mobfox https://www.mobfox.com/privacy-policy/#opt-out;Click Tech Limited (dba Yeahmobi) https://en.yeahmobi.com/can-users-opt-out-of-devices/;Snapchat https://support.snapchat.com/en-US/a/advertising-preferences;Gameloft S.E. – Please see Section “Limit Ad Tracking / Do Not Track of Gameloft Cookie Policy available at http://www.gameloft.com/en-gb/legal/showcase-cookie-policy;IQzone Inc. https://iqzone.com/about/privacy/#optout;Twitter https://help.twitter.com/en/safety-and-security/privacy-controls-for-tailored-ads;Etermax S.A. http://www.etermax.com/en/privacy/#publicity-analytics.
1277	0	We're constantly trying to improve our Services, so we may need to change this Privacy Policy from time to time as well, but we will alert you to changes via the Services (e.g., by posting a notice), by sending you an email, and/or by some other means. Please note that if you've opted not to receive legal notice emails from us (or you haven't provided us with your email address), those legal notices will still govern your use of the Services, and you are still responsible for reading and understanding them. If you use the Services after any changes to the Privacy Policy have been posted, that means you agree to all of the changes. Use of information we collect now is subject to the Privacy Policy in effect at the time such information is collected.
5044	1	"This section of the Privacy Policy applies only if you use our Platform or services covered by this Privacy Policy from a country that is a Member State of the European Union and in the event of and from the date of the UK's departure from the European Union, the United Kingdom (the ""EEA""), and supplements the information in this Privacy Policy. "
332	1	Under the laws of the State of California (US), California Residents who have an established business relationship with us may choose to opt out of our disclosure of personal information about them to third parties for direct marketing purposes. As detailed above, our policy is not to disclose personal information collected online to a third party for direct marketing purposes without your approval. If you choose to opt-out at any time after granting approval, email privacyofficer@pikpok.com.
5289	1	We do not knowingly collect, maintain, or use personal information from children under 13 years of age, and no part of our Services are directed to children. Legally you must be at least 13 years old to use the Services (but this might be older depending on whether or not a particular Service has a required minimum age rating) as per our Terms of Service. If you learn that a child has provided us with personal information in violation of this Privacy Policy, then you may alert us at support@ftxgames.com.
2639	1	We do not knowingly collect or solicit personal information from or direct or target interest based advertising to anyone under the age of 13 or knowingly allow such persons to use our Services.  If you are under 13, please do not send any information about yourself to us, including your name, address, telephone number, or email address.  No one under the age of 13 may provide any personal information.  In the event that we learn that we have collected personal information from a child under age 13, we will delete that information as quickly as possible.  If you believe that we might have any information from or about a child under the age of 13, please contact us.
4383	0	This Privacy Policy forms part of our Terms of Use, which are available at https://languagedrops.com/privacypolicy.html .
2194	1	We do not knowingly collect or solicit personal information from anyone under the age of 13 or knowingly allow such persons to use our Service. If you are under 13, please do not send any information about yourself to us, including your name, address, telephone number, or email address. No one under the age of 13 may provide any personal information. In the event that we learn that we have collected personal information from a child under age 13, we will delete that information as quickly as possible.
2720	1	If you have additional questions about Alexadra Games's privacy practices related to children under the applicable minimum age, please contact us at support@alexandragames.com.
3964	1	subscribe to newsletters
2243	1	You must be at least 16 years old to use the App. If you are accepting these Terms and using the App, you warrant that you state the correct age and you are 16 or more years old.
1266	0	Please make sure that the functions and services we provide to you will be updated and developed from time to time. If a certain function or service is not included in the above description and we have collected your information, we will inform you of the content, scope and purpose of information collection by page prompt, interactive process and announcement on website, so as to solicit your consent.
3664	0	When you request deletion of your personal data, we will use reasonable efforts to honor your request. In some cases we may be legally required to keep some of the data for a certain time; in such event, we will fulfill your request after we have complied with our obligations.
2260	1	If you are under 15 years of age or a minor in your country of residence, please ask your legal guardian’s permission to use or access the Services. Trials of Heroes takes children’s privacy seriously, and encourages parents and/or guardians to play an active role in their children's online experience at all times. Trials of Heroes does not knowingly collect any personal information from children below the aforementioned age and if Trials of Heroes learns that Trials of Heroes has inadvertently gathered personal data from children under the aforementioned age, Trials of Heroes will take reasonable measures to promptly erase such personal data from Trials of Heroes’s records.
5353	1	Our Games and related Services are intended for general audience.  We do not knowingly collect, use or share any personally identifiable information about children without verifiable parental consent or as permitted by law.  If you are a parent and you believe your child has provided us with personal information, you can contact us and request your child’s information to be deleted from our system.
115	1	For more information on how to protect children online, please visit this link.
2119	0	Grounds for retention: E-Commerce Act
4307	0	These personal data are processed by Our internal monitoring system.
1934	1	"By using the Application, you are consenting to our processing of your information as set forth in this Privacy Policy now and as amended by us. ""Processing,” means using cookies on a computer/hand held device or using or touching information in any way, including, but not limited to, collecting, storing, deleting, using, combining and disclosing information, all of which activities will take place in China. If you reside outside China your information will be transferred, processed and stored there under China privacy standards. "
2122	0	We take appropriate organisational and technical measures to protect the personal information that we hold. We limit access to your personal information to those who we believe reasonably need to come into contact with that information in order to carry out their jobs
4977	0	Other parties in connection with any company transaction, such as a merger, sale of company assets or shares, reorganization, financing, change of control or acquisition of all or a portion of our business by another company or third party or in the event of bankruptcy or related or similar proceedings; and third parties as required to (i) satisfy any applicable law, regulation, subpoena/court order, legal process or other government request, (ii) enforce our Terms of Use Agreement, including the investigation of potential violations thereof, (iii) investigate and defend ourselves against any third party claims or allegations, (iv) protect against harm to the rights, property or safety of Filmigo, its users or the public as required or permitted by law and (v) detect, prevent or otherwise address criminal (including fraud or stalking), security or technical issues.
