	sentiment	review
3174	0	For more information about Vungle, please visit Vungle Privacy Policy: http://vungle.com/privacy/
3041	1	We do not use the Application to knowingly solicit data from or market to children under the age of 13. If a parent or guardian becomes aware that his or her child has provided us with information without their consent, he or she should contact us at support@gamebeartech.com. We will delete such information from our files within a reasonable time.
3163	0	Sex, age, weight in case of request of additional information conducting.
4610	0	We will share your information with third parties only in the ways that are described in this Privacy policy.
5236	0	Right to withdraw consent: If we rely on your consent to process your Personal Data, you have the right to withdraw that consent at any time, but this will not affect any processing of your data that has already taken place.
2291	0	We use this data to enable us to fulfill our obligations to you as part of the Services (e.g. in cases where you request restoration of your account).
2426	1	To obtain this information from us, please send an email message to support@betterme.tips which includes “Request for California Privacy Information” on the subject line and your state of residence and email address in the body of your message. If you are a California resident, we will provide the requested information to you at your email address in response.
5266	1	This section summarizes Uber’s grounds for processing personal information under the GDPR, and the rights of EU users as relates to Uber’s handling of personal information.
4673	0	Overmobile shall keep the User’s Data and protect it against unauthorized access and distribution in accordance with the internal rules and regulations.
2671	0	Personal Data means data about a living individual who can be identified from those data (or from those and other information either in our possession or likely to come into our possession).
3696	1	These Services do not address anyone under the age of 13. I do not knowingly collect personally identifiable information from children under 13. In the case I discover that a child under 13 has provided me with personal information, I immediately delete this from our servers. If you are a parent or guardian and you are aware that your child has provided us with personal information, please contact me so that I will be able to do necessary actions.
2529	1	A Note to Users Outside of the Vietnam. If you are a non Vietnam user of the Site or the Services, by visiting the Site, using the Services and providing us with Personal Data, you acknowledge and agree that your Personal Data may be processed for the purposes identified in this privacy policy. In addition, your Personal Data may be processed in the country in which it was collected and in other countries, including the Vietnam, where laws regarding processing of Personal Data may be less stringent than the laws in your country. By providing your data, you consent to such transfer.
2912	0	We communicate with you, for example, by push notifications. These may include reminders and motivational messages encouraging you to follow your training and nutrition plan, or other information about the App. As a result, you may, for example, receive a push notification every day at a particular time reminding you to work out. To opt out of receiving push notifications, you need to change the settings on your device.
3896	1	You must be 18 or older to use our Services. Minors under 18 and at least 13 years of age are only permitted to use our Services through an account owned by a parent or legal guardian with their appropriate permission and under their direct supervision. We do not knowingly collect or solicit Information from anyone under the age of 13 or knowingly allow such persons to register for the Service.
1257	1	This section of the Privacy Policy applies only if you use our Sites or services covered by this Privacy Policy from a country that is a Member State of the European Union, and supplements the information in this Privacy Policy.
5130	1	The Service is not intended for children (i.e., under 14 years old for Koreans and under 16 years old for foreigners). If the Company becomes aware that the collected personal data is from a child, we will delete the personal data and close the subject user’s account. If you believe that the Company has collected personal data from a child, please contact privacy@weply.io.
3322	1	Children can be invited to take part in testing our games (playtests) with their parents' authorisation and/or their parents' physical presence being required depending on the country where the playtest is conducted.
1804	1	Our policy on children.
2215	0	AVCR sends your data to the USA if and to the extent necessary for the provision of our services. The security of your personal data is regulated under the EU-US Privacy Shield (https://www.privacyshield.gov) for the recipients certified thereunder.
4484	0	For example, some of our services require you to sign up with your social media account or phone number. When you do, we’ll ask for personal information like your email address, telephone number to store with your account. If you want to take full advantage of the sharing features we offer, we might also ask you to register with a Facebook account or telephone number, which may include your Facebook name and photo.
2723	1	If you live in the European Union, you confirm to have reached the legally required minimum age in your country for the processing of your personal data and that you have the approval of someone with parental authority.
2734	0	To monitor the usage of our Service
5310	0	The legal basis on which Overmobile relies for the use of User’s Data includes:Processing of User’s Data where User has given consent for one or more specific purposes;Processing of User’s Data that is necessary for performing a contract to which User are party;Processing of User’s Data that is necessary to take steps at User’s request prior to entering into a contract;Processing of User’s Data that is necessary for Overmobile to comply with a legal obligation.
1385	1	We apply the following limitations to personal information collection for a user that is not of the minimum legal age required in their country of residence.
2048	0	How do we use your Personal Information?
3060	0	When making a purchase, you enter your credit card details into a form supplied by the payment provider that will be processing the payment, and this information goes directly to the payment provider‘s server. Your credit card information never reaches Telegram’s servers. We do not access and do not store your credit card information. When you save your credit card info, it is saved on the respective payment provider's servers and the payment provider gives Telegram a token that you can reuse for future payments. It is not possible to reconstruct your credit card info from the token
2735	1	If you are under 15 years of age or a minor in your country of residence, please ask your legal guardian’s permission to use or access the Services. Eyewind takes children’s privacy seriously, and encourages parents and/or guardians to play an active role in their children's online experience at all times. Eyewind does not knowingly collect any personal information from children below the aforementioned age and if Eyewind learns that Eyewind has inadvertently gathered personal data from children under the aforementioned age, Eyewind will take reasonable measures to promptly erase such personal data from Eyewind’s records.
2892	0	Usage Information: We collect information about how you use our Services, such as the types of content that you view or engage with, the features you use, the actions you take, the other users you interact with and the time, frequency and duration of your activities.
3724	1	Parents of users under the age of 13: If you wish to exercise the rights referred in 5.1 with regard to your child, please send an email containing this information to: cookjameel@gmail.com, along with a copy of your passport (to prevent misuse of requests for information). After the verification of your identity, the copy of your passport will be deleted.
3344	0	When you delete your account, we delete things you have posted, such as your photos and status updates, and you won't be able to recover that information later. Information that others have shared about you isn't part of your account and won't be deleted. If you don't want to delete your account but want to temporarily stop using the Products, you can deactivate your account instead. To delete your account at any time, please visit the Facebook Settings and Instagram Settings.
5439	1	Camel Games will not knowingly collect personally identifiable information from any person under the age of 13. Camel Games encourages parents to instruct their children to never give out personal information when online. Parents who are concerned about the transfer of personal information from their children may contact us.
95	1	With respect to such a user, we will prevent the collection and use of his/her precise geolocation data and display to him/her contextual advertising only (excluding any behavioural advertising).
3600	0	the personal data have been unlawfully processed or
5137	1	California residents have the right to request (a) information identifying any third party to whom Netmarble may have disclosed (within the previous calendar year) his/her personal information for that third party’s direct marketing purposes; and (b) a description of the categories of personal information disclosed. If you are a California resident and wish to obtain such information, please send a request email to netmarbles@igsinc.co.kr.
2704	1	We do not knowingly process personal data from persons under 16 years of age. If you learn that anyone younger than 16 has provided us with personal data, please contact us at support@betterme.tips.
166	0	You are entitled to choose whether or not you would like to use cookies. If you do not approve to the use of cookies, please be sure to opt out, as in block or disable them using your browser settings. If you disable cookies, however, you may not be able to use all portions or functionalities of the Services.
3499	0	Information You Provide
4637	1	use any other feature where users could appear under their real names
1407	0	Object to us processing data about you
1885	0	We will share the collected information (Kids’ Persistent Device Identifier) with third parties only in ways described in this privacy statement. We may disclose personal information only in the following cases:if required by law, for example to comply with a court order, subpoena, regulation, legal process or other governmental request;to exercise or protect the rights, property or personal safety of the Company, our users or others;to enforce this privacy statement, including investigation of potential violations thereof;pursuant to the approval of a legal guardian, in order to supply certain services such legal guardian or the user may have requested from the Company;to collect, hold or manage Kids’ Persistent Device Identifier through our authorized third parties service providers, as reasonable for business purposes, which may be located in a country that does not have the same data protection laws as the user’s jurisdiction;to let our partners and affiliates serve the users with advertisements as permitted by applicable laws and rules;To detect, prevent, or otherwise address fraud, security or technical issues.
4011	1	LIKE is not directed to children, and if you are under the minimum age as specified in LIKE You Agreement, you may not create a LIKE account or use LIKE Services.
2868	0	Eyewind may also disclose your personal data to third parties when Eyewind has a reason to believe that a disclosure is necessary to address potential or actual injury or interference with Eyewind’s rights, property, operations, users or others who may be harmed or may suffer loss or damage, or Eyewind believes that such disclosure is necessary to protect Eyewind’s rights, combat fraud and/or comply with a judicial proceeding, court order, or legal process served on Eyewind. To the extent permitted by applicable law, Eyewind will make reasonable efforts to notify you of such disclosure through Eyewind’s website or in another reasonable manner.
4332	0	4.3 We will exercise our best efforts to avoid collecting irrelevant personal information by taking reasonably practicable measures. We will only retain your personal information for as long as necessary to fulfill the purposes set forth in this Policy, except where it is necessary to prolong the retention period or permitted by law.
655	1	6. Final Note to Parents and Our Commitment To Children’s Privacy
2893	0	We may feature advertisements served by third parties that deliver cookies to your computer/device so the content you access and advertisements you see can be tracked. Since the third party advertising companies associate your computer/device with a number, they will be able to recognize your computer/device each time they send you an advertisement. These advertisers may use information about your visits to our Service and third party sites and applications in order to measure advertisement performance and to provide advertisements about goods and services of interest to you. This Policy does not apply to, and we are not responsible for the data collection practices of these third party advertisers, and we encourage you to check their privacy policies to learn more about their use of cookies and other technology.
2214	0	You have the right to have your Personal Data erased where one of the following grounds applies, see Article 17 of the GDPR:The Personal data is no longer necessary in relation to the purposes for which it was collected or otherwise processed,
151	0	We may use the information collected through these technical methods for many purposes, including delivering content, tracking and enhancing our members’ experience on our websites. For example, when you return to use one of our Services after logging in, cookies provide information to the site so that the site will remember who you are. We also may use technical methods to analyze the traffic patterns on our Services, such as the frequency with which our members visit various parts of our Sites.
1726	1	Canva does not knowingly collect or solicit personal information from children under the age of 13 and the Service and its content are not directed at children under the age of 13. In the event that we learn that we have collected personal information from a child under age 13 without verification of parental consent, we will delete that information as quickly as possible. If you believe that we might have any information from or about a child under 13, please contact us at community@canva.com.
3369	0	By using the Service, you are agreeing to the collection and use of your personal information as outlined in this Privacy Policy.
3772	1	If you are a California resident, California Civil Code Section 1798.83 provides you with the right to request certain information regarding disclosure of your Personal Information to third parties for direct marketing purposes, including a description of the categories of Personal Information disclosed. We do not share your Personal Information with third parties for their marketing purposes.
103	1	The Services are not directed to individuals under the age of sixteen (16), and we request that they not provide personal information through the Services. If we find out that a child under 16 has provided personal information, we will take steps to delete that information.
4269	1	Parents/guardians of children under the age of 13 can email us an official request to review any personally identifiable information collected about their child, have this information deleted, and/or request that there be no further collection or use of their child's personally identifiable information. We will take steps to verify the identity of anyone requesting personally identifiable information about a child and to ensure that the person is in fact the child's parent or legal guardian.
873	0	We may also store some information locally on your device. For example, we may store information as local cache so that you can open the app and view content faster.
1028	1	These Services are not intended or regulated for persons who are not authorized to sign the binding legal contracts as governed by the laws of the respective countries. FINDNOW does not collect information from minors deliberately or without intention by way of services. We would like the parents and guardians of minors to take care of their children's online activities in order to prevent the collection of personal information from children without the parents'/guardians' consents.
3141	1	California Do Not Track Disclosure: Do Not Track is a privacy preference that users can set in their web browsers. When a user turns on the Do Not Track signal, the browser sends a message to websites requesting them not to track the user. At this time, we do not respond to Web browser “do not track” settings or signals. As described in our Cookie Policy, we deploy cookies and other technologies on our Service to collect information about you and your browsing activity, even if you have turned on the Do Not Track signal.
1864	1	We do not knowingly collect personal information from children under 18 years old (or the minimum age required for the creation of a GOGO LIVE Account absent parental consent in your country), unless permitted to do so by applicable law. Children under 18 years old are not permitted to use our Services. If we become aware that we have unknowingly collected personal information from a child, we will make commercially reasonable efforts to delete such information in our database. If you are a parent or guardian of a child, and you believe your child has provided us with their Personal Information on our Services, please contact us immediately at support@GOGO LIVE.com.
541	1	Under California Civil Code Sections 1798.83-1798.84, California residents are entitled to ask us for a notice identifying the categories of personal Information that we share with our affiliates and/or third parties for marketing purposes, and providing contact information for such affiliates and/or third parties. If you are a California resident and would like a copy of this notice, please submit a written request to the following address: Rooster Teeth Productions, LLC / Attn: Legal Department, 1901 E 51st St, Austin, TX 78723. We will respond to one request per California customer each year, and we do not respond to requests made by means other than as set forth above.
451	1	Personal Data of Children:  We do not knowingly collect or solicit Personal Data from anyone under the age of 16 in the EU.  If you are under age 16 and reside in the EU, please do not attempt to register for the Services or send any Personal Data about yourself to us.  If we learn that we have collected Personal Data from an EU resident under age 16, we will delete that information as quickly as possible. If you believe that an EU resident under age 16 may have provided us Personal Data, please contact us at support@inkitt.com.
1424	1	Comments or inquiries about this EU Data Protection Rights, requests to update information we have about Representatives, or requests to exercise Representatives’ rights may be sent to us by e-mail at info-eurigs@eurigs.com or call to us by phone +420 225 092 352
4308	0	In that case, we will consider applicable local laws, the nature of the order, as well as the legitimacy and proportionality of your information.
5039	1	Only the minimum required personal information of users in the EU domain will be collected in order to execute the Games and provide the Services, and any other information will be collected only with the consent of the user. You have the right to object to the way your personal information is processed by Netmarble by contacting Netmarble's Privacy Protection Department. Residents of EU Member States may contact Netmarble's Privacy Protection Department for any unreasonable treatment that exceeds the time or other limits required by law.   You may also be able to request judicial relief from the authorities in certain situations.
3040	1	Unless stated specifically to the contrary on the applicable Ubisoft Service, Ubisoft’s Services are intended for a general audience. Ubisoft encourages parents and guardians to spend time online with their children. We urge parents to instruct their children to never give out their real names, addresses or phone numbers, without permission, when using the Internet. We recognize a special obligation to protect personal information obtained from young children. Therefore, in order for children under 12 years old to register on any Service, we require that the child provides the email address, or other contact information, of a parent or guardian who will be contacted by Ubisoft in order to inform, confirm, modify or refuse his or her child’s registration. Ubisoft reserves the right to request written proof of the parent or guardian’s authorization at any time. Until the parent or guardian answered to Ubisoft’s email pursuant to Ubisoft’s instructions, the child’s use of the Services will be limited.
1476	0	LIKE cares about your privacy. Respecting your privacy is a fundamental policy of LIKE, and therefore, we formulate this Privacy Policy to inform you of how we collect, use and share your personal information.
1094	1	If you are in the EEA your controller is Alibaba.com Singapore E-Commerce Private Limited (incorporated in Singapore with Company Reg. No. 200720572D). For contact details, please see section J. HOW TO CONTACT US  below.
1836	0	We ensure that:the personal data is transferred to countries recognised as offering an equivalent level of protection or, 
752	1	These Services do not address anyone under the age of 13. We do not knowingly collect personally identifiable information from children under 13. In the case we discover that a child under 13 has provided us with personal information, we immediately delete this from our servers. If you are a parent or guardian and you are aware that your child has provided us with personal information, please contact us so that we will be able to do necessary actions.
5420	0	Duration of retention: three years
1069	1	We consider a user to be a child if they are under the age of 13, unless more stringent regulation applies in their country of residence. In EU countries, users under the age of 16 are considered children, unless the data protection regulation of their country of residence specifies another age.
2141	1	These Services do not address anyone under the age of 13. I do not knowingly collect personally identifiable information from children under 13. In the case I discover that a child under 13 has provided me with personal information, I immediately delete this from our servers. If you are a parent or guardian and you are aware that your child has provided us with personal information, please contact me so that I will be able to do necessary actions.
3681	0	Where you located in the EEA, as required by law, you hereby provide us with your express consent to transfer your data to where may be outside of EEA once you use the Service. You may withdraw your consent at any time.
3835	1	We do not knowingly collect personally identifiable information from children under 13. If you are a parent or guardian and you learn that your Children have provided us with Personal Information, please contact us. If we become aware that we have collected Personal Information from a children under age 13 without verification of parental consent, we take steps to remove that information from our servers.
3651	0	We will not store or collect your payment card details. That information is provided directly to our third-party payment processors whose use of your personal information is governed by their Privacy Policy. These payment processors adhere to the standards set by PCI-DSS as managed by the PCI Security Standards Council, which is a joint effort of brands like Visa, Mastercard, American Express and Discover. PCI-DSS requirements help ensure the secure handling of payment information.
3820	0	conduct research and analysis of users’ behavior to improve our services and content.
803	0	To facilitate the purchase of any Virtual Items (as defined in the Terms) Necessary for the performance of a contract
5231	1	We are aware of the obligation imposed on us to especially protect personal data obtained from children. Therefore, we shall not collect data from children under 16 years of age without a legal guardian’s prior consent. Each legal guardian may contact us at contact@boomhits.games.
3160	1	Limiting our collection of personal information from children to no more than is reasonably necessary to participate in an online activity
3920	0	Uber and its partners use cookies and other identification technologies on our apps, websites, emails, and online ads for purposes described in this policy.
