	sentiment	review
0	0	We may send cookies to your web browser (not the yummy kind) to help you use Canva. If you would like to adjust your cookie settings, please consult your browser instructions.
1	1	Information such as billing information, IP addresses, mobile numbers and e-mail addresses is retained to combat fraud and spam as long as it is relevant. Usually this period is determined by the period of validity of the method of payment.
2	0	Contacts.  You also may grant us access to your contacts.  If you do, we may collect the name, email address, and phone number of all your individual contacts.
3	0	We endeavor to ensure a level of security appropriate to the risks that are presented by the processing, having all due regard to the state of the art, the costs of implementation and the nature, scope, context and purposes of the processing as well as the risk to users. No method of transmission over the Internet, or method of electronic storage, is 100% secure, however. Therefore, while we use reasonable efforts to protect your personal information, we cannot guarantee its security.
4	0	You also have the right to correct your data, have your data deleted, object how we use or share your data, and restrict how we use or share your data. You can always withdraw your consent, for example by turning off GPS location sharing in your mobile device settings.
5	0	We take your privacy and the security of your personal information very seriously. To protect your personal information, Ubisoft maintains appropriate safeguards to ensure the security, integrity and privacy of the information you have provided. We use robust security measures to protect personal information from loss, misuse and alteration. We use industry-standard practices such as encrypted communications, physically secured rooms, firewalls and password protection systems to safeguard the confidentiality of your personal information.
6	0	Your IP address and mobile device identifiers (such as your advertising ID)
7	1	Our correspondence with our support team will be kept longer so that we can use it for any subsequent requests that may arise. Such correspondence deleted after 3 years in the absence of requests.
8	0	6.1. We may  transfer and maintain on our servers or databases some of your personal information outside the European Economic Area (EEA) including in Russia.
9	1	We store your information for as long as needed to provide you with our services. We may store information longer, but only in a way that it cannot be tracked back to you. We delete the information as soon as we do not need it for the purposes as described in this Privacy Policy and in any event no later than five (5) years after your interaction with all of our Games has ceased.
10	1	- Where a Member and an information and communications service provider (e.g., the Company) enters into a separate agreement regarding the period of retention of personal data.
11	1	We retain your Personal Data as long as needed to provide services or products to you, or as required or permitted by applicable laws, such as tax and accounting laws.
12	0	 The Service is not intended for children (i.e., under 14 years old for Koreans and under 16 years old for foreigners). If the Company becomes aware that the collected personal data is from a child, we will delete the personal data and close the subject user’s account. If you believe that the Company has collected personal data from a child, please contact privacy@weply.io.
13	1	Imo retains the personal information we receive as described in this Privacy Policy for as long as you use our Services or as necessary to fulfill the purpose(s) for which it was collected, provide our Services, resolve disputes, establish legal defenses, conduct audits, pursue legitimate business purposes, enforce our agreements, and comply with applicable laws.
14	0	Singapore Office: 10 Anson Road, International Plaza, Singapore
15	0	HOMER Learning frequently will be offering you additional online experiences and activities. In fact, some of the features that we describe below may not be available on our Services at this time. As we add more features to our Services, we may change this Privacy Policy to accommodate new technologies, industry practices, regulatory requirements or for other purposes. We will provide notice to you if these changes are material and, where required by applicable law, we will obtain your consent.
16	1	We retain personal information we collect from you where we have an ongoing legitimate business need to do so (for example, to provide you with a service you have requested or to comply with applicable legal, tax or accounting requirements).
17	0	We do not knowingly collect personally identifiable information from children under 13. If you are a parent or guardian and you learn that your Children have provided us with Personal Information, please contact us. If we become aware that we have collected Personal Information from a children under age 13 without verification of parental consent, we take steps to remove that information from our servers.
18	0	10557 Berlin
19	0	12) Investigations and complaints management: We use information you provide to investigate any complaints received from you or from others about our website, or our products and services. We also use data in connection with legal claims, compliance, regulatory and investigative purposes as necessary (including the disclosure of such information in connection with legal process or litigation).
20	0	5(C) Responding to Legal Requests and Preventing Harm
21	1	RETENTION PERIOD OF YOUR PERSONAL INFORMATION
22	1	LLC “WebmartGroup” stores the personal data relating to the User for 1 (one) year after closing, termination of the Personal account or uninstalling the application. Upon termination of the mentioned term personal data relating to the User are subject to destruction or depersonalization to ensure anonymity of such information via deletion of the personal identifying information.
23	1	We will retain your personal information for the purpose for which it was collected to provide you with Services. We may retain your personal information even after you have closed your account with us or we have ceased providing Services to you, if retention of your personal information is reasonably necessary to comply with our legal obligations, meet regulatory requirements, resolve disputes, prevent fraud, cheating or abuse, or enforce this Privacy Policy or any other agreement we may have with a user.
24	1	We will also retain Usage Information for internal analysis purposes. Usage Information is generally retained for a shorter period of time, except when this data is used to improve the functionality of our Services, or we are legally obligated to retain this data for longer time periods.
25	1	Following termination or deactivation of your User account, Canva may retain your profile information and User Content for a commercially reasonable time, and for as long as we have a valid purpose to do so. In particular, Canva may retain your information for the purpose of comply with its legal and audit obligations, and for backup and archival purposes.
26	1	We generally retain your personal information for as long as is necessary for the performance of the contract between you and us and to comply with our legal obligations. If you no longer want us to use your information that we physically access and store, you can request that we erase your personal information and close your account.
27	1	With respect to processing of Personal Data Level Eight is Data Controller. Level Eight shall (i) Not keep the Personal Data for longer than is necessary for the purposes of performing the Agreement unless further storage is required in order to establish, exercise or defend a legal claim or to comply with applicable law, including accounting rules; (ii) Store, process and use the Personal Data for the sole purpose of performing the Agreement; and (iii) Ensure that their employees and employees of their affiliates and subcontractors involved in the performance of the Agreement comply with the provisions of this agreement (iv) Implement all reasonable technical and organizational measures to protect your Personal Data against any accidental or unlawful destruction, accidental loss, unauthorized alteration, communication or access, (v) Where applicable report to you, upon its occurrence, any unauthorized access, disclosure, use, modification or destruction of  your Personal Data, (vi) Refrain from exporting or transferring  your Personal Data to any Third Country, and from collecting, using or Processing Personal Data within any Third Country, unless prior to the transfer we have ensured that an adequate level of protection of the Personal Data has been implemented in accordance with the terms and conditions stated in section 9 of this Agreement (International Data Transfers). Personal Data are deleted or anonymized as soon as it no longer serves one of the above mentioned purposes and in any event no later than three (3) years after your interaction with us has ended.
28	0	Go to your Settings > Select General > Select About > Select Advertising > Enable the “Limit Ads Tracking” setting
29	1	Grounds for preservation: E-Commerce Act
30	1	We will store your Personal Data for as long as you use our Services or as necessary to fulfill the purpose(s) for which it was collected, resolve disputes, establish legal defenses, conduct audits, pursue legitimate business purposes, enforce our agreements, and comply with applicable laws.
31	0	This type of service allows User Data to be utilized for advertising communication purposes displayed in the form interstitial and video advertisements on this Application, possibly based on User interests. This does not mean that all Personal Data are used for this purpose. Some of the services listed below may use Cookies to identify Users or they may use the behavioral retargeting technique, i.e. displaying ads tailored to the User’s interests and behavior, including those detected outside this Application. For more information, please check the privacy policies of the relevant services.
32	0	We do not knowingly collect personal information from children under 18 years old (or the minimum age required for the creation of a GOGO LIVE Account absent parental consent in your country), unless permitted to do so by applicable law. Children under 18 years old are not permitted to use our Services. If we become aware that we have unknowingly collected personal information from a child, we will make commercially reasonable efforts to delete such information in our database. If you are a parent or guardian of a child, and you believe your child has provided us with their Personal Information on our Services, please contact us immediately at support@GOGO LIVE.com.
33	0	We encourage law enforcement agencies to contact us via email (legal@bigo.tv) regarding the availability of user information before serving the formal request.
34	1	Records relating to processing of consumer complaints and dispute resolution
35	0	Please contact Customer Support for further inquiries.
36	1	Unless stated otherwise in this Privacy Policy, the personal data that you provide us will only be stored for as long as it is necessary for us to fulfill our obligations in respect of the provision of the Services.
37	0	Last revised: January 12th 2016
38	1	Information requested by an investigative agency pursuant to a search and seizure warrant
39	0	We may send you notifications through our mobile application. You may at any time change the settings on your mobile device. We may also collect geolocation information if you use our mobile applications. To stop this, you may change the settings on your mobile device.
40	0	We may update this Policy to reflect changes to our data and information privacy practices. If we make any material changes we will notify you by email (sent to the e-mail address specified in your account) or by means of a notice on this Site prior to the change becoming effective. We encourage you to periodically review this page for the latest information on our privacy practices.
41	0	Our Service may contain links to and from other websites and services. We are not responsible for the privacy practices or the content of any third party sites. Please check the individual privacy policy of any such websites or services before you submit any personal information to them.
42	1	Uber requires user profile information in order to provide its services, and retains such information for as long you maintain your Uber account.
43	0	Software and services over the Internet work. We may store and process your information around the world. According to legal requirements, if you are located in the EEA, you hereby expressly agree to transfer your data after you use this software and / or services outside the EEA place. You can withdraw your consent at any time.
44	1	Records relating to payment settlement and supply of goods
45	1	We retain your information for as long as your account is active or as needed to provide you Services.  We will also retain and use your information as necessary to comply with our legal obligations, resolve disputes, and enforce our agreements.
46	1	If you do not use your account for 24 months, your profile and any data will be deleted. When you request the removal of your profile via an application or website, it immediately becomes unavailable and completely deleted within 30 days.
47	1	Records relating to contracts, cancellation of service, etc.
48	0	TAXI GAMES FREE reserves the right to update this policy at any time, so please re-visit this page frequently. In case of any material change, we will make reasonable efforts to post a clear notice on the service.
49	1	However, some data may still be stored for a certain time period if information is necessary to comply with legal obligation (taxation, accounting, audit) or in order to maintain safety and data backup settings, prevent fraud or other malicious acts.
50	1	In principle, if the Company collects a Member’s personal data, the personal data is retained from the time of sign up until the cancellation of the Member’s account (including cancellation requested by the Member and cancellation by the Company itself based on its direct authority). When a member terminates his/her account, the Company shall destroy the Member’s personal data so it cannot be viewed or used; provided, however, in circumstances where the personal data is required to achieve the Company’s purposes of collection/use and/or where retaining the personal data is required or permitted by law, the Company may retain the Member’s personal data even after his/her account is terminated. For example, under the relevant Korean laws such as the Commercial Act, Act on Consumer Protection in Electronic Commerce (“E-Commerce Act”), Electronic Financial Transactions Act, Specialized Credit Finance Business Act, Framework Act on National Taxes, Corporate Tax Act, and the Value-Added Tax Act, and the Service’s internal regulations, information that can be used to identify a transacting party (e.g., name, address) and information that can be used to verify the rights and obligations of the transacting party with respect to the transaction may be retained by the Company even if the Member withdraws his/her consent to the use of the Service. Transaction records shall be retained as follows.
51	0	No personal information should be submitted to NOVA GEIMS, OOO by users under the minimum legal age required in their country of residence.
52	0	If we collect and use your personal information in reliance on our legitimate interests (or those of any third party), this interest will normally be to operate our Platform and services, manage our relationship with you and communicate with you as necessary to provide our services to you and for our legitimate commercial interest, for instance, when responding to your queries, improving our Platform and our services, undertaking marketing, or for the purposes of ensuring the security of our Platform and services and detecting or preventing illegal activities such as fraud. We may have other legitimate interests and if appropriate we will make clear to you at the relevant time what those legitimate interests are.
53	0	From time to time, we collect information about our users and prospective users during trade shows, industry events and other functions. The information we may collect at these events includes, but not limits to, user name, address, phone number, fax number and email address.
54	0	Information you provide us
55	0	User Profiles and Submissions: Certain user profile information, including your name, location, and any video or image content that such user has uploaded to the Services, may be displayed to other users to facilitate user interaction within the Services or address your request for our services. Your account privacy settings may allow you to limit the other users who can see the Personal Data in your user profile and/or what information in your user profile is visible to others. Please remember that any content you upload to your public user profile, along with any Personal Data or content that you voluntarily disclose online in a manner other users can view (on discussion boards, in messages and chat areas, etc.) becomes publicly available, and can be collected and used by anyone. Your user name may also be displayed to other users if and when you send messages or comments or upload images or videos through the Services and other users can contact you through messages and comments.
56	0	This Privacy Policy applies only to the Services on which this Privacy Policy is made available by Ubisoft and not to websites, networks or platforms maintained by other companies or organizations to which we may provide links. Please note, however, that when you link to foreign sites or any other third party sites from our Services, this Privacy Policy no longer applies. Ubisoft does not control the activities on those third party services and cannot and does not guarantee the security of any personal information disclosed on those third party services.
57	0	We use cookies to store visitors preferences, customize Web page content based on visitors browser type or other information that the visitor sends. Cookies are required to use Todoist.
58	1	How long we keep your User Content
59	1	We take measures to delete your Personal Information or keep it in a form that does not allow you to be identified when this information is no longer necessary for the purposes for which we process it, unless we are required by law to keep this information for a longer period. When determining the retention period, we take into account various criteria, such as the type of products and services requested by or provided to you, the nature and length of our relationship with you, possible re-enrollment with our products or services, the impact on the services we provide to you if we delete some information from or about you, mandatory retention periods provided by law and the statute of limitations.
60	0	"If you are a resident of the EEA, you also have the following data protection rights, which you can exercise at any time by contacting us using the contact details provided under section H. ""HOW TO CONTACT US""   below:The right to access, correct, update or request deletion of your personal information. "
61	0	"Bgcupid respect the privacy of users and to develop privacy policies to protect your privacy. Privacy policy include: user case Bgcupid, we collect information, how to use this information and share this information with anyone. When you use our web site or service, or business transaction with us, we recommend that you carefully read the ""Privacy Policy."" By using our website, indicates that you have accepted the provisions of the confidentiality agreement. Bgcupid online privacy very seriously. If you have any questions about this privacy policy, please contact us."
62	0	If you have questions about or need further information concerning the legal basis on which we collect and use your personal information, please contact us in-game or at:Cookies and similar tracking technology
63	0	"We also may share your information as well as information from tools like cookies, log files, and device identifiers and location data, with third-party organizations that help us provide the Service to you (""Service Providers""). Our Service Providers will be given access to your information as is reasonably necessary to provide the Service under reasonable confidentiality terms."
64	0	Please read the Terms of Service located at http://gogolive.com/terms-of-service/ before using our Services. By accepting the Terms of Services, you warrant and represent that you have read, understood and agreed to our privacy practices described in this Policy and our Terms of Service. Where we require your consent to process your personal information, we will ask for your consent to the collection, use, and disclosure of your personal information as described further below. If you disagree with anything in this Policy, you should immediately discontinue access or use of our Services.
65	0	"The fact that the Service links to a website or presents a banner ad or other type of advertisement does not mean that ""Mobirix"" endorses or authorizes that third party, nor is it a representation of our affiliation with that third party."
66	1	We will try to limit the storage of your personal information to the time necessary to serve the purpose(s) for which your personal information was processed, to enforce our agreement, policies or terms, to resolve disputes, or as otherwise required or permitted by law. Please contact us if you have any questions about our retention periods. While retention requirements can vary by country, we generally apply the retention periods noted below.
67	0	Enable or administer our business, such as for quality control, consolidated reporting, and customer service
68	1	When required by law, we will retain your information for as long as we are legally obligated to do so. If you request us to delete your data, we will delete your data as described above in “Your Rights” Section.
69	1	- Once the 3-months period as explained above is over, the emails will be destroyed immediately.
70	1	Duration of retention: five years
71	0	We would like to inform you that BOOMHITS is a regulated entity to which an obligation can be imposed to disclose your personal data, on the basis of a request by the authorized state authorities or in connection with other legal entities.
72	1	At the time when we no longer need your personal data to provide you with the Services, we will remove them or they will be made anonymous.
73	1	We store data for as long as it is necessary to provide our Games and products to you and others, including those described above. Information associated with your account will be kept until your account is deleted, unless we no longer need the data to provide products and services.
74	0	The Services are not directed to children under 13 years of age, and imo does not knowingly collect Personally Identifiable Information from children under 13 years of age. If you learn that your child has provided us with personal information without your consent, you may delete your child’s entire account, by selecting the “Delete imo account” option in your child’s imo app settings or alert us at privacy@imo.im. If we learn that we have collected any personal information from children under 13 (and in certain jurisdictions under the age of 16), we will promptly take steps to delete such information and terminate the child’s account.
75	0	s “Legitimate interest”, BOOMHITS treats the legitimate and rational purpose of data processing, in particular, protection of the security of processed data, marketing of BOOMHITS’ Services, but most importantly, to ensure that marketing activities addressed to you are appropriate, and to conduct analyzes that will help us to combat any illicit practices.
76	0	To identify your age for data protection purposes, for example to determine the legal requirements for processing of Personal Data. We requests that anyone under the age of 18 not send any Personal Data about themselves over the Internet unless sent under the supervision of their parent or guardian. We do not knowingly collect Personal Data from children under 13 years old in the Game. We believe it is important to safeguard the privacy of children and encourage parents to regularly monitor their children’s use of online activities. If you are a parent and believe that your child under the age of 13 has accessed and/or played the Game and provided personally identifiable information to us, please contact us at privacy@leveleight.se or the mailing address at the end of this Privacy Policy and we will work to delete that account and any such personally identifiable information. This in compliance with Article 6(1)(c) of the GDPR.
77	1	We will securely erase your information in advance of these deadlines if we decide that we no longer need it
78	0	We generally do not offer children who identify themselves as being under 13 the chat functionality or services that enable them to publicly disclose personal information (such as online forum, messenger, or e-mail)(collectively, “Communication Services”).  However, if we offer such Communication Services as part of our Game or Services to children, we will restrict the child from accessing them until we receive a verifiable consent from the child’s parent.
79	0	We may also use this data in order to investigate any complaints on your behalf and to provide you with a more efficient service.
80	0	Information We Collect Automatically; Cookies and Other Tracking Technologies
