	sentiment	review
162	0	If you would like to object to Facebook using your data for marketing purposes, please use the Facebook opt-out settings provided in your user profile: https://www.facebook.com/settings?tab=ads or opt -www.regardingads.info/choices web Http://www.youronlinechoices.com for users or EU users. Your choices shall be taken into account when using desktops or mobile devices, regardless of platform or device.
163	1	7.2. You may request to remove your account and data on our Services by contacting the Service support (see Section 10 for details).
164	1	Duration of retention: five years
165	1	Your Personal Data collected through our Services will be deleted when they no longer serve one of the above-mentioned purposes but in any event your Personal Data will be deleted after 14 months of inactivity in your use of our Services. Once we have deleted your Personal Data, you will not be able to exercise the right to access, the right to erasure, the right to rectification or the right to data portability.
166	1	As stated above, we do not retain your IP address beyond your VPN session and do not log your online activities.
167	1	We will keep your information for as long as you are a player or customer of DoubleUGames. We may keep your information for longer for research or statistical purposes. If we do, we will make sure your information is anonymized and non-traceable to you as a person. We will also keep it for longer if we cannot delete it for legal or regulatory reasons.
168	0	Personal information is information that identifies you and that may be used to contact you online or offline. We collect personal information from you on a voluntary basis as described below. Our primary goals in collecting and using information is to create your account, provide Services to you, improve our Services, contact you, conduct research and create reports for internal use and for use with our partners.
169	1	We will retain your Personal Data only for as long as is necessary for the purposes set out in this Privacy Policy. We will retain and use your Personal Data to the extent necessary to comply with our legal obligations (for example, if we are required to retain your data to comply with applicable laws), resolve disputes, and enforce our legal agreements and policies.
170	1	When we have no ongoing legitimate business need to process your personal information, we will either delete or anonymize it or, if this is not possible (for example, because your personal information has been stored in backup archives), then we will securely store your personal information and isolate it from any further processing until deletion is possible. 
171	0	Our Data Protection Officer (DPO) e-mail is: dpo@nekki.com. You may contact Our DPO in order to enforce Your rights provided in Section 4 Privacy Policy or receive additional information concerning processing of Your personal data. Our DPO performs its functions on behalf of the whole Nekki Limited
172	1	Following such request, Uber deletes the information that it is not required to retain. In certain circumstances, Uber may be unable to delete your account, such as if there is an outstanding credit on your account or an unresolved claim or dispute. Upon resolution of the issue preventing deletion, Uber will delete your account as described above.
173	0	Cookies will expire once the user closes the browser or logs out of the browser.
174	1	● Web Behavior Data. We retain any information collected via cookies, clear gifts, flash cookies, web page counters and other technical or analytic tools in our system for a certain date and time from expiry of the cookie or the date of collection.
175	1	How Long Do We Retain Your Personal Data?  We retain Personal Data about you as long as you have an open account with us and for 3 months after you close your account.  In some cases, we retain Personal Data for longer, if doing so is necessary to comply with our legal obligations, resolve disputes or collect fees owed, or is otherwise permitted or required by applicable law, rule or regulation. Afterwards, we retain some information in a depersonalized or aggregated form but not in a way that would identify you personally.
176	1	Finally—and this is important—you should understand that users who see the content you provide can always save it using any number of techniques: screenshots, in-app functionality, or any other image-capture technology. It’s also possible, as with any digital information, that someone might be able to access messages forensically or find them in a device’s temporary storage. If any deletion of user information of our App happens, we cannot promise that deletion will occur within a specific timeframe. And we may also retain certain information in backup for a limited period of time or as required by law.
177	0	We process personal information inside and outside of the United States. Uber transfers information of users' outside the United States on the basis of mechanisms approved under applicable laws.
178	1	We generally retain your personal information for as long as is necessary for the performance of the contract between you and us and to comply with our legal obligations. If you no longer want us to use your information that we physically access and store, you can request that we erase your personal information and close your account.
179	1	The Data is kept for the time necessary to provide the service requested by the User, or stated by the purposes outlined in this document, and the User can always request that the Data Controller suspend or remove the data.
180	1	We will store your personal data for as long as it is reasonably necessary for achieving the purposes set forth in this Privacy Policy (including providing the Service to you), which includes (but is not limited to) the period during which you have an account with the App. We will also retain and use your personal data as necessary to comply with our legal obligations, resolve disputes, and enforce our agreements.
181	1	We retain your Personal Data as long as needed to provide services or products to you, or as required or permitted by applicable laws, such as tax and accounting laws.
182	0	Any questions related to this Policy can be mailed to support@overmobile.ru
183	0	Wherever your personal information is transferred, stored or processed by us, we will take reasonable steps to safeguard the privacy of your personal information.
184	1	7.1. We will retain your personal information for as long as required to perform the purposes for which the data was collected depending on the legal basis for which that data was obtained and/or whether additional legal/regulatory obligations mandate that we retain your personal information during the term that is required and/or permissible under applicable/relevant law.
185	0	You may have the right to request that we correct information that we have inaccurately stored. You may also have the right to have incomplete personal data completed, including by means of providing a supplementary statement.
186	0	MoPub (Twitter inc.) https://www.mopub.com/legal/privacy/
187	1	We retain the information we collect as described in this Privacy Policy for as necessary for the provision of the Services, internal analytical purposes, or to comply with its legal obligations, resolve disputes and enforce agreements (e.g. settlement). The criteria used to determine the retention periods include: (i) how long the personal data is needed to provide the Services and operate the business; (ii) the type of personal data collected; and (iii) whether we are subject to a legal, contractual or similar obligation to retain the data (e.g., mandatory data retention laws, government orders to preserve data relevant to an investigation, or data that must be retained for the purposes of litigation or disputes). We will only keep your personal information for three (3) years.
188	0	AppGenre built the FanGenre - Get Followers for Instagram app as a Free app. This SERVICE is provided by AppGenre at no cost and is intended for use as is.
189	1	We retain your Personal Data as long as we have an ongoing legitimate business need to do so for example to provide services or products to you, or as required or permitted by applicable laws, such as tax and accounting laws.
190	1	Data Retention
191	1	Uber may also retain certain information if necessary for its legitimate business interests, such as fraud prevention and enhancing users' safety and security. For example, if Uber shuts down a user's account because of unsafe behavior or security incidents, Uber may retain certain information about that account to prevent that user from opening a new Uber account in the future.
192	0	You have an option to opt out from sharing your information and data for the purposes of interest-based advertising at all times. When you opt out, you will not stop receiving ads, they just won't be based on topics you like, your interest, behavior, demographics, etc. You can opt out by choosing one of the following options (for more information please read the ''Opt Out'' Section of our Privacy Policy):
193	0	NHN does not sell or rent your Personal Information to third-parties for marketing purposes without your consent. However, you hereby agree that NHN may, without seeking further your consent, share your Personal Information with affiliate companies of NHN to provide you Services or information about Services or other promotional materials. In addition, NHN may share Personal Information with business partners that assist NHN in providing you Services. NHN is committed to giving you a choice when your Personal Information may be used or disclosed for marketing purposes.
194	0	We'll notify you before we make changes to this policy and give you the opportunity to review the revised policy before you choose to continue using our Products.
195	1	We will store your personal data for as long as it is reasonably necessary for achieving the purposes set forth in this Privacy Policy (including providing the Service to you), which includes (but is not limited to) the period during which you have an account with the App. We will also retain and use your personal data as necessary to comply with our legal obligations, resolve disputes, and enforce our agreements.
196	0	To run our service weﾡﾯll have to use computers all over the world. This means your information might be transferred to the US, Australia, Europe and anywhere else the service is operated.
197	0	We process your personal data under the following legal bases:your consent;to perform our contract with you;
198	0	We will share personal information with companies, organizations or individuals outside of Merger Gamewhen we have your consent to do so. We require opt-in consent for the sharing of any sensitive personal information.
199	0	"Cookies. Ubisoft uses cookies on the Services. A ""cookie"" is a small bit of record-keeping information that web sites often store on a user's computer. Cookies do not include people's names, e-mail addresses, or other information that is personally identifiable; they are typically used to quickly identify a user's computer and to ""remember"" things about the user's visit. Ubisoft may set cookies for your web browser as you visit our websites, use our products or visit a website where Ubisoft provides ads, content or analytics. For example, Ubisoft uses cookies to keep track of selected items in your shopping cart on our online store and to remember your Account identifier. You can disable cookies or set your browser to alert you when cookies are being sent to your computer, although this may affect your ability to shop online or to access certain features of our Services. Each browser is different, so check the ""Help"" menu of your browser to learn how to change your cookie preferences. In addition to Ubisoft using cookies on our network of websites, Ubisoft may allow certain partners to set and access their cookies on your computer. These companies use of cookies is subject to their own privacy policies, not the Ubisoft Privacy Policy. Please review them carefully. For more information about cookies, please see http://www.allaboutcookies.org. You can see the list of companies that may implement and/or access cookies on your computer, mobile or device, and how to opt-out to such cookies at https://legal.ubi.com/cookies/"
200	1	We will hold your personal information on our systems for as long as is necessary for the relevant service, or as otherwise described in this Privacy Policy.
201	1	What about the storage of payment details? The processing and storage of payment details is a matter for the relevant platform and the applicable payment method/processor. Nordeus will not receive, process or store any of your payment details. This is because the payment transactions themselves are completed through the relevant platforms (e.g. Apple’s App Store or Google Play) via the user account you have associated with that platform account. If you make in-game purchases within the Nordeus Services, we are notified by the payment processor once a transaction takes place, but we will not receive any of your actual payment details.
202	0	We do not use the Application to knowingly solicit data from or market to children under the age of 13. If a parent or guardian becomes aware that his or her child has provided us with information without their consent, he or she should contact us at support@gamebeartech.com. We will delete such information from our files within a reasonable time.
203	0	When you use our Apps we may display contextual advertisements to you. In order to enable advertising we allow our advertising partners to collect online identifiers (such as Advertising ID on Android and IDFA on iOS) that might be considered as personal information under some legislations, but they should use it solely for the purposes of contextual advertising. For any other purposes they should use the information solely on anonymized and aggregated basis.
204	1	Uber retains user profile and other information for as long as you maintain your Uber account.
205	0	We will try to respond to any request in a timely manner. Please note that we are within our rights to decline your request if this is clearly intended to cause AVCR or our affiliated organisations harm or prejudice, e.g. by sending frequent (unfounded) requests in a short period of time. We also reserve the right to review your request for erasure against statutory or regulatory obligations that conflict with such erasure.
206	0	If any new purposes for processing your information arise we will let you know we start to process information on that other purpose by introducing the corresponding changes to this Privacy policy.
207	0	“EEA” includes all current member states to the European Union and the European Economic Area.
208	1	- For the prevention of fraudulent activities, emails of the deleted accounts will be encrypted with one-way password that renders decryption impossible and will be kept for 3 months, during which sign-ups are restricted.
209	1	Retention of your Personal Data. In addition to the retention periods mentioned in Section 1 above, in some circumstances we may store your Personal Data for longer periods of time, for example (i) where we are required to do so in accordance with legal, regulatory, tax or accounting requirements, or (ii) for us to have an accurate record of your dealings with us in the event of any complaints or challenges, or (iii) if we reasonably believe there is a prospect of litigation relating to your Personal Data or dealings.
210	0	This Privacy Policy covers the free and paid versions of Touch VPN, including the mobile and desktop applications, as well as the Touch VPN websites. (collectively, the “Services”). The terms “AnchorFree,” “we,” “us,” and “our” include AnchorFree, Inc. and AnchorFree GmbH, and our affiliates and subsidiaries. By using the Services, you agree to the terms and conditions of this Privacy Policy. Beyond the Privacy Policy, your use of the Services is also subject to our Terms of Service.
211	1	We will retain Your information for the duration of Your membership of the Games and/or whilst you continue to have access to the Games and for a reasonable period thereafter or as long as the law requires or permits. Your personal information will be deleted when You explicitly gives up the Games usage namely request your account deletion or request Us to delete Your personal data. If you send us such requests, We will delete your personal data as soon as technically possible. The period process of erasing personal data can take up to one month. Considering the complexity and number of requests, this period may be extended by a further two months.
212	1	We only keep your information for as long as is reasonably necessary for the purposes set out in this Privacy Policy and to fulfill our legal obligations.
213	0	Right to erasure / right to be forgotten
214	1	We will retain your information for as long as your account is active or as needed to provide you services. If you wish to cancel your account or request that we no longer use your information to provide you services, you may delete your account. We may retain and use your information as necessary to comply with our legal obligations, resolve disputes, and enforce our agreements. Consistent with these requirements, we will try to delete your information quickly upon request. Please note, however, that there might be latency in deleting information from our servers and backed-up versions might exist after deletion. In addition, we do not delete from our servers files that you have in common with other users.
215	1	We retain your personal information for as long as necessary to provide the Services you have requested, or for other essential purposes such as complying with our legal obligations, resolving disputes, and enforcing our terms of use, end user license agreements, and other contracts in place with third parties, including but not limited to our third party service providers and independent data controllers. Upon your request to remove your data, we will do our best to remove such data immediately, and in no event will we retain any data requested for removal more than thirty (30) business days after the date of the request.
216	0	To learn even more about how to affect advertising choices on various devices, please look at the information available here.
217	0	This Application collects some Personal Data from its Users.
218	1	We will retain your information for the period necessary for us to provide you with our Services. Accordingly, your information will be retained up to 3 years following the last game session in any of our games. Where it is no longer necessary for us to process your information, we will delete it. Please note, however, that we may be subject to legal and regulatory requirements to keep personal data for a longer period, in particular pursuant to any applicable statutory limitation period.
219	1	Your personal data are processed for as long as necessary for the processing purposes mentioned above. AVCR will de-identify your personal data when these are no longer necessary for the said purposes, unless:a legitimate intrest of AVCR or a third party to archive your personal data in an identifiable form prevails over your intrest to de-identify;a legal measure, mandatory public authority measure or court order prevents such de-identification.
220	0	Last updated: April 18, 2019
221	1	Grounds for retention: E-Commerce Act
222	1	Grounds for retention: E-Commerce Act
223	1	5.4 By submitting your personal information to us, you agree that we may retain your information for as long as is necessary (up to 5 years) to fulfill any of the services we provide or to comply with applicable legislation, regulatory requests and relevant orders from competent courts.
224	0	Our legitimate interests for this purpose are enforcing our legal rights, preventing and addressing fraud and unauthorised use of the Service, non-compliance with our Terms and Conditions of Use.
225	0	The APP and Services work over the Internet. We may store and process your information in various locations throughout the world. Where you located in the EEA, as required by law, you hereby provide us with your express consent to transfer your data to where may be outside of EEA once you use the Software and/or Services. You may withdraw your consent at any time.
226	0	Cookies will expire once the user closes the browser or logs out of the browser.
227	0	The protection of user privacy is a fundamental policy of the Jasmin Chat. The Jasmin Chat guarantees that it will not publicly disclose or provide a third party with an individual user's registered information or non-public content, which is stored in the Jasmin Chat during the use of web Services, unless in the following circumstances as follows:a) When prior express authorization is obtained from;b) When and as required by applicable laws and regulations;c) When and as required by relevant competent authorities of the government;d) When it is necessary to safeguard the public interest;e) When it is necessary to safeguard the legal rights and interests of the Jasmin Chat.
228	0	"This is the Privacy Policy of MOVEFAST COMPANY (""Company"") and its live streaming broadcast service HAKUNA (""Service"") and is incorporated into and is subject to our TERMS OF SERVICE which can be found at https://hakuna.live/terms-of-service. Please read on to learn more about our data handling practices. Your use of the Service signifies that you agree with the terms of this Privacy Policy. If you do not agree with the terms of this Privacy Policy, you may not use the Service and must immediately terminate your use of the Service."
229	1	As stated above, we do not retain your IP address beyond your VPN session and do not log your online activities.
230	1	NOVA GEIMS, OOO retains, uses and stores your information as long as you are playing our games or using our Services, and also for the period necessary to fulfil all the purposes described in this Privacy Policy, in compliance with the applicable laws of your country of residence. We want to inform you that a longer retention period could be required to resolve disputes, or answer regulatory or police requests. In such cases, the collected information will be used and stored until the request is closed.
231	0	Magic Seven may store and/or transfer your personal data to its affiliates and partners in and outside of EU/EEA member states and the United States in accordance with mandatory legislation and this Privacy Policy. Magic Seven may disclose your personal data to third parties in connection with a corporate merger, consolidation, restructuring, the sale of substantially all of Magic Seven’s stock and/or assets or other corporate change, including, without limitation, during the course of any due diligence process provided, however, that this Privacy Policy shall continue to govern such personal data.
232	0	By using our application, you consent to our privacy policy.
233	1	7.1. We will retain your personal information for as long as required to perform the purposes for which the data was collected depending on the legal basis for which that data was obtained and/or whether additional legal/regulatory obligations mandate that we retain your personal information during the term that is required and/or permissible under applicable/relevant law.
234	0	Cookies and similar technologies
235	0	Under EU law you have the right to lodge a complaint regarding the processing of your personal data by Medium with the dedicated Supervisory Authority of your EU member state.
236	1	In principle, if the Company collects a Member’s personal data, the personal data is retained from the time of sign up until the cancellation of the Member’s account (including cancellation requested by the Member and cancellation by the Company itself based on its direct authority). When a member terminates his/her account, the Company shall destroy the Member’s personal data so it cannot be viewed or used; provided, however, in circumstances where the personal data is required to achieve the Company’s purposes of collection/use and/or where retaining the personal data is required or permitted by law, the Company may retain the Member’s personal data even after his/her account is terminated. For example, under the relevant Korean laws such as the Commercial Act, Act on Consumer Protection in Electronic Commerce (“E-Commerce Act”), Electronic Financial Transactions Act, Specialized Credit Finance Business Act, Framework Act on National Taxes, Corporate Tax Act, and the Value-Added Tax Act, and the Service’s internal regulations, information that can be used to identify a transacting party (e.g., name, address) and information that can be used to verify the rights and obligations of the transacting party with respect to the transaction may be retained by the Company even if the Member withdraws his/her consent to the use of the Service. Transaction records shall be retained as follows.
237	1	Duration of retention: three years
238	0	Units A&B, 15/F, Neich Tower, 128 Gloucester Road, Wanchai, Hong Kong.
239	1	① If stored in the form of electronic files, the personal data will be destroyed by technical means so that the records cannot be reproduced.
240	1	SayGames will store your personal data for as long as necessary in order to provide you with the App or otherwise fulfil the purposes as described above, unless further storage is required in order to establish, exercise or defend a legal claim or to comply with applicable law, including accounting rules.
241	0	You have the right to object to profiling;
