	sentiment	review
242	1	Your Personal Data collected through our Get in Touch forms will be deleted after 2 years from the date of receipt. Once we have deleted your Personal Data, you will not be able to exercise the right to access, the right to erasure, the right to rectification or the right to data portability.
243	0	We may transfer information that we collect about you to affiliated entities, or to other third parties across borders and from your country or jurisdiction to other countries or jurisdictions around the world. Please note that these countries and jurisdictions may not have the same data protection laws as your own jurisdiction, and you consent to the transfer of information to the U.S. and the use and disclosure of information about you, including personal information, as described in this Policy.
244	1	We will store your personal data for as long as it is reasonably necessary for achieving the purposes set forth in this Privacy Policy (including providing the Service to you), which includes (but is not limited to) the period during which you have an account with the App. We will also retain and use your personal data as necessary to comply with our legal obligations, resolve disputes, and enforce our agreements.
245	1	When we have no ongoing legitimate business need to process your personal information, we will either delete or anonymize it or, if this is not possible (for example, because your personal information has been stored in backup archives), then we will securely store your personal information and isolate it from any further processing until deletion is possible.
246	1	How long do we retain your data for? As long as necessary for the purpose for which the data was originally collected. As detailed below, depending on where you live you may have certain legal rights to object to our collection and use of your data, but this may mean some or all Nordeus Services become unavailable to you. We also reserve the right to retain your information as necessary to comply with our legal obligations, resolve disputes, maintain appropriate business records, and enforce our agreements.
247	0	The security of your personal information is extremely important. We take the following precautions to make sure it cannot be accessed or altered:1、Data encrypted in transit2、Data encrypted in storage3、Industry standard Internal security protocolsControl
248	1	We retain your Personal Data as long as we have an ongoing legitimate business need to do so for example to provide services or products to you, or as required or permitted by applicable laws, such as tax and accounting laws. When we have no ongoing legitimate business need to process your Personal Data, we will either delete or anonymise it or, if this is not possible (for example, because your Personal Data has been stored in backup archives), then we will securely store your Personal Data and isolate it from any further processing until deletion is possible.
249	0	If you do not submit personal information when asked by Ubisoft, your refusal may limit our ability to process your online product registration, Account creation, contest registration, purchase via our online store, or request for technical support.
250	1	We retain your information for as long as needed to provide the Nordeus Services to you or longer where permitted by law. 
251	1	Uber retains transaction, location, usage and other information for 7 years in connection with regulatory, tax, insurance or other requirements in the places in which it operates. Uber thereafter deletes or anonymizes such information in accordance with applicable laws.
252	1	Storing might be different depending on the territory of collecting the information and the applicable legislation, but we always strive to store the information only as long as it is needed for the purposes of providing, improving or personalizing our services.
253	1	We will retain User Provided data for as long as you use the Application and for a reasonable time thereafter. We will retain Automatically Collected information for up to 24 months and thereafter may store it in aggregate. If you’d like us to delete User Provided Data that you have provided via the Application, please contact us at privacy@applicationsite.com and we will respond in a reasonable time. Please note that some or all of the User Provided Data may be required in order for the Application to function properly.
254	0	We promote our Apps and services in ours and other publisher’s apps and we also allow our partners to promote and advertise their goods and services in our Apps. We may share information we collect from you to our advertising partners and they can reuse such data for targeted advertising. We or our advertising partners may display interest-based, or retargeted, ads (''IBA''), but only for the device IDs that have passed the age gate and have not opted out of IBA. By using our Apps and not choosing one of the opt-out options, you give us consent to transfer your data as stated below.
255	0	We can change this Privacy Policy, but if we do we will put the changed version online and normally it will take effect 30 days afterwards. Please feel free to contact us if you have any questions with regards to the changes.
256	1	● Marketing. We store information used for marketing purposes indefinitely until you unsubscribe. Once you unsubscribe from marketing communications, we add your contact information to our suppression list to ensure we respect your unsubscribe request.
257	0	The public at your request. If you interact with our site or app on social media, for example by tagging your videos #Filmigo on Instagram, that piece of User Content will be linked to Filmigo on our website or social media profiles and Filmigo may display your User Content publicly;
258	1	When we have no ongoing legitimate business need to process your personal information, we will either delete or de-identify it, or, if this is not possible, for example, because your personal information has been stored on a backup server, then we will securely store your personal information and isolate it from any further processing until deletion is possible.
259	1	Grounds for retention: Protection of Communication Secrets Act
260	0	"We use third-party advertising companies to serve ads when you visit the Websites and/or use the Mobile Apps. These companies may use information about your visits to any of the Websites and other websites and the Mobile App(s) and other mobile applications in order to provide advertisements about goods and services of interest to you. You have the ability to opt out of the use of your information for purposes of online third-party advertising. If you would like more information about your choices, visit optout.aboutads.info. You may have the ability to manage tracking and ad preferences on your mobile device from your devices settings. We do not respond to Web browser ""do not track"" signals or other similar mechanisms."
261	0	To customize your experience
262	0	9.1. We take  technical, organizational and legal measures, including, where suitable, encryption, to ensure that your personal data are protected from unauthorized or accidental access, deletion, modification, blocking, copying and dissemination.
263	1	Duration of retention: six months
264	1	In principle, once the personal data’s purpose of collection/use is achieved, the Company destroys the subject personal data without delay in accordance with the respective retention/use period. The procedure, method, and time for destroying personal data are as follows:(1) Procedures for destroying personal data
265	0	Any questions or complaints or comments about this Privacy Policy or our use of your personal information, please contact our Privacy Policy Administrator by:email at emea-email-support@ubisoft.com or,
266	1	Anonymous information about activity on Topface persists longer for statistical data and marketing research, but it does not correlate with you after deleting the profile, that is, becomes anonymous. This is because Topface seeks to develop its services and opportunities for more convenient communication and this period is justified by our legitimate interest.
267	0	Collection of non-personal information
268	1	We retain the information we collect as described in this Privacy Policy for as necessary for the provision of the Services, internal analytical purposes, or to comply with its legal obligations, resolve disputes and enforce agreements (e.g. settlement). The criteria used to determine the retention periods include: (1) how long the personal data is needed to provide the Services and operate the business; (2) the type of personal data collected; and (3) whether we are subject to a legal, contractual or similar obligation to retain the data (e.g., mandatory data retention laws, government orders to preserve data relevant to an investigation, or data that must be retained for the purposes of litigation or disputes). We will only keep your personal information for three (3) years.
269	0	We may receive information about you from third parties. For example, if you access our websites or Service through a third-party connection or log-in, for example, through Facebook Connect, by ﾡﾰfollowing,ﾡﾱ ﾡﾰliking,ﾡﾱ adding the Canva application, linking your account to the Canva Service, etc., that third party may pass certain information about your use of its service to Canva. This information could include, but is not limited to, the user ID associated with your account (for example, your Facebook UID), an access token necessary to access that service, any information that you have permitted the third party to share with us, and any information you have made public in connection with that service. You should always review, and if necessary, adjust your privacy settings on third-party websites and services before linking or connecting them to the Canva Service. You may also unlink your third party account from the Service by adjusting your settings on the third party service. If you unlink your third party account, we will no longer receive information collected about you in connection with that service.
270	0	We implement a variety of security measures when a user places an order to maintain the safety of your personal information.
271	1	However, some information may still be stored for a certain time period if information is necessary to comply with legal obligation (taxation, accounting, audit) or in order to maintain safety and data backup settings, prevent fraud or other malicious acts.
272	0	We use cookies, which deposit small data files stored on your computer or mobile device, and other similar technologies like software development kits (“SDKs“) or third party libraries. We use cookies to distinguish you, identify your interests and your account and its status and settings, to collect usage data, keep track of your preferences and deliver content specific to your interests. For example, we use cookies to remember your volume settings, language settings, search history, account type and the last time you checked or updated your feed. Our advertising partners may use cookies and similar technologies to identify and deliver content and advertising specific to your interests, to track the effectiveness of such advertising and to provide and analyse their services. You can configure your browser to reject cookies. By using our Services you consent to our, and our advertising partners’, use of cookies and related technologies, and the sharing of data with our advertising partners. You can withdraw your consent to our use of cookies using your browser settings or your device’s limit ad tracking settings. You may also be able to control the use of cookies via industry websites such as http://www.aboutads.info/choices and http://www.youronlinechoices.eu/ or through other functionality which we may have available from time to time.
273	1	Information we collect may be stored or processed on computers located in any country where we do business.
274	1	We retain your information in our server logs, our databases and our records only for as long as necessary in light of the purposes set out in this Policy, subject to any legal obligations to further retain such information. We may use third party service providers to store and maintain such data. We retain your verification-related information for a reasonable period of time, even if you do not complete all verification steps, to assist with future verifications and to prevent abuse of our verification processes. If you decide not to verify the account and would like us to delete the verification information you provided, contact support via our online support form.
275	1	Your information collected through the Service may be stored and processed in the Turkey or any other country in which Reports+, its Affiliates or Service Providers maintain facilities. Reports+, its Affiliates, or Service Providers may transfer information that we collect about you, including personal information across borders and from your country or jurisdiction to other countries or jurisdictions around the world.
276	0	Unless stated specifically to the contrary on the applicable Ubisoft Service, Ubisoft’s Services are intended for a general audience. Ubisoft encourages parents and guardians to spend time online with their children. We urge parents to instruct their children to never give out their real names, addresses or phone numbers, without permission, when using the Internet. We recognize a special obligation to protect personal information obtained from young children. Therefore, in order for children under 12 years old to register on any Service, we require that the child provides the email address, or other contact information, of a parent or guardian who will be contacted by Ubisoft in order to inform, confirm, modify or refuse his or her child’s registration. Ubisoft reserves the right to request written proof of the parent or guardian’s authorization at any time. Until the parent or guardian answered to Ubisoft’s email pursuant to Ubisoft’s instructions, the child’s use of the Services will be limited.
277	0	Please read this Privacy Policy carefully to understand our policies and practices regarding your Personal Data (as defined below) and how we will treat it.
278	1	The period of data storage Your data will be available to us as long as it is necessary to meet the objectives set out in our Privacy Policy, in particular, for the time of providing you with the Services or providing you with technical assistance. In the case of processing based on your consent, in the event of its withdrawal we will delete the data without undue delay, no longer than 30 days from the receipt of your request.
279	1	② If printed on paper, the personal data will be destroyed by shredding or incinerating the paper documents.
280	1	Data retention periods for other Processors are indicated by the links above.
281	0	Medium also pursues its legitimate interests by collecting minimal data of logged out users to provide the Services, as outlined above, as well as to ensure that new users trying out the free member preview do not exceed their maximum limit of free articles per month before a paid subscription is required to read further. These legitimate interests are not outweighed by (nor do they violate) our users’ privacy interests because we collect minimal user data for these purposes and we are fully transparent about these activities.
282	0	Third-party disclosure
283	0	The security of your Personal Information is important to us, and we strive to implement and maintain reasonable, commercially acceptable security procedures and practices appropriate to the nature of the information we store, in order to protect it from unauthorized access, destruction, use, modification, or disclosure.
284	0	We are committed to protecting the privacy of all people who use our services. Being a New Zealand company, we comply with New Zealand’s Privacy Act 1993 (“Privacy Act”) and follow the privacy principles that are a part of the Privacy Act. Additionally, we seek to comply with acts from the United States of America, which are: COPPA, the United State’s Children’s Online Privacy Protection Act, and CAN-SPAM, which covers the transmission of commercial email messages with the primary purpose of advertising or promoting a product. For Individuals located in the EU, we also seek to follow the EU General Data Protection Regulation (“GDPR”). For purposes of this Privacy Policy Notice and GDPR, PikPok is the data Controller with regard to any data we collect from you, unless otherwise specified.
285	1	In some cases, rather than provide a way to delete data, we store it for a predetermined period of time. For each type of data, we set retention time frames based on the reason for its collection. For example, to ensure that our services display properly on many different types of devices, we may retain browser width and height for up to 12 months.
286	1	- Where the retention is required by applicable law or regulation
287	0	Under this legal basis we:• Provide our Service (in accordance with our Terms and Conditions of Use)• Customize your experience• Manage your account and provide you with customer supportfor our (or others') legitimate interests, unless those interests are overridden by your interests or fundamental rights and freedoms that require protection of personal data;
288	1	Duration of retention: six months
289	1	In exceptional cases, longer storage periods may result from applicable law, e.g. tax regulations or other legal requirements imposed on us, and obligations.
290	0	In addition, we will take reasonable steps to assure that third parties to whom we transfer any data will provide sufficient protection of personal information
