	sentiment	review
78	0	  If you receive an unwanted email from us, you can use the unsubscribe link found at the bottom of the email to opt out of receiving future emails. Note that you will continue to receive transaction-related emails regarding products or Services you have requested. Regardless of your marketing preferences, we may also send you certain non-promotional communications regarding us and our Services(e.g., communications regarding the Services or updates to this Privacy Policy).  We will obtain your consent, where required under applicable law, before sending you our promotional emails.
79	1	The Service is not geared toward children under the age of 13 and we do not knowingly collect personal information from children under the age of 13. If we learn that a child under 13 has provided us with personal information we will delete such information from our files as quickly as possible. 
80	0	Collection of non-personal information
81	0	"This is the Privacy Policy of MOVEFAST COMPANY (""Company"") and its live streaming broadcast service HAKUNA (""Service"") and is incorporated into and is subject to our TERMS OF SERVICE which can be found at https://hakuna.live/terms-of-service. Please read on to learn more about our data handling practices. Your use of the Service signifies that you agree with the terms of this Privacy Policy. If you do not agree with the terms of this Privacy Policy, you may not use the Service and must immediately terminate your use of the Service."
82	1	We consider it the responsibility of parents to monitor their children's use of our products and services. Nevertheless, it is our policy not to require personal data from minors or offer to send any promotional materials to persons in that category. Xiaomi does not seek or intend to seek to receive any personal data from minors. Should a parent or guardian have reasons to believe that a minor has provided Xiaomi with personal data without their prior consent, please contact us to ensure that the personal data is removed and unsubscribe them from any of the applicable Xiaomi services.
83	1	Please note: You can find published age recommendations on: Apple’s App Store on iTunes, Google Play, Amazon App Store and Windows App Store . However, these age or maturity classifications refer only to the content in our games (similar to movie ratings G, PG or PG-13 in the U.S., but related to gameplay, animations, etc.). For more on how these categories are defined, visit these support websites for Apple, Google, Amazon and Windows.
84	1	Bgcupid not knowingly collect or maintain under the age of 18 who personally identifiable information and non-personally identifiable information, any item on this site under the age of 18 who are not facing the open. If you are under 18, please stop using or prohibit access to the Site or the Service. If Bgcupid learned the information collected under 18 years of age who personally identifiable information, this website will take reasonable steps to remove the information.
85	0	"We use third-party advertising companies to serve ads when you visit the Websites and/or use the Mobile Apps. These companies may use information about your visits to any of the Websites and other websites and the Mobile App(s) and other mobile applications in order to provide advertisements about goods and services of interest to you. You have the ability to opt out of the use of your information for purposes of online third-party advertising. If you would like more information about your choices, visit optout.aboutads.info. You may have the ability to manage tracking and ad preferences on your mobile device from your devices settings. We do not respond to Web browser ""do not track"" signals or other similar mechanisms."
86	1	Our Services are not directed to children under 16 and we do not knowingly collect PII from children under 16.If a parent or guardian becomes aware that his or her child has provided us with information without their consent, he or she should promptly contact us and we take reasonable steps to ensure that such information is deleted from our files.
87	1	Parents can review the personal information we have collected from their child and request them to be deleted.  Parents can also revoke their previously provided consent to collection or use of the child’s information.  If you are a parent and wish to review, modify, or delete your child’s personal information, or withdraw consent, you can submit a request to our Privacy Administrator at the address, e-mail address or telephone number provided below.
88	0	In principle, once the personal data’s purpose of collection/use is achieved, the Company destroys the subject personal data without delay in accordance with the respective retention/use period. The procedure, method, and time for destroying personal data are as follows:(1) Procedures for destroying personal data
89	0	- Where the retention is required by applicable law or regulation
90	1	Our “California do not track” notice. We do not track consumers over time and across third-party websites and therefore do not respond to DO Not Track signals. We do not allow third parties to collect personally identifiable information about individuals consumer’s online activities over time and across different websites when a consumer uses the Website.
91	0	Medium also pursues its legitimate interests by collecting minimal data of logged out users to provide the Services, as outlined above, as well as to ensure that new users trying out the free member preview do not exceed their maximum limit of free articles per month before a paid subscription is required to read further. These legitimate interests are not outweighed by (nor do they violate) our users’ privacy interests because we collect minimal user data for these purposes and we are fully transparent about these activities.
92	0	The right to data portability. If you wish to receive your personal data in a machine-readable format, you can do so by requesting a copy of your personal data as described above (or send respective request at support@betterme.tips). The data will be made available to you in the .json file format.
93	0	You may also reach us by the following address:Bigo Technology Pte. Ltd.
94	0	The User is also entitled to:request the access to and rectification or erasure of personal data processed by the YUMOBI TEKHNOLODZHI, OOO;restrict the processing of personal data concerning the User;object to processing of personal data concerning the User;demand for realization of the right to data portability from the YUMOBI TEKHNOLODZHI, OOO; ;exercise the right to lodge a complaint with a relevant supervisory authority.
95	0	The right to withdraw consent.
96	0	GameAnalytics ApS https://gameanalytics.com/privacy
97	0	1.3 Information we obtain from third party sources
98	1	A Note to Users Outside of the Vietnam. If you are a non Vietnam user of the Site or the Services, by visiting the Site, using the Services and providing us with Personal Data, you acknowledge and agree that your Personal Data may be processed for the purposes identified in this privacy policy. In addition, your Personal Data may be processed in the country in which it was collected and in other countries, including the Vietnam, where laws regarding processing of Personal Data may be less stringent than the laws in your country. By providing your data, you consent to such transfer.
99	0	Any questions related to this Policy can be mailed to support@overmobile.ru
100	1	These Services do not address anyone under the age of 13. I do not knowingly collect personally identifiable information from children under 13. In the case I discover that a child under 13 has provided me with personal information, I immediately delete this from our servers. If you are a parent or guardian and you are aware that your child has provided us with personal information, please contact me so that I will be able to do necessary actions.
101	1	We do not provide service focus on Children. If you are under 18, you may use our website when you are with a parent or guardian.
102	1	If you are a California resident, California Civil Code Section 1798.83 provides you with the right to request certain information regarding disclosure of your Personal Information to third parties for direct marketing purposes, including a description of the categories of Personal Information disclosed. We do not share your Personal Information with third parties for their marketing purposes.
103	1	These Services do not address anyone under the age of 13. I do not knowingly collect personally identifiable information from children under 13. In the case I discover that a child under 13 has provided me with personal information, I immediately delete this from our servers. If you are a parent or guardian and you are aware that your child has provided us with personal information, please contact me so that I will be able to do necessary actions.
104	0	You can be a subject to a decision based solely on automated processing, including profiling. It means that you can receive some information or offers which are based only on automated processing of your personal information (for example, personalized advertisements). You have the right to refuse to be a subject to a decision based solely on automated processing, including profiling. In this regard, please, contact Us via e-mail, specified in this Privacy Policy.
105	0	To identify your age for data protection purposes, for example to determine the legal requirements for processing of Personal Data. We requests that anyone under the age of 18 not send any Personal Data about themselves over the Internet unless sent under the supervision of their parent or guardian. We do not knowingly collect Personal Data from children under 13 years old in the Game. We believe it is important to safeguard the privacy of children and encourage parents to regularly monitor their children’s use of online activities. If you are a parent and believe that your child under the age of 13 has accessed and/or played the Game and provided personally identifiable information to us, please contact us at privacy@leveleight.se or the mailing address at the end of this Privacy Policy and we will work to delete that account and any such personally identifiable information. This in compliance with Article 6(1)(c) of the GDPR.
106	0	We may send you notifications through our mobile application. You may at any time change the settings on your mobile device. We may also collect geolocation information if you use our mobile applications. To stop this, you may change the settings on your mobile device.
107	0	MoPub (Twitter inc.) https://www.mopub.com/legal/privacy/
108	0	If you have questions about or need further information concerning the legal basis on which we collect and use your personal information, please contact us in-game or at:Cookies and similar tracking technology
109	1	In order to protect the privacy interests of younger Internet users, we do not allow children under the age of 18 to use our services without the consent of their parents or legal guardians. We also provide a number of provisions regarding the personally identifiable information of children. These are that a parent/guardian has the right to review the information the site has collected from their child, have their child’s PII deleted from the site and also request us to stop collecting further PII from their child in the future.
110	0	We encourage law enforcement agencies to contact us via email (legal@bigo.tv) regarding the availability of user information before serving the formal request.
111	0	  Tracking & Cookies Data
112	0	This type of service allows User Data to be utilized for advertising communication purposes displayed in the form interstitial and video advertisements on this Application, possibly based on User interests. This does not mean that all Personal Data are used for this purpose. Some of the services listed below may use Cookies to identify Users or they may use the behavioral retargeting technique, i.e. displaying ads tailored to the User’s interests and behavior, including those detected outside this Application. For more information, please check the privacy policies of the relevant services.
113	0	Contacts.  You also may grant us access to your contacts.  If you do, we may collect the name, email address, and phone number of all your individual contacts.
114	0	We have no control over and assume no responsibility for the content, privacy policies or practices of any third party sites or services.
115	1	These Services do not address anyone under the age of 13. We do not knowingly collect personally identifiable information from children under 13. In the case we discover that a child under 13 has provided us with personal information, we immediately delete this from our servers. If you are a parent or guardian and you are aware that your child has provided us with personal information, please contact us so that we will be able to do necessary actions.
116	0	You may have the right to request that we correct information that we have inaccurately stored. You may also have the right to have incomplete personal data completed, including by means of providing a supplementary statement.
117	0	You may also withdraw Your consent for Us to process Your data at any time by notifying Us in writing by contact e-mail, specified in this Privacy Policy (Chapter 1 “Contacting Nekki” of this Privacy Policy).But if You withdraw Your consent to all or certain types of processing described above We may be unable to maintain Your membership of the Games and you may no longer be able to access the Games, if it will be technically or practically impossible.
118	0	The App offers social sharing features and other integrated tools (such as the Facebook “Like” button), which let you share actions you take in the App with other media. You must be over the minimum age limit that is prescribed by the legislation in the individual jurisdictions to use any social sharing features integrated in the App. The use of such features enables the sharing of information with your friends or the public, depending on the settings you establish with the entity that provides the social sharing feature.
119	1	In September 2013, California enacted amendments to the California Online Privacy Protection Act (California Business & Professions Code §§22575-22579) which require operators of websites to disclose how they respond to “do not track” (DNT) signals from browsers used by consumers or other mechanisms that provide consumers a choice regarding the collection of personally identifiable information about the consumer’s online activities over time and across different websites or online services. While some newer browsers have incorporated “Do Not Track” features which, when turned on, send a signal or preference to the web sites you visit indicating that you do not wish your online activity to be tracked, a DNT protocol that can be implemented across multiple devices and sites has not yet been widely adopted. Currently, our computer system does not support, and cannot act on DNT signal headers that we may receive; accordingly, the choices that we provide you concerning out collection and use of personally identifiable information will continue to operate as described in this policy.
120	1	The Services are not directed to children under 13 years of age, and imo does not knowingly collect Personally Identifiable Information from children under 13 years of age. If you learn that your child has provided us with personal information without your consent, you may delete your child’s entire account, by selecting the “Delete imo account” option in your child’s imo app settings or alert us at privacy@imo.im. If we learn that we have collected any personal information from children under 13 (and in certain jurisdictions under the age of 16), we will promptly take steps to delete such information and terminate the child’s account.
121	0	If you do not want to receive tailored in-application advertisements from third parties that relate to your interests in apps on your mobile device, you may opt-out by adjusting the ad tracking settings on your device. You can also reset the “Advertising Identifier” (like an IDFA) from your mobile device’s settings page, which will prevent continued use of existing behavioral data tied to the previous “Advertising Identifier.” In addition, depending on the platform provider (such as Apple or Google), you may be able to download apps, such as the Digital Advertising Alliance’s “AppChoices” app, that offer to provide you with control regarding the collection and use of cross-app data for tailored advertising. Like the opt-out tools mentioned above for web, these mobile opt-out tools are provided by third parties, not Green Panda Games. Green Panda Games does not control or operate these tools or the choices that advertisers and others provide through these tools.
122	0	The APP and Services work over the Internet. We may store and process your information in various locations throughout the world. Where you located in the EEA, as required by law, you hereby provide us with your express consent to transfer your data to where may be outside of EEA once you use the Software and/or Services. You may withdraw your consent at any time.
123	1	"Our Service does not address anyone under the age of 18 (""Children"")."
124	1	6.1. We do not knowingly collect or solicit personal information from anyone under 3 years old or knowingly allow such persons to register.
125	0	This Privacy Policy covers the free and paid versions of Touch VPN, including the mobile and desktop applications, as well as the Touch VPN websites. (collectively, the “Services”). The terms “AnchorFree,” “we,” “us,” and “our” include AnchorFree, Inc. and AnchorFree GmbH, and our affiliates and subsidiaries. By using the Services, you agree to the terms and conditions of this Privacy Policy. Beyond the Privacy Policy, your use of the Services is also subject to our Terms of Service.
126	0	Uber uses the information we collect to provide, personalize, maintain and improve our products and services. This includes using the information to:Create and update your account.
127	1	Lima Sky does not knowingly collect Personal Information from persons under the age of 13 without parental consent. Lima Sky requires device owners to specify their age before any Personal Information is collected. If it comes to Lima Sky’s attention that Personal Information has been collected from a person under the age of 13, Lima Sky will delete this information as quickly as possible. If you believe that Lima Sky may have Personal Information from or about a child under the age of 13, please contact Lima Sky at info@limasky.com.
128	1	For games that are not directed at children but nonetheless may appeal to them, we take additional steps to limit access to these Services based on the user’s age. For these services, when a user indicates they are under 13 (or the applicable age in their territory), we will limit their access to certain features, such as social media plug-ins, chat features, and certain types of notification alerts. For underage players, we also limit Personal Data collection and sharing to only what is necessary to support the internal operations of our Services.
129	0	We use cookies to store visitors preferences, customize Web page content based on visitors browser type or other information that the visitor sends. Cookies are required to use Todoist.
130	1	We do not use the Application to knowingly solicit data from or market to children under the age of 13. If a parent or guardian becomes aware that his or her child has provided us with information without their consent, he or she should contact us at walli@shanga.co. We will delete such information from our files within a reasonable time.
131	1	California’s Shine the Light law gives California residents the right to ask companies once a year what personal information they share with third parties for those third parties' direct marketing purposes. Learn more about what is considered to be personal information under the statute.
132	0	Legal Basis for Processing Personal Data Under General Data Protection Regulation (GDPR)
133	1	Although the Service is a general audience service, the Software is not intended for children under the age of 16 or other statutory minimum age according to the applicable laws and regulations in your country (the “Minimum Age”). We do not knowingly collect, maintain, or use personal information from children under the Minimum Age, and no part of the Service is directed to children under the Minimum Age. If you learn that your child has provided us with personal information without your consent, you may alert us at msoracle2019@gmail.com. If we learn that we have collected any personal information from children under the Minimum Age, we will promptly take steps to delete such information and terminate the Service for the child.
134	0	We will try to respond to any request in a timely manner. Please note that we are within our rights to decline your request if this is clearly intended to cause AVCR or our affiliated organisations harm or prejudice, e.g. by sending frequent (unfounded) requests in a short period of time. We also reserve the right to review your request for erasure against statutory or regulatory obligations that conflict with such erasure.
135	0	You can also make changes to what data a third-party social network or platform shares with us, or stop our Services interacting with that social network or platform by adjusting your settings with that third-party provider; however, you may not be able to enjoy some social features of our Services.
136	1	To obtain this information from us, please send an email message to support@betterme.tips which includes “Request for California Privacy Information” on the subject line and your state of residence and email address in the body of your message. If you are a California resident, we will provide the requested information to you at your email address in response.
137	1	If you live in a country in the European Economic Area (EEA), the Services are provided by Telegram, which for the purposes of applicable data protection legislation is the data controller responsible for your personal data when you use our Services. However, as Telegram is located outside the EEA, we have designated one of our EEA-based group companies, Telegram UK Holdings Ltd (71-75 Shelton Street, Covent Garden, London, England, WC2H 9JQ), as a representative to whom you may direct any issues you have relating to our processing of your personal data.
138	1	Our Service does not address anyone under the age of 18 (“Children”).
139	0	If any new purposes for processing your information arise we will let you know we start to process information on that other purpose by introducing the corresponding changes to this Privacy policy.
140	0	"Microsoft might occasionally update this Privacy Statement. The ""last updated"" date at the top of the Privacy Statement is updated with every revision. We encourage you to periodically review this Privacy Statement to be informed of how Microsoft is protecting your information. If there are material changes to this statement or in how Microsoft will use your information, we will notify you either by posting a notice of such changes before they take effect or by directly sending you a notification."
141	0	The Service may also collect and gather non-personally identifiable information, such as certain profile information including country of residence and preferences. In addition, the Service may collect and store information about your and others' usage of and interaction with the Service and our websites, including usage by geographies, device and connection information, IP address, device capability, bandwidth, statistics on live streaming views, network type and traffic to and from our websites.
142	0	5.2 The data that we collect from you may be transferred to, and stored at, a destination outside the European Economic Area (EEA). It may also be processed by staff operating outside the EEA who work for us, one of our associated companies or a third party engaged by us. By submitting your personal information to us, you agree to such transfer, storing or processing. We will take all steps reasonably necessary to ensure that your personal information is treated securely at all times and in accordance with this Privacy Policy.
143	1	All of our games are made for people who are at least 13 years of age.
144	0	Some of the Services may be characterized by interaction with our Trusted Partners. Therefore, we may share some of your personal information with our Trusted Partner, which will be protected based on their privacy policies. Due to the optionality of such access, it will be preceded by your explicit consent, which you can always withdraw.
145	0	 Understand and analyze aggregate usage trends, improve the Services, and develop new products, services, features, and functionality
146	1	Please be aware of the open nature of certain social networking and other open features of the Services Trials of Heroes may make available to you. You may choose to disclose data about yourself in the course of contributing user generated content to the Services. Any data that you disclose in any of these forums, blogs, chats or the like is public information, and there is no expectation of privacy or confidentiality. Trials of Heroes is not responsible for any personal data you choose to make public in any of these forums.
