	sentiment	review
224	1	If you are a child, please ask your parent(s) or guardian(s) for permission before using or playing on the Service. If you do not get permission from your parent(s) or guardian(s), you should not use our Service. If you are a parent or guardian and have any concerns regarding the service, wish to review information collected from your child, or have that information modified or deleted, you may contact us at privacy@jamcity.com. If we become aware that a child has provided us with Personal Data, we will delete any Personal Data we have collected, unless we have a legal obligation to keep it, and terminate the child’s account and/or revert them to the underage experience, as applicable.
225	1	We do not knowingly process personal data from persons under 16 years of age. If you learn that anyone younger than 16 has provided us with personal data, please contact us at support@betterme.tips.
226	0	Your information, including Personal Data, may be transferred to — and maintained on — computers located outside of your state, province, country or other governmental jurisdiction where the data protection laws may differ than those from your jurisdiction.
227	1	We do not knowingly collect or solicit personal information from or direct or target interest based advertising to anyone under the age of 13 or knowingly allow such persons to use our Services.  If you are under 13, please do not send any information about yourself to us, including your name, address, telephone number, or email address.  No one under the age of 13 may provide any personal information.  In the event that we learn that we have collected personal information from a child under age 13, we will delete that information as quickly as possible.  If you believe that we might have any information from or about a child under the age of 13, please contact us.
228	0	In cases in which user information is demanded by effective administrative and / or judicial authorities for a survey or an investigation carried out in accordance with the procedural method.
229	1	California Civil Code Section 1798.83 permits registered Account Holders of Camsurf that are California residents to request certain information regarding our disclosure of personal information to third parties, or to change privacy settings to the extent they are available. You may opt-out of communications, or request privacy related changes by contacting us at Privacy@Camsurf.com.
230	0	By changing your device settings, you can prevent your device’s ad identifier being used for interest-based advertising, or you can reset your device’s ad identifier. Typically, you can find the ad identifier settings under “privacy” or “ads” in your device’s settings, although settings may vary from device to device.
231	1	Please be aware that not all information sharing is covered by the “Shine the Light” requirements and only information on covered sharing will be included in our response.
232	1	We do not knowingly collect or solicit personal information from anyone under 13 years old or knowingly allow such persons to register. If You are under the age of 13 years, please do not attempt to access the Games or send any information about Yourself to Us including, without limitation, Your name, address, telephone number, or email address. No person under the age of 13 may provide any personal information to Us or the Games. In the event that We learn that We have collected personal information from anyone under the age of 13, We will delete that information as soon as practicable. If You believe that We might have any information from or about a child under the age of 13, please contact Us in writing by using the e-mail specified in Chapter 1 “Contacting Nekki” of this Privacy Policy.
233	0	Enforce our Terms of Service
234	0	"Bgcupid respect the privacy of users and to develop privacy policies to protect your privacy. Privacy policy include: user case Bgcupid, we collect information, how to use this information and share this information with anyone. When you use our web site or service, or business transaction with us, we recommend that you carefully read the ""Privacy Policy."" By using our website, indicates that you have accepted the provisions of the confidentiality agreement. Bgcupid online privacy very seriously. If you have any questions about this privacy policy, please contact us."
235	0	You have the right to object to profiling;
236	1	To the extent you are a User of these Services without a registered account, such requests may be made, but Camsurf reserves discretion to determine the manner in which such requests may be handled, certain opt-out provisions that may not be available to unregistered Users may be accomplished by discontinuing use of these Services.
237	0	The Apps may contain links to and from third party Apps of our business partners, advertisers, and social media sites. If you follow a link to any of these apps or websites, please note that these apps or websites have their own privacy policies and that we do not accept any responsibility or liability for their policies. Please check the individual policies before you submit any information to those apps or websites.
238	1	Please be aware that the removal of your information or content may not be complete or comprehensive, and residual copies of such removed information or content may remain on our servers.  In addition, we are not obligated to remove any posted content or information that has been copied or reposted by a third party, that has been rendered anonymous, or that we are required to keep by law.
239	1	Topface deliberately does not collect any information about minors. We do not engage or encourage the use of our service by persons under the age of majority. If we become aware of the registration of a user under the age of majority, the statutory residence of an EU citizen and the provision of their personal data, we will take measures to remove such profile and any information about it from Topface.
240	0	Article 1 Purpose of collecting and using personal data
241	1	Under California Civil Code Sections 1798.83-1798.84, California residents are entitled to ask us for a notice identifying the categories of personal Information that we share with our affiliates and/or third parties for marketing purposes, and providing contact information for such affiliates and/or third parties. If you are a California resident and would like a copy of this notice, please submit a written request to the following address: Rooster Teeth Productions, LLC / Attn: Legal Department, 1901 E 51st St, Austin, TX 78723. We will respond to one request per California customer each year, and we do not respond to requests made by means other than as set forth above.
242	0	Please read the Terms of Service located at http://gogolive.com/terms-of-service/ before using our Services. By accepting the Terms of Services, you warrant and represent that you have read, understood and agreed to our privacy practices described in this Policy and our Terms of Service. Where we require your consent to process your personal information, we will ask for your consent to the collection, use, and disclosure of your personal information as described further below. If you disagree with anything in this Policy, you should immediately discontinue access or use of our Services.
243	1	Under the laws of the State of California (US), California Residents who have an established business relationship with us may choose to opt out of our disclosure of personal information about them to third parties for direct marketing purposes. As detailed above, our policy is not to disclose personal information collected online to a third party for direct marketing purposes without your approval. If you choose to opt-out at any time after granting approval, email privacyofficer@pikpok.com.
244	0	Units A&B, 15/F, Neich Tower, 128 Gloucester Road, Wanchai, Hong Kong.
245	1	We appreciate the need to provide extra privacy protections to users who are children. Our Services are intended for general audiences over the age of 16 years. We do not knowingly collect personal information from children under 16 years of age. In order to request the deletion of personal data, for any reason, please use the in-app support feature in our Services or contact us at the address provided below and we will take reasonable measures to promptly delete such personal data from our records.
246	0	To customize your experience
247	0	Please contact Customer Support for further inquiries.
248	1	For Users in the EEA, where we transfer your information to a third party provider that is not located in the EEA, and is not subject to an adequacy decision by the EU Commission, we will require those third party providers to enter into an agreement that provides appropriate safeguards for your information. From time to time we may also seek your consent to transfer your information to a third country outside the EEA.
249	1	Beginning May 25, 2018, the processing of personal data of users in the European Union is subject to the EU General Data Protection Regulation (“GDPR”).
250	1	We are aware of the obligation imposed on us to especially protect personal data obtained from children. Therefore, we shall not collect data from children under 16 years of age without a legal guardian’s prior consent. Each legal guardian may contact us at contact@boomhits.games.
251	0	To run our service weﾡﾯll have to use computers all over the world. This means your information might be transferred to the US, Australia, Europe and anywhere else the service is operated.
252	0	This Privacy Policy explains how your personal data is collected and processed by SayGames LLC («SayGames») when you use the Clean Road mobile application (the “App”).
253	0	We process your personal data under the following legal bases:your consent;to perform our contract with you;
254	1	This Kids Apps Privacy Policy is appointed to provide the legal guardian of a child under the age of 13 with guidance regarding our privacy policies that concern collecting, using and disclosing personal information of children under 13.
255	0	Alexadra Games takes reasonable measures to help protect information about you from loss, theft, misuse and unauthorized access, disclosure, alteration and destruction.
256	0	If you would like further information about your legal rights under applicable law or would like to exercise any of them, please contact us using the information in the “Contact Us” section below at any time. Your local laws may permit you to request that we:● Provide access to and/or a copy of certain information we hold about you;● Prevent the processing of your information for direct-marketing purposes (including any direct marketing processing based on profiling);● Update information which is out of date or incorrect;● Delete certain information which we are holding about you;● Restrict the way that we process and disclose certain of your information;● Transfer your information to a third-party provider of services;● Revoke your consent for the processing of your information.
257	0	Under EU law you have the right to lodge a complaint regarding the processing of your personal data by Medium with the dedicated Supervisory Authority of your EU member state.
258	1	We ensure that we comply with the applicable law and regulation regarding children's online privacy protection, and does not knowingly collect personal information about users directed to children under the age of thirteen (13). If you are in the EEA, our Services are not directed to children under 16 and we do not knowingly collect personal information from children under 16. If a parent or guardian becomes aware that his or her child has provided us with information without their consent, he or she should promptly contact us and we take reasonable steps to ensure that such information is deleted from our files.
259	1	Our Games and related Services are intended for general audience.  We do not knowingly collect, use or share any personally identifiable information about children without verifiable parental consent or as permitted by law.  If you are a parent and you believe your child has provided us with personal information, you can contact us and request your child’s information to be deleted from our system.
260	1	California residents have the right to request (a) information identifying any third party to whom Netmarble may have disclosed (within the previous calendar year) his/her personal information for that third party’s direct marketing purposes; and (b) a description of the categories of personal information disclosed. If you are a California resident and wish to obtain such information, please send a request email to netmarbles@igsinc.co.kr.
261	0	When you first use and activate your Mi Band or Mi Scale, the device's unique identification code and approximate geographical information may be collected.
262	0	The cases that require legal compliance with the legislations in force and international agreement that are also effective in the domestic law.
263	1	We do not knowingly collect personal information from children under 18 years of age. If you are under 18 years old, please do not provide any personal information to us.
264	1	We do not knowingly collect or solicit personal data about or direct or target interest based advertising to anyone under the age of 13 or knowingly allow such persons to use our Services.  If you are under 13, please do not send any data about yourself to us, including your name, address, telephone number, or email address.  No one under the age of 13 may provide any personal data.  If we learn that we have collected personal data about a child under age 13, we will delete that data as quickly as possible.  If you believe that we might have any data from or about a child under the age of 13, please contact us.
265	1	We do not offer our products or services for use by children. If you are under 18, you may not use the product, or provide any information to the product without involvement of a parent or a guardian. We do not knowingly collect information from, and/or about children.
266	1	"Our Services are not directed to children under 16 or other statutory minimum age according to the applicable laws and regulations in your country (the ""Minimum Age""). We do not knowingly collect PII from children under the Minimum Age. If a parent or guardian becomes aware that his or her child has provided us with information without their consent, he or she should promptly contact us and we take reasonable steps to ensure that such information is deleted from our files."
267	0	This page informs you of our policies regarding the collection, use, and disclosure of personal data when you use our Service and the choices you have associated with that data.
268	1	Like many other things in life, parents and guardians have control over how children use Canva. We donﾡﾯt want children to upload personal information and weﾡﾯll delete that information if we learn about it.
269	1	These Services do not address anyone under the age of 13. I do not knowingly collect personally identifiable information from children under 13. In the case I discover that a child under 13 has provided me with personal information, I immediately delete this from our servers. If you are a parent or guardian and you are aware that your child has provided us with personal information, please contact me so that I will be able to do necessary actions.
270	1	If you are a resident of the European Union (“EU”), United Kingdom, Lichtenstein, Norway, or Iceland, you may have additional rights under the EU General Data Protection Regulation (the “GDPR”) with respect to your Personal Data, as outlined below.
271	0	Candivore
272	0	LIKE will use commercially reasonable security measures to protect your data. For example, under certain conditions, LIKE may use the universally accepted SSL encryption system to ensure the security of information transfer.
273	0	We process and answer your requests without undue delay and in any event within one month of our receipt of the request unless a longer period is required due to the complexity of the request. In this case, our response time can be up to three months in total as permitted by Article 12 of the GDPR.
274	0	Mimo may amend, change, or update these terms and conditions. If Mimo does not obtain your specific consent for any revisions of its terms and conditions, you will be notified at least seven days prior to the effective date of the updated terms and conditions.
275	0	imo is a U.S. company and stores data in the United States. This data is subject to U.S. laws. Thus, your information may be transferred to — and maintained on — computers located outside of your state, province, country, or other governmental jurisdiction where the privacy laws may not be as protective as those in your jurisdiction. If you are located outside the United States and choose to provide information to us, imo transfers that information to the United States and processes it there. By using the Service, you understand and consent that your information may be transferred to our facilities and those third parties with whom we share it as described in this Privacy Policy. If you are from the European Union or other regions with laws governing data collection and use, please note that you are agreeing to the transfer of your information to United States and to Processing of your data globally. By providing your personal information, you consent to any transfer and Processing in accordance with this Policy.
276	1	We do not knowingly collect personal information from children under 18 years of age. If you are under 18 years old, please do not provide any personal information to us.
277	0	We take your privacy and the security of your personal information very seriously. To protect your personal information, Ubisoft maintains appropriate safeguards to ensure the security, integrity and privacy of the information you have provided. We use robust security measures to protect personal information from loss, misuse and alteration. We use industry-standard practices such as encrypted communications, physically secured rooms, firewalls and password protection systems to safeguard the confidentiality of your personal information.
278	1	Children under 13 are not allowed to use MuseScore. If you are based in the EEA you may only use MuseScore if you are over the age at which you can provide consent to data processing under the laws of your country or if verifiable parental consent for your use of MuseScore has been provided to us. If you are a parent and you learn that your child is using MuseScore and you don't want them to, please contact us.
279	1	We do not knowingly collect or store personally identifiable information from anyone under the age of 13 unless or except as permitted by law. ANY PERSON WHO VISITS ANY OF THE WEBSITES OR USES ANY OF THE MOBILE APPS REPRESENTS TO US THAT HE OR SHE IS 13 YEARS OF AGE OR OLDER AND HAS READ AND WILL ADHERE TO OUR ONLINE SAFETY AND BEST PRACTICES GUIDELINES. If we are made aware that we have received personally identifiable information from someone under 13, Mobile Apps will use reasonable efforts to remove that information from our records.
280	0	You may also limit data collection by third parties by using your mobile device settings. Please note that electing to opt-out will not stop advertising from appearing in your browser or applications. It may make the ads you see less relevant to your interests. Additionally, please not that if you use a different browser or erase cookies from your browser, or use a different mobile device, you may need to renew your opt-out choices.
281	1	Our Service does not address anyone under the age of 16 (“Children”). When we collect personal information, we do not know the age of our players. We do not knowingly collect personally identifiable information from children under 16. If you are a parent or guardian and you are aware that your Children has provided us with Personal Information, please contact us. If we become aware that we have collected Personal Information from a child under age 16 without verification of parental consent, we will take steps to remove that information from our servers.
282	0	Your information collected through the Service may be stored and processed in the Turkey or any other country in which Reports+, its Affiliates or Service Providers maintain facilities. Reports+, its Affiliates, or Service Providers may transfer information that we collect about you, including personal information across borders and from your country or jurisdiction to other countries or jurisdictions around the world.
283	0	 [@The Services may contain links to other websites/applications and other websites/applications may reference or link to our Services. These other domains and websites are not controlled by us. We encourage our users to read the privacy policies of each website and application with which they interact. We do not endorse, screen or approve, and are not responsible for the privacy practices or content of such other websites or applications. Visiting these other websites or applications is at your own risk.#Legal basis*]
284	1	We encourage parents to instruct their children about privacy and the way they use their information on the Internet. Children should never disclose their name, address or phone number, or any personal information, without their parents’ prior permission.
285	0	Do Not Track (“DNT”) is a privacy preference that users can set in certain web browsers. Please note that we do not respond to or honor DNT signals or similar mechanisms transmitted by web browsers.
286	0	If you are located in the EU/EEA, the legal bases for using your information as set out in this Privacy Policy are as follows:● Where use of your information is necessary to perform our obligations under a contract with you (for example, to comply with our Terms of Service and/or your contract to provide our services to you);● Where use of your information is necessary for our legitimate interests or the legitimate interests of others;● Where we have obtained your prior consent;● We conduct certain marketing activities on the basis of consent, and others on the basis of our legitimate interest in informing you about our services and offers.
287	0	This helps us to better understand our business, analyze our operations, maintain, improve, innovate, plan, design, and develop the App and our new products. We also use such data for statistical analysis purposes, to test and improve our offers. This enables us to better understand what features and categories of books our users like more, what categories of users use our App. As a consequence, we often decide how to improve the App based on the results obtained from this processing. For example, if we discover that users more often read book summaries from “Productivity & time management” category, we may create and introduce more of book summaries into this category.
288	0	We process personal information inside and outside of the United States. Uber transfers information of users' outside the United States on the basis of mechanisms approved under applicable laws.
289	0	This Privacy Policy applies only to the Services on which this Privacy Policy is made available by Ubisoft and not to websites, networks or platforms maintained by other companies or organizations to which we may provide links. Please note, however, that when you link to foreign sites or any other third party sites from our Services, this Privacy Policy no longer applies. Ubisoft does not control the activities on those third party services and cannot and does not guarantee the security of any personal information disclosed on those third party services.
290	1	We generally do not offer children who identify themselves as being under 13 the chat functionality or services that enable them to publicly disclose personal information (such as online forum, messenger, or e-mail)(collectively, “Communication Services”).  However, if we offer such Communication Services as part of our Game or Services to children, we will restrict the child from accessing them until we receive a verifiable consent from the child’s parent.
291	1	Canva does not knowingly collect or solicit personal information from children under the age of 13 and the Service and its content are not directed at children under the age of 13. In the event that we learn that we have collected personal information from a child under age 13 without verification of parental consent, we will delete that information as quickly as possible. If you believe that we might have any information from or about a child under 13, please contact us at community@canva.com.
292	1	These Services do not address anyone under the age of 13. We do not knowingly collect personally identifiable information from children under 13. In the case we discover that a child under 13 has provided us with personal information, we immediately delete this from our servers. If you are a parent or guardian and you are aware that your child has provided us with personal information, please contact us so that we will be able to do necessary actions.
293	0	Notwithstanding the forgoing, we may share information about you with certain third parties based on the legal basis in Articles 6(1)(b), 6(1)(c) and 6(1)(f) of the GDPR as follows
