	sentiment	review
0	1	We do not knowingly collect or solicit personal information from anyone under the age of 13 or knowingly allow such persons to use our Service. If you are under 13, please do not send any information about yourself to us, including your name, address, telephone number, or email address. No one under the age of 13 may provide any personal information. In the event that we learn that we have collected personal information from a child under age 13, we will delete that information as quickly as possible.
1	0	FancyClean is very concerned about safeguarding the confidentiality of your information. We do not collect Personal Information, and we employ administrative, physical and electronic measures designed to protect your Non-Personal Information from unauthorized access and use. Please be aware that no security measures that we take to protect your information is absolutely guaranteed to avoid unauthorized access or use of your Non-Personal Information which is impenetrable.
2	0	The data we collect depends on the context of your interactions with us, the choices you make, including your privacy settings, and the products and features you use. The data we collect can include SDK/API/JS code version, browser, Internet service provider, IP address, platform, timestamp, application identifier, application version, application distribution channel, independent device identifier, ad identifier (IDFA), Android ad master identifier, the equipment model, the terminal manufacturer, the terminal device operating system version, the session start / stop time, the location of the language, the time zone and the network state (WiFi and so on) etc.
3	1	Unless stated specifically to the contrary on the applicable Ubisoft Service, Ubisoft’s Services are intended for a general audience. Ubisoft encourages parents and guardians to spend time online with their children. We urge parents to instruct their children to never give out their real names, addresses or phone numbers, without permission, when using the Internet. We recognize a special obligation to protect personal information obtained from young children. Therefore, in order for children under 12 years old to register on any Service, we require that the child provides the email address, or other contact information, of a parent or guardian who will be contacted by Ubisoft in order to inform, confirm, modify or refuse his or her child’s registration. Ubisoft reserves the right to request written proof of the parent or guardian’s authorization at any time. Until the parent or guardian answered to Ubisoft’s email pursuant to Ubisoft’s instructions, the child’s use of the Services will be limited.
4	1	We do not provide service focus on Children. If you are under 18, you may use our website when you are with a parent or guardian.
5	1	In the case that we collect the personal information of a minor who uses our products or services with the consent of his or her parent or guardian, we will only use, share, transfer or disclose such information as permitted by laws and legislations, with the express consent of the parent or guardian, or where necessary for the protection of minors.
6	0	You may enable Uber to send you push notifications about discounts and news from Uber. You may enable/disable these notifications at any time through the Privacy Settings menu in the Uber app.
7	0	We may transfer information that we collect about you to affiliated entities, or to other third parties across borders and from your country or jurisdiction to other countries or jurisdictions around the world. Please note that these countries and jurisdictions may not have the same data protection laws as your own jurisdiction, and you consent to the transfer of information to the U.S. and the use and disclosure of information about you, including personal information, as described in this Policy.
8	0	Information We Collect Automatically; Cookies and Other Tracking Technologies
9	0	Whenever you load a page from Canva, your browser sends us info about itself and your interactions with our Service. That info gets stored on our servers.
10	0	Personal information is information that identifies you and that may be used to contact you online or offline. We collect personal information from you on a voluntary basis as described below. Our primary goals in collecting and using information is to create your account, provide Services to you, improve our Services, contact you, conduct research and create reports for internal use and for use with our partners.
11	0	In connection with the processing, we will in certain circumstances transfer your personal data to recipients in the U.S which has been declared an unsafe third country by the European Commission.
12	0	If you request, we will provide you a copy of your personal data in an electronic format.
13	0	As part of our international operations, we may transfer personal information to our affiliates (which means subsidiaries, parent companies, joint ventures, and other corporate entities under common ownership of NOVA GEIMS, OOO from time to time for our legitimate business purposes.
14	1	To obtain this information from us, please send an email message to support@get-headway.com which includes “Request for California Privacy Information” on the subject line and your state of residence and email address in the body of your message. If you are a California resident, we will provide the requested information to you at your email address in response.
15	1	With respect to such a user, we will prevent the collection and use of his/her precise geolocation data and display to him/her contextual advertising only (excluding any behavioural advertising).
16	1	Beginning May 25, 2018, the processing of personal data of users in the European Union is subject to the EU General Data Protection Regulation ('GDPR'). This section provides information as relates to EU users' rights, and Uber's responsibilities, under this regulation.
17	0	a. Personal Information. We do not store Personal Information and therefore we do not disclose your Personal Information.
18	0	We will not share any personal information that we have collected from you except for the following events:If we are required by law to disclose your information, we may share your information with law enforcement or other competent authorities and any third party, as may be required (e.g., to detect, prevent or otherwise address fraud, security, or technical issues; to respond to claims or satisfy any legal process, subpoena, or governmental request; or to protect the rights, property, or personal safety of the team’s users, its partners, or the general public);In the event the team goes through a business transition such as a merger or acquisition by another company, consolidation, change of control, reorganization, or sale of all or a portion of its assets, your information will be among the assets transferred;We may share your information with certain third parties (including, without limitation, search engines, content providers, and advertising networks and platforms) that provide various services (such as advertising, marketing, analysis, content, payment, and search) in connection with the Software and the Services. We take appropriate measures to ensure that no user can be individually identified from the disclosure of such information, and we require these third parties (i) to keep the data secured; (ii) not to use the data for any other purpose other than to provide us with Services; and (iii) to use the data solely in compliance with this Privacy Policy. If you want to delete any personal data which we have shared with the third parties, please contact us by email at: game.logo.word.guessing.puzzle@gmail.com. We would try our best to notify the third party of deleting the relative personal data, but no warranty as to the deletion is made by us.Third-Party Content.
19	1	No personal information should be submitted to NOVA GEIMS, OOO by users under the minimum legal age required in their country of residence.
20	0	If you do not submit personal information when asked by Ubisoft, your refusal may limit our ability to process your online product registration, Account creation, contest registration, purchase via our online store, or request for technical support.
21	1	If we consider that any of our Services are directed at users under the minimum legal age required in their country of residence, we can block such users from using the Services or from providing information and/or limit the collection of information from such users as more particularly described below.
22	1	You must be at least 16 years old to use the App. If you are accepting these Terms and using the App, you warrant that you state the correct age and you are 16 or more years old.
23	0	Notifications: Discounts and News
24	0	(Last updated on 20th June. 2019)
25	0	Access:  You can request more information about the Personal Data we hold about you and request a copy of such Personal Data.
26	1	The Service is not geared toward children under the age of 13 and LONG TECH NETWORK LIMITED does not knowingly collect personal information from children under the age of 13. If users are under 13, they may use and access LONG TECH NETWORK LIMITED’s game only with the involvement of a parent or guardian. If a parent believes that his or her child has submitted personal information to LONG TECH NETWORK LIMITED, he or she can contact us through e-mail listed below. If LONG TECH NETWORK LIMITED learns that a child under 13 has provided LONG TECH NETWORK LIMITED with personal information LONG TECH NETWORK LIMITED will delete such information from its files as quickly as possible. LONG TECH NETWORK LIMITED recognizes the importance of safeguarding the privacy of children and encourages parents to check and monitor their children's use of online activities regularly.
27	1	The Site is not directed to persons under 13. If you become aware that your child has provided us with Personal Data without your consent, please contact us via our website (www.singnowapp.com). We do not knowingly collect Personal Data from children under 13. If we become aware that a child under 13 has provided us with Personal Data, we take steps to remove such information and terminate the child's account.
28	0	When you use the Service, we may employ clear GIFs (also known as web beacons) which are used to anonymously track the online usage patterns of our Users. In addition, we may also use clear GIFs in HTML-based emails sent to our users to track which emails are opened and which links are clicked by recipients. This information allows for more accurate reporting and improvement of the Service.
29	1	California privacy rights. California Civil Code Section 1798.83 permits our customers who are California residents to request certain information regarding our disclosure of Personal Data to third parties for their direct marketing purposes. To make such a request, please send an email to privacy@any.do. Please note that we are only required to respond to one request per customer each year.
30	1	Our services are not intended for—and we don’t direct them to—anyone under 18. And that’s why we do not knowingly collect personal information from anyone under 18.
31	0	If you choose to use the Services or provide your information to us, your personal information may be transferred to, processed and maintained on servers or databases located outside of the country or jurisdiction where you are located. Such countries or jurisdictions may have data protection laws that are less protective than the laws of the jurisdiction in which you reside. If you do not want your information transferred to or processed or maintained outside of the country or jurisdiction where you are located, you should not use the Services.
32	0	Our Service may contain links to and from other websites and services. We are not responsible for the privacy practices or the content of any third party sites. Please check the individual privacy policy of any such websites or services before you submit any personal information to them.
33	1	We apply the following limitations to personal information collection for a user that is not of the minimum legal age required in their country of residence.
34	1	Children can be invited to take part in testing our games (playtests) with their parents' authorisation and/or their parents' physical presence being required depending on the country where the playtest is conducted.
35	1	We do not knowingly process personal data from persons under 16 years of age. If you learn that anyone younger than 16 has provided us with personal data, please contact us at support@get-headway.com.
36	1	If we deleted your profile because you violated our minimum age rule, we can save your email and IP addresses so you do not try to bypass our rules by creating a new profile.
37	0	If you have any questions or concerns with respect to any matter covered by this Privacy Policy, you may contact us by email at: game.logo.word.guessing.puzzle@gmail.com
38	1	(a) If you are located outside of the United States of America this Agreement shall be governed by and construed in accordance with the laws of Sweden, without giving effect to any principles of conflicts of law, and the parties hereby consent to the sole and exclusive jurisdiction of the courts of Sweden, with the district court of Umeå (Umeå Tingsrätt) as first venue, to resolve any disputes arising out of or relating to this Agreement.
39	1	If you have additional questions about Alexadra Games's privacy practices related to children under the applicable minimum age, please contact us at support@alexandragames.com.
40	1	If you are a parent of a child who is under 13 years of age (or under another age specified by applicable regulations) and believe your child has provided us with information, please contact us at  support@ngames.mobi  and we will delete the information from our system.
41	1	California residents under the age of 18 have the right to request removal of any content or information that he or she posted anywhere within our Services, such as public forum or message boards in our Websites or Applications.  You can make this request by contacting us at netmarbles@igsinc.co.kr.
42	0	“EEA” includes all current member states to the European Union and the European Economic Area.
43	0	10557 Berlin
44	0	Updated October 12, 2017
45	1	We do not knowingly and directly collect and store on its servers any personal information from children under the age 13 as that would be a violation of COPPA. Some information may be collected by third party providers of services (advertising networks, etc.) or certain products.
46	0	"The fact that the Service links to a website or presents a banner ad or other type of advertisement does not mean that ""Mobirix"" endorses or authorizes that third party, nor is it a representation of our affiliation with that third party."
47	0	"More details may be found by visiting the MIUI Security Centre under the ""Permissions"" section. If you have previously agreed to us using your personal data for the abovementioned purposes, you may change your mind at any time by writing or emailing us atdataprotectionSG@xiaomi.com [A1] ."
48	0	Your personal information and files are stored on Adobe’s servers and the servers of companies we hire to provide services to us.
49	1	In accordance with applicable law, obtaining consent from parents for the collection of personal information from their children, or for sending information about our products and services directly to their children
50	0	You also have the right to correct your data, have your data deleted, object how we use or share your data, and restrict how we use or share your data. You can always withdraw your consent, for example by turning off GPS location sharing in your mobile device settings.
51	1	Our App is not intended for children under the age of 18. Therefore, we do not knowingly collect or solicit any personal information from children under 18. No one under age 18 may provide any personal information to the App. If you are under 18, do not use or provide any information on this App or through any of its features. Do not provide any information about yourself, including your email address. If we learn that we have collected personal information from a child under age 18 without verification of parental consent, we will erase that information as quickly as possible. If you believe that we might have any information from or about a child under 18, please contact us.
52	1	If you are a parent or guardian of a user of our Services who is under 13, or 16 where applicable, you may contact us at any time to ask that (a) we stop collecting Personal Data from such user and (b) we delete any Personal Data already collected from such user. Please contact us at legal@aminoapps.com to request deletion of the account of an underage user. Be advised that we may ask for additional verification and documentation to confirm your identity and authorization to make this request.
53	1	Personal Data of Children:  We do not knowingly collect or solicit Personal Data from anyone under the age of 16 in the EU.  If you are under age 16 and reside in the EU, please do not attempt to register for the Services or send any Personal Data about yourself to us.  If we learn that we have collected Personal Data from an EU resident under age 16, we will delete that information as quickly as possible. If you believe that an EU resident under age 16 may have provided us Personal Data, please contact us at support@inkitt.com.
54	0	TAXI GAMES FREE reserves the right to update this policy at any time, so please re-visit this page frequently. In case of any material change, we will make reasonable efforts to post a clear notice on the service.
55	1	If you are under 15 years of age or a minor in your country of residence, please ask your legal guardian’s permission to use or access the Services. Trials of Heroes takes children’s privacy seriously, and encourages parents and/or guardians to play an active role in their children's online experience at all times. Trials of Heroes does not knowingly collect any personal information from children below the aforementioned age and if Trials of Heroes learns that Trials of Heroes has inadvertently gathered personal data from children under the aforementioned age, Trials of Heroes will take reasonable measures to promptly erase such personal data from Trials of Heroes’s records.
56	0	3.1. Basic Account Data
57	0	Cookies will expire once the user closes the browser or logs out of the browser.
58	0	We may send periodic promotional or informational emails to you. You may opt-out of such communications by following the opt-out instructions contained in the e-mail. Please note that it may take up some time for us to process opt-out requests. If you opt-out of receiving emails about recommendations or other information we think may interest you, we may still send you e-mails about your account or any Services you have requested or received from us. If you want to review, delete, or change the information we have about you, no longer want us to make active use of your information, or have additional questions, please send an email to us at the following address: privacy@bolegames.com with your request and identifying information in the body of the email, including your first name, last name, e-mail address or login name you use to access our Application and Services. We will respond to your email as soon as possible. Please note that certain records, for example those relating to payments or customer service matters, will be held for legal and accounting purposes. We may not be able to delete content posted on a public forum through the Services, if applicable. If you have previously allowed us to access your geolocation data or receive push notifications, you can stop making geolocation available to us or receiving push notifications by visiting your mobile device's settings for the relevant Application or in some cases, through the Application itself. In some instances you can also stop or limit the type of cookies you allow. Please note that you may lose some of the features and functionality of our Services and Applications because accepting cookies may be necessary to track and enhance your game play and other activities.
59	0	Aeria Canada Studio Inc. will retain your Personal Data only for as long as is necessary for the purposes set out in this Privacy Policy. We will retain and use your Personal Data to the extent necessary to comply with our legal obligations (for example, if we are required to retain your data to comply with applicable laws), resolve disputes, and enforce our legal agreements and policies.
60	1	These Services are not addressed to, regulated or governed by the laws of the respective countries for persons who are not authorized to sign legal contracts. TESTFONI Services never collect information intentionally or deliberately from underage persons/minors. We would like parents and guardians to take care of their children's online activities in order to prevent the collection of personal information from children without their parents’ consents. 
61	0	5(C) Responding to Legal Requests and Preventing Harm
62	0	Most data used for Xiaomi's products and/or services is stored in a storage system. By using column family based access control mechanism, Xiaomi employees are only allowed access to the data column families they are granted access to.
63	1	We do not knowingly collect personally identifiable information from anyone under the age of 18. If you are a parent or guardian and you are aware that your child has provided us with Personal Data, please contact us. If we become aware that we have collected Personal Data from children without verification of parental consent, we take steps to remove that information from our servers.
64	1	The Service offered by us are not intended for children under 13 or other statutory minimum age according to the applicable laws and regulations in your country (the “Minimum Age”). Anyone under the Minimum Age should not use the Service. With this in mind, we do not willingly collect personal data from children under the Minimum Age. All the same, if the collection of such data is brought to the attention of us, we will take all useful measures possible to delete the corresponding data. If you believe that we might have any information from or about a child under the Minimum Age, please contact us through the email displayed below.
65	1	We do not knowingly collect personally identifiable information from anyone under the age of 18. If you are a parent or guardian and you are aware that your Children has provided us with Personal Data, please contact us. If we become aware that we have collected Personal Data from children without verification of parental consent, we take steps to remove that information from our servers.
66	1	We recognize the need to provide further privacy protections with respect to personal information we may collect from children on our Sites and Games. Some of the features on our Sites and Games are age-gated so that they are not available for use by children, and we do not knowingly collect personal information from children in connection with those features.
67	0	Under this legal basis we:• Provide our Service (in accordance with our Terms and Conditions of Use)• Customize your experience• Manage your account and provide you with customer supportfor our (or others') legitimate interests, unless those interests are overridden by your interests or fundamental rights and freedoms that require protection of personal data;
68	0	What information is collected and how do we use it?
69	1	6. Privacy Policy Concerning Children
70	0	Information you provide us
71	1	For more information on how to protect children online, please visit this link.
72	0	"We also may share your information as well as information from tools like cookies, log files, and device identifiers and location data, with third-party organizations that help us provide the Service to you (""Service Providers""). Our Service Providers will be given access to your information as is reasonably necessary to provide the Service under reasonable confidentiality terms."
73	0	In selecting our trusted third party service providers, they understand that we are passing on our standards for data protection to them, and we seek assurances that any data they handle or store is in accordance with this Privacy Policy and the requirements of applicable privacy laws.
74	0	How Long Do We Retain Your Personal Data? We retain Personal Data about you for as long as you have an open account with us and for up to 30 days after you close your account. In some cases we retain Personal Data for longer, if doing so is necessary to comply with our legal obligations, resolve disputes or collect fees owed, or is otherwise permitted or required by applicable law, rule or regulation. Afterwards, we retain some information in a depersonalized or aggregated form but not in a way that would identify you personally.
75	1	If you are less than 13 years old, do not use Musixmatch. If you are a parent or the guardian of a person under the age of 13, please do not allow such person to use Musixmatch.
76	0	Green Panda Games (“we,” “us” or “our”) takes your privacy seriously. This Privacy policy (“Privacy policy”) explains our data protection policy and describes the types of information we may process when you use one or more of our mobile applications (the “App”, “our App”) and explains how we and some of the companies we cooperate processing that information.
77	0	Our Privacy Policy may be subject to change.
