	sentiment	review
147	1	The Service offered by us are not intended for children under 13 or other statutory minimum age according to the applicable laws and regulations in your country (the “Minimum Age”). Anyone under the Minimum Age should not use the Service. With this in mind, we do not willingly collect personal data from children under the Minimum Age. All the same, if the collection of such data is brought to the attention of us, we will take all useful measures possible to delete the corresponding data. If you believe that we might have any information from or about a child under the Minimum Age, please contact us through the email displayed below.
148	0	We have put in place reasonable technical and organizational measures designed to secure your personal information from accidental loss and from unauthorized access, use, alteration or disclosure. However, we cannot guarantee that unauthorized third parties will never be able to overcome those measures or use your personal information for improper purposes. Also please note that email and messaging systems are not considered secure, so we discourage you from sending us personal information through these mediums.
149	0	Please keep your log-in information confidential. You accept sole responsibility for your Mi Account registration and log-in information. You must inform us immediately of any behaviour in relation to actual or suspected violation of law or unauthorised use of your Mi Account. We do not accept liability for any losses incurred as a result of non-compliance with your obligations under this clause.
150	0	Our Data Protection Officer (DPO) e-mail is: dpo@nekki.com. You may contact Our DPO in order to enforce Your rights provided in Section 4 Privacy Policy or receive additional information concerning processing of Your personal data. Our DPO performs its functions on behalf of the whole Nekki Limited
151	1	As used herein, the “child” or “children” means under the age of 13, and the term “parent” includes legal guardians.
152	1	You may be required to open an Account directly with LINEKONG GROUP by completing the registration process and providing true, accurate, current and complete information about yourself. LINEKONG GROUP do not knowingly solicit any personally identifiable information from children under the age of 13. If we determine, in our sole discretion, that a person is under the age of 13, based on the information provided during the registration process, that person will not be permitted to register.
153	1	Comments or inquiries about this EU Data Protection Rights, requests to update information we have about Representatives, or requests to exercise Representatives’ rights may be sent to us by e-mail at info-eurigs@eurigs.com or call to us by phone +420 225 092 352
154	1	We consider a user to be a child if they are under the age of 13, unless more stringent regulation applies in their country of residence. In EU countries, users under the age of 16 are considered children, unless the data protection regulation of their country of residence specifies another age.
155	1	If you live in the European Union, you confirm to have reached the legally required minimum age in your country for the processing of your personal data and that you have the approval of someone with parental authority.
156	1	You must be 18 or older to use our Services. Minors under 18 and at least 13 years of age are only permitted to use our Services through an account owned by a parent or legal guardian with their appropriate permission and under their direct supervision. We do not knowingly collect or solicit Information from anyone under the age of 13 or knowingly allow such persons to register for the Service.
157	1	LIKE has zero tolerance to any form of child abuse or exploitation. Your data (including private messages) may be shared with law enforcement agencies if we have reasonable grounds to believe that you have engaged in child pornography, or if we are requested to do so by law enforcement agencies.
158	0	Personal Information. We do not store Personal Information and therefore we do not disclose your Personal Information.
159	0	The security of your personal information is extremely important. We take the following precautions to make sure it cannot be accessed or altered:1、Data encrypted in transit2、Data encrypted in storage3、Industry standard Internal security protocolsControl
160	1	To obtain this information from us, please send an email message to support@betterme.tips which includes “Request for California Privacy Information” on the subject line and your state of residence and email address in the body of your message. If you are a California resident, we will provide the requested information to you at your email address in response.
161	0	We are committed to protecting the privacy of all people who use our services. Being a New Zealand company, we comply with New Zealand’s Privacy Act 1993 (“Privacy Act”) and follow the privacy principles that are a part of the Privacy Act. Additionally, we seek to comply with acts from the United States of America, which are: COPPA, the United State’s Children’s Online Privacy Protection Act, and CAN-SPAM, which covers the transmission of commercial email messages with the primary purpose of advertising or promoting a product. For Individuals located in the EU, we also seek to follow the EU General Data Protection Regulation (“GDPR”). For purposes of this Privacy Policy Notice and GDPR, PikPok is the data Controller with regard to any data we collect from you, unless otherwise specified.
162	0	Stick of Titan may disclose your Personal Data in the good faith belief that such action is necessary to:To comply with a legal obligation
163	1	access the chat, leaderboard, forums, SNS (Facebook, Game Center, etc)
164	0	User Profiles and Submissions: Certain user profile information, including your name, location, and any video or image content that such user has uploaded to the Services, may be displayed to other users to facilitate user interaction within the Services or address your request for our services. Your account privacy settings may allow you to limit the other users who can see the Personal Data in your user profile and/or what information in your user profile is visible to others. Please remember that any content you upload to your public user profile, along with any Personal Data or content that you voluntarily disclose online in a manner other users can view (on discussion boards, in messages and chat areas, etc.) becomes publicly available, and can be collected and used by anyone. Your user name may also be displayed to other users if and when you send messages or comments or upload images or videos through the Services and other users can contact you through messages and comments.
165	0	Other third-party service providers. For some of our Games, we use Unity Software to develop such Games. For the data processing by Unity please see Unity’s privacy policy available at https://unity3d.com/legal/privacy-policy. For some Games, we partner with third-party development studios to develop such Games. Such third-party development studios do not have access to your personal information, they can only access aggregated data that they cannot trace back to you.
166	1	Please be aware that not all information sharing is covered by the “Shine the Light” requirements and only information on covered sharing will be included in our response.
167	0	Where Adobe Ireland transfers your personal information to the United Kingdom or a country which is not within the EEA and is not subject to an adequacy decision by the EU Commission, we rely on one or more of the following legal mechanisms: EU-U.S. Privacy Shield, Swiss-U.S. Privacy Shield, European Commission approved Standard Contractual Clauses, and your consent in certain circumstances. A copy of the relevant mechanism can be provided for your review upon request, using the contact details provided at the end of this Privacy Policy. For more information about the certification of Adobe U.S. to the EU-U.S. Privacy Shield, including the scope of our certification, please see Privacy Shield/European data transfers.
168	1	Once a user indicates that he or she is under the age of 13, we will not collect any personal information from that user except certain limited information permitted by the law.  For example, we may ask for the name and online contact information of a child user’s parent in order to provide notice and obtain a parental consent.  In addition, we may collect certain information permitted by the law to support and protect the security, integrity and operation of our Services.
169	0	On the websites and within the mobile applications of CXZH.LTD, there are many links to other companies or mobile applications, which have established cooperative relationships with us. CXZH.LTD assumes no responsibility for the privacy criteria adopted by our commercial copartners. We recommend that you read their privacy policies, which may involve different contents.
170	1	Our Services are not designed for persons under 18. We do not knowingly collect information from persons under 18, including children under 13 in particular. If we discover that a child under 13 has provided us with personal information, we will delete such information from our systems.
171	0	Mimo may change, update, suspend, make improvements to, or discontinue aspects of the services.
172	1	We do not knowingly process personal data from persons under 16 years of age. If you learn that anyone younger than 16 has provided us with personal data, please contact us at support@betterme.tips.
173	0	We care about your privacy. For a better experience, while using our Service, we may require you to provide us with certain personally identifiable information. The information that we request will be retained by us and used as described in this privacy policy.
174	1	"This Privacy Policy covers our treatment of personally identifiable information (""Personal Data"") that we gather when you are accessing or using our Services, but not to the practices of companies we don’t own or control, or people that we don’t manage. We gather various types of Personal Data from our users, as explained in more detail below, and we use this Personal Data internally in connection with our Services, including to personalize, provide, and improve our services, to allow you to set up a user account and profile, to contact you and allow other users to contact you, to fulfill your requests for certain products and services, and to analyze how you use the Services. In certain cases, we may also share some Personal Data with third parties, but only as described below."
175	1	When we collect personal information, we do not know the age of our players. If a player has a social media account and has logged into a game, we may obtain the age information from the player through that. If we learn that we have collected personal data about a child under age 13, we will delete that data as promptly as possible. 
176	0	Please read this Privacy Policy carefully to understand our policies and practices regarding your Personal Data (as defined below) and how we will treat it.
177	0	We will let you know via email and/or a prominent notice on our Service, prior to the change becoming effective and update the “effective date” at the top of this Privacy Policy.
178	1	This App is not intended for children below 7 and we do not knowingly collect data relating to such children.
179	0	Cookies and similar technologies
180	0	AppGenre built the FanGenre - Get Followers for Instagram app as a Free app. This SERVICE is provided by AppGenre at no cost and is intended for use as is.
181	0	We might use such technologies also to collect data when you interact with our partners’ services, for example in relation to commercial and advertising services.
182	1	If you are users located in the EEA , we provide you an opportunity to manage your information,  you can learn more in our Information Management Guide.
183	1	If a child states that his/her age is under 13, we will seek consent from the child’s parent before collecting personal information from the child; except we may collect and use certain information from the child for limited purposes without obtaining parental consent where permitted to do so by law. 
184	1	Users who are considered minors in their country or region of residence would need their parent and/or guardian’s consent before using the Services and providing personal information.
185	1	When we intend to collect personal information from children, we take additional steps to protect children’s privacy, including:Notifying parents about our information practices with regard to children, including the types of personal information we may collect from children, the uses to which we may put that information, and whether and with whom we may share that information
186	1	This section summarizes Uber’s grounds for processing personal information under the GDPR, and the rights of EU users as relates to Uber’s handling of personal information.
187	1	Some of our mobile applications are intended for children under the age of 13, as well as mobile applications for other target population (Other Apps).
188	1	Overmobile doesn’t intentionally collect User’s Data from children younger than 16, it doesn’t request it and doesn’t allow them to use the Applications. Persons under 16 are not allowed to provide User’s Data. If Overmobile gets to know that the information was collected from a child under 16, Overmobile shall immediately delete such information. If you think we could have obtained any information from a child or about a child under 16, please, contact us through e-mail support@overmobile.ru.
189	1	California’s Shine the Light law gives California residents the right to ask companies once a year what personal information they share with third parties for those third parties' direct marketing purposes. Learn more about what is considered to be personal information under the statute.
190	1	The Services are not addressed to people under the age of 13. This explains why we do not consciously collect personal data from subjects under the age of 13.
191	1	subscribe to newsletters
192	0	s “Legitimate interest”, BOOMHITS treats the legitimate and rational purpose of data processing, in particular, protection of the security of processed data, marketing of BOOMHITS’ Services, but most importantly, to ensure that marketing activities addressed to you are appropriate, and to conduct analyzes that will help us to combat any illicit practices.
193	1	A minor must not create his or her own user account without the consent of his or her parent or guardian. If you are a minor, we recommend that you ask your parent or guardian to read this Privacy Policy carefully, and obtain the consent of your parent or guardian before using our services or providing us with information.
194	1	Our services are not intended for—and we don’t direct them to—anyone under 13. And that’s why we do not knowingly collect personal information from anyone under 13. If we need to rely on consent as a legal basis for processing your information and your country requires consent from a parent, we may require your parent’s consent before we collect and use that information.
195	0	This Service may contain links to other sites. If you click on a third-party link, you will be directed to that site. Note that these external sites are not operated by me. Therefore, I strongly advise you to review the Privacy Policy of these websites. I have no control over and assume no responsibility for the content, privacy policies, or practices of any third-party sites or services.
196	1	We do not use the Application to knowingly solicit data from or market to children under the age of 13. If a parent or guardian becomes aware that his or her child has provided us with information without their consent, he or she should contact us at chillyroominc@gmail.com. We will delete such information from our files within a reasonable time.
197	0	We take precautions — including administrative, technical, and physical measures — to safeguard your personal information against loss, theft, and misuse, as well as against unauthorized access, disclosure, alteration, and destruction.We use firewalls, encryption technology and Network access designed to protect against fraud and identity theft; our data is only stored in centers that provide high-level security for user’s information.
198	1	If you are between 13 and 16 years old, we will not collect Your personal data without the explicit consent of a person that is the holder of parental responsibility over You. The consent of the holder of parental responsibility shall be given through the e-mail or other ways.
199	0	If there are any questions regarding this privacy policy you may contact us using the information below. We love hearing your voice. Let’s contact us and stay connected! Email address: init.dream.sp@gmail.com
200	1	2. Grounds for Processing
201	1	You must be at least 16 years old to use the App. If you are accepting these Terms and using the App, you warrant that you state the correct age and you are 16 or more years old.
202	0	Your IP address and mobile device identifiers (such as your advertising ID)
203	1	Where a parent has provided consent, a child may be able use our Services much like any other user, including some services that enable the child to publicly disclose personal information or communicate with other users of all ages. Once we have a parent’s consent, we may collect from the child the same types of personal information, and use and share that information for the same purposes, as described in this Privacy Policy.  If we make any material changes in the way we process your child's personal information, we will notify parents by email or by in-game notice to obtain verifiable parental consent for the new uses of your child's personal information.
204	0	Third Party Services. Our Services may contain third party tracking and data collection and analytics tools from our service providers, examples of which include Tenjin (https://tenjin.io), and Mopub (https://mopub.com). Such third parties may use cookies, APIs, and SDKs in our Services to enable them to collect and analyze user and device related data and information on our behalf. The third parties may have access to and collect data and information about you, such as your device identifier, geo-location information, IP address, application usage, access and session times, applications present on the device or in use at a particular time on the device, and your viewing of and interactions with advertising, for the purpose of providing their services, including, for example, enabling, providing and delivering advertising as described in further detail below.
205	0	Information that the customers allowed to be disclosed to collaborating third parties using an external services’ privacy setting
206	0	Any questions or complaints or comments about this Privacy Policy or our use of your personal information, please contact our Privacy Policy Administrator by:email at emea-email-support@ubisoft.com or,
207	0	"Cookies. Ubisoft uses cookies on the Services. A ""cookie"" is a small bit of record-keeping information that web sites often store on a user's computer. Cookies do not include people's names, e-mail addresses, or other information that is personally identifiable; they are typically used to quickly identify a user's computer and to ""remember"" things about the user's visit. Ubisoft may set cookies for your web browser as you visit our websites, use our products or visit a website where Ubisoft provides ads, content or analytics. For example, Ubisoft uses cookies to keep track of selected items in your shopping cart on our online store and to remember your Account identifier. You can disable cookies or set your browser to alert you when cookies are being sent to your computer, although this may affect your ability to shop online or to access certain features of our Services. Each browser is different, so check the ""Help"" menu of your browser to learn how to change your cookie preferences. In addition to Ubisoft using cookies on our network of websites, Ubisoft may allow certain partners to set and access their cookies on your computer. These companies use of cookies is subject to their own privacy policies, not the Ubisoft Privacy Policy. Please review them carefully. For more information about cookies, please see http://www.allaboutcookies.org. You can see the list of companies that may implement and/or access cookies on your computer, mobile or device, and how to opt-out to such cookies at https://legal.ubi.com/cookies/"
208	1	We have to protect children’s privacy and safety online which includes complying with restrictions on marketing to those under 13. Without their legal guardians’ consent, children under 13 cannot use any of our apps. In addition, they may not install, use or access these apps, or are requested to erase them from their device in case of previous installation if they or their legal guardians disagree with any term in this Privacy Policy.
209	0	Security. We have implemented appropriate technical, organizational and security measures designed to reduce the risk of accidental destruction or loss, or the unauthorized disclosure or access to such information appropriate to the nature of the information concerned. However, please note that we cannot guarantee that the information will not be exposed as a result of unauthorized penetration to our servers. As the security of information depends in part on the security of the computer, device or network you use to communicate with us and the security you use to protect your user IDs and passwords, please make sure to take appropriate measures to protect this information.
210	1	“ICBC Mobile Banking” provides financial services to overseas users, and users who use the client should be those with independent financial capacity. We do not collect information on minors who do not have independent financial capacity.
211	0	Facebook Audience Network https://www.facebook.com/about/privacy/update?ref=old_policy
212	0	We may send cookies to your web browser (not the yummy kind) to help you use Canva. If you would like to adjust your cookie settings, please consult your browser instructions.
213	1	The Services are not directed to children under 13. We do not knowingly collect personally identifiable information from anyone under 13 years of age. If we determine upon collection that a use is under this age, we will not use or maintain his/her Personal Information without the parent/guardian consent.
214	0	Imo retains the personal information we receive as described in this Privacy Policy for as long as you use our Services or as necessary to fulfill the purpose(s) for which it was collected, provide our Services, resolve disputes, establish legal defenses, conduct audits, pursue legitimate business purposes, enforce our agreements, and comply with applicable laws.
215	0	We also use the data to operate our business, which includes analyzing our performance, meeting our legal obligations, developing our workforce, and doing research.
216	0	You are advised to review this Privacy Policy periodically for any changes. Changes to this Privacy Policy are effective when they are posted on this page.
217	1	The Service is not directed to children under the age of thirteen (13) years old and we do not knowingly collect personally identifiable information from children under the age of thirteen (13) years old as part of the Service. If we become aware that we have inadvertently received personally identifiable information from a user under the age of thirteen (13) years old as part of the Service, we will delete such information from our records. If we change our practices in the future, we will obtain prior, verifiable parental consent before collecting any personally identifiable information from children under the age of thirteen (13) years old as part of the Service.
218	1	"Our Service does not address anyone under the age of 18 (""Children"")."
219	0	We retain your Personal Data as long as needed to provide services or products to you, or as required or permitted by applicable laws, such as tax and accounting laws.
220	0	Each time you use the Site, Applications or Services, the current version of the Privacy Policy will apply. Accordingly, when you use the Site, Applications or Services, you should check the date of this Privacy Policy (which appears at the top of the Privacy Policy) and review any changes since the last version. This Privacy Policy is subject to change from time to time. Unless stated otherwise, our current Privacy Policy applies to all information that we have about you. We will not materially change our policies and practices to make them less protective of customer information collected in the past without the consent of affected customers.
221	0	You shall be extra careful and not disclose your personal information to unrelated third parties, since such information may be used in different ways and against your interests, including activities such as fraud, invasion of privacy, identity theft, etc.
222	0	To provide technical assistance.
223	0	Enable or administer our business, such as for quality control, consolidated reporting, and customer service
